question,extracted_terms
C#과 C++ OpenCV java는 어떤 관계가 있나요? 객체지향 이란?,C#
"서류전형 + 코딩테스트 후 실무면접+임원면접 K텔레콤(주) 사의 빠른 소식을 받아보세요! 2 코이즈(주) 8 기업 랭킹 채용 뉴스 연봉 이직 뽐뿌 오는 날 5분 완성, 1년 간 기업정보가 무료!    제휴 대학 서비스  회사소개 이용약관 개인정보처리방침 커뮤니티가이드라인 모바일 버전 공지사항 광고 및 제휴문의 고객 문의 FAQ | | | | | | | | (주)브레인커머스 서울특별시 강남구 테헤란로 509 엔씨타워 I, 10층 | 대표   황희승, 윤신근 | 개인정보보호관리자   윤신근 사업자등록번호   120-87-92182 | 통신판매업 신고번호   제2014-서울강남-02942호 | 유료 직업소개사업 등록번호   (국내) 제2017-3220163-14-5-00046호 대표번호   1644-5641 (10:00~17:00 / 매월 마지막 금요일 09:00~13:00 / 주말 및 공휴일 휴무) | 대표이메일 : customer_service@jobplanet.co.kr ©Jobplanet. All rights reserved. 1 2 3 4 5 면접일자 2019/08 면접경로 온라인 지원",right
"MVC MVP MVVM과 같은 아키텍트 패턴 질문, 비동기 처리에 관한 질문, 프로젝트 경험 질문을 합니 다.",MVC
"진행했던 프로젝트에 대해 처음부터 종료시 까지 수행 업무 설명 진행하면서 힘들었던 점, 해당 프로젝트 중 특별히 고민을 많이 한 부분 또는 주요 알고리즘에 대한 간 단한 설명",알고리즘
코딩테스트 관련해서는 비공개 동의를 한 상태라 자세한 이야기는 할수 없으나 몇개의 문제를 주고 2-3 시간 동안 풀고 제출합니다,상태
"하루종일 약 6개?의 면접을 보는 원데이 면접이라 체력적으로나 정신적으로나 매 우 힘들다 K텔레콤(주) 사의 빠른 소식을 받아보세요! 2 코이즈(주) 8 기업 랭킹 채용 뉴스 연봉 이직 뽐뿌 오는 날 5분 완성, 1년 간 기업정보가 무료!    제휴 대학 서비스  회사소개 이용약관 개인정보처리방침 커뮤니티가이드라인 모바일 버전 공지사항 광고 및 제휴문의 고객 문의 FAQ | | | | | | | | (주)브레인커머스 서울특별시 강남구 테헤란로 509 엔씨타워 I, 10층 | 대표   황희승, 윤신근 | 개인정보보호관리자   윤신근 사업자등록번호   120-87-92182 | 통신판매업 신고번호   제2014-서울강남-02942호 | 유료 직업소개사업 등록번호   (국내) 제2017-3220163-14-5-00046호 대표번호   1644-5641 (10:00~17:00 / 매월 마지막 금요일 09:00~13:00 / 주말 및 공휴일 휴무) | 대표이메일 : customer_service@jobplanet.co.kr ©Jobplanet. All rights reserved. 4 5 6 7 8 2018/05 면접경로 공개채용",right
"리눅스 버전별 차이점, 프로젝트 진행 경험, 현재 skt 시스템에서 개선해야될점 어떻게하면 관리가 용 이할지 서술 발표시기 16일 후 ""linux 엔지니어 채용으로 상수사옥에서 면접진행 세분이 들어오셨고 개론적인 질 문이 상당히 많았습니다."" 불합격 보통 도움이 돼요 0",in
SPA앱에서 메모리를 관리하는 방법? 디버깅하는 방법? 프로젝트하면서 어려웠던 경험?,디버깅
디버깅은 어떻게 하셨나요? 퍼블릭 클라우드로 구성하지 않고 온프레미스로 구성한다면 어떻게 해야할까요?(퍼블릭 클라우드를 사용한 프로젝트가 pt에 있었음) 마지막에 직군이 몇개 있는 데 그 중에 뭘 하고 싶냐(데이터/프론트/백엔드 등등),디버깅
"이력서에 작성한 경력에 대한 자세한 질문들이 대부분이었음. - 가장 기억에남는 프로젝트에 대해서 자세히 설명하고 자신의 역할,기술,성과에 대해 - rest api에 대하여 - 동료와 트러블 있을 때 해결방안",역할
"프로젝트 때 어떤 역할을 했나? 자소서에 어떠한 점이 참신하다고 자신을 어필했는데 이게 진짜 참신하다고 생각하나? 5G 커버리지 전략 짜고, 구체적인 엔지니어링 전략 2개 도출 후 구체화하기","역할, 구체화"
"펜을 쓰지않고 문제 풀기, 손코딩등 진행하였습니다. ""흔한 공채, 그렇지만 만만하지 않은 주변 사람들"" K텔레콤(주) 사의 빠른 소식을 받아보세요! 2 코이즈(주) 8 기업 랭킹 채용 뉴스 연봉 이직 뽐뿌 오는 날 5분 완성, 1년 간 기업정보가 무료!    제휴 대학 서비스  회사소개 이용약관 개인정보처리방침 커뮤니티가이드라인 모바일 버전 공지사항 광고 및 제휴문의 고객 문의 FAQ | | | | | | | | (주)브레인커머스 서울특별시 강남구 테헤란로 509 엔씨타워 I, 10층 | 대표   황희승, 윤신근 | 개인정보보호관리자   윤신근 사업자등록번호   120-87-92182 | 통신판매업 신고번호   제2014-서울강남-02942호 | 유료 직업소개사업 등록번호   (국내) 제2017-3220163-14-5-00046호 대표번호   1644-5641 (10:00~17:00 / 매월 마지막 금요일 09:00~13:00 / 주말 및 공휴일 휴무) | 대표이메일 : customer_service@jobplanet.co.kr ©Jobplanet. All rights reserved. 11 12 13 14 15",right
"1. 네트워크 망분리 찬성/반대 2. 어떤 소프트웨어 개발론을 도입해야 하는가? 3. WAS 관련 문제 4. 네트워크 쪽 문제 5. 인생그래프(가장 어려웠던 일, 영향을 끼친 일)",소프트웨어
통신사업분야에 대한 경험을 물었으나 해당 분야는 전무하여 이 부분에 대한 답변이 제일 난해함(서류 에서 미리 걸렀으면). openstack 운영 경험 많이 물어 봄.,open
그룹 면접 1. 4:4로 나누어 자료(팀별로 다른 자료와 다른 점수표)를 제공후 협상을 진행 협상 결과에 따른 점수판 정 2. Shadow IT의 해결방안 도출 3. 주어진 자료를 보고 새로운 사업 아이템 제시 개별면접 1. 자기소개서 기반 면접 2. 알고리즘 문제 6개? 주로 정렬과 관련된 알고리즘 3. 테스트 (정보처리 기사 수준?),"알고리즘, 정렬"
"pt 내용에 관련된 기본적인 질문과 tcp/ip에 대한 간단한 질문 채용방식 PT면접 발표시기 10일 후 ""준비해온 pt 발표 후, 발표자료에 대한 질문 진행."" K텔레콤(주) 사의 빠른 소식을 받아보세요! 3 엘티삼보(주) 1 기업 랭킹 채용 뉴스 연봉 이직 뽐뿌 오는 날 5분 완성, 1년 간 기업정보가 무료!    제휴 대학 서비스  회사소개 이용약관 개인정보처리방침 커뮤니티가이드라인 모바일 버전 공지사항 광고 및 제휴문의 고객 문의 FAQ | | | | | | | | (주)브레인커머스 서울특별시 강남구 테헤란로 509 엔씨타워 I, 10층 | 대표   황희승, 윤신근 | 개인정보보호관리자   윤신근 사업자등록번호   120-87-92182 | 통신판매업 신고번호   제2014-서울강남-02942호 | 유료 직업소개사업 등록번호   (국내) 제2017-3220163-14-5-00046호 대표번호   1644-5641 (10:00~17:00 / 매월 마지막 금요일 09:00~13:00 / 주말 및 공휴일 휴무) | 대표이메일 : customer_service@jobplanet.co.kr ©Jobplanet. All rights reserved. 17 18 19 20 21",right
"팀장면접 중, '가장 최근에 마무리 지은 공부는 무엇인가?' ""을지로 T타워에서 이루어짐. 오전 8시까지 T타워에 도착. 인턴채용이었으므로 당일 오후 6시 30분즈음까지 이 루어짐. 오리엔테이션을 통해 진행될 면접 순서에 대해 전해들음. 각 조는 12명으로 이루어져있으며 조마다 진행되는 순서는 다르지만, - 팀장급 면접 - 그룹 면접 - 보고서 작성하기 - 협상 면접 - 직무별 간단한 테스트 정도로 면접이 진행됨."" K텔레콤(주) 사의 빠른 소식을 받아보세요! 2 코이즈(주) 8 기업 랭킹 채용 뉴스 연봉 이직 뽐뿌 오는 날 5분 완성, 1년 간 기업정보가 무료!    제휴 대학 서비스  회사소개 이용약관 개인정보처리방침 커뮤니티가이드라인 모바일 버전 공지사항 광고 및 제휴문의 고객 문의 FAQ | | | | | | | | (주)브레인커머스 서울특별시 강남구 테헤란로 509 엔씨타워 I, 10층 | 대표   황희승, 윤신근 | 개인정보보호관리자   윤신근 사업자등록번호   120-87-92182 | 통신판매업 신고번호   제2014-서울강남-02942호 | 유료 직업소개사업 등록번호   (국내) 제2017-3220163-14-5-00046호 대표번호   1644-5641 (10:00~17:00 / 매월 마지막 금요일 09:00~13:00 / 주말 및 공휴일 휴무) | 대표이메일 : customer_service@jobplanet.co.kr ©Jobplanet. All rights reserved. 19 20 21 22 23",right
"유니코드, 네트워크, 커널 등 심도있는 질문을 합니다 개념정도로는 택도 없더라구요 연구와 개발 중 연구하는 인력을 선호하는걸 느꼇어요",유니코드
"네트워크.데이터베이스.알고리즘 손코딩.현안토론 및 대안모색.논리서술.요금제관련질문.iot플랫폼 및 최신기술 동향에 대한 주제 채용방식 필기시험, 인/적성검사, 스킬테스트, 논술 시험, 케이스 면접, PT면접, 그룹면접, 토론면접, 개인면접 발표시기 30일 후 ""1박2일로 진행 이틀동안 열가지넘는 테스트를 진행한다. 10명이 한팀으로 진행하고 다시 5명씩 쪼개서 토론하기도 하고 합쳐서 토론하기도 한다. 주로 에스케이텔레콤 현안에 대해서 대안을 모색하는 과제가 주를 이룬다. 개인테스트도 진행하는데 전산학지식 및 손코딩이나 논리문제가 제출된다. 마지막날 개인면담을 수행하는데 주로 진행했던 프로젝트 위주로 물어본다."" 신입공채 채용 판도 뒤바꾼 SKT…”오히려 좋 아” [인터뷰] SK텔레콤 광고사업팀 김유민님, Ranker팀 김태 현님 찐친부터 가족까지 입사시키고 싶은 이 회 사, 비결은? 찐으로 ‘좋아요’ 꾸욱 누르게 만드는 SKT 구성원 리뷰 모 음.zip K텔레콤(주) 사의 빠른 소식을 받아보세요! 3 엘티삼보(주) 1 기업 랭킹 채용 뉴스 연봉 이직 뽐뿌 오는 날 5분 완성, 1년 간 기업정보가 무료!    제휴 대학 서비스",알고리즘
"자소서기반한 경험과 내가 대학에서 했던 활동과 성과기준으로 많은 질문을 받았 다 K텔레콤(주) 사의 빠른 소식을 받아보세요! 3 엘티삼보(주) 1 기업 랭킹 채용 뉴스 연봉 이직 뽐뿌 오는 날 5분 완성, 1년 간 기업정보가 무료!    제휴 대학 서비스  회사소개 이용약관 개인정보처리방침 커뮤니티가이드라인 모바일 버전 공지사항 광고 및 제휴문의 고객 문의 FAQ | | | | | | | | (주)브레인커머스 서울특별시 강남구 테헤란로 509 엔씨타워 I, 10층 | 대표   황희승, 윤신근 | 개인정보보호관리자   윤신근 사업자등록번호   120-87-92182 | 통신판매업 신고번호   제2014-서울강남-02942호 | 유료 직업소개사업 등록번호   (국내) 제2017-3220163-14-5-00046호 대표번호   1644-5641 (10:00~17:00 / 매월 마지막 금요일 09:00~13:00 / 주말 및 공휴일 휴무) | 대표이메일 : customer_service@jobplanet.co.kr ©Jobplanet. All rights reserved. 21 22 23 24 25",right
"인성면접 자기소개해봐라. 자소서면접 학교다닐때 했던 전공 프로젝트 전공면접 ""전공면접과 인성면접이 있었다. 공채로 들어가서 쉽지않았으며 1박2일동안 합숙 하면서 면접을 보았다."" K텔레콤(주) 사의 빠른 소식을 받아보세요! 2 코이즈(주) 8 기업 랭킹 채용 뉴스 연봉 이직 뽐뿌 오는 날 5분 완성, 1년 간 기업정보가 무료!    제휴 대학 서비스  회사소개 이용약관 개인정보처리방침 커뮤니티가이드라인 모바일 버전 공지사항 광고 및 제휴문의 고객 문의 FAQ | | | | | | | | (주)브레인커머스 서울특별시 강남구 테헤란로 509 엔씨타워 I, 10층 | 대표   황희승, 윤신근 | 개인정보보호관리자   윤신근 사업자등록번호   120-87-92182 | 통신판매업 신고번호   제2014-서울강남-02942호 | 유료 직업소개사업 등록번호   (국내) 제2017-3220163-14-5-00046호 대표번호   1644-5641 (10:00~17:00 / 매월 마지막 금요일 09:00~13:00 / 주말 및 공휴일 휴무) | 대표이메일 : customer_service@jobplanet.co.kr ©Jobplanet. All rights reserved. 22 23 24 25 26",right
이제까지 오면서 성취하기 가장 어려웠던 일. 왜 어려웠는지. 자신의 구체적인 역할이 무엇이었는지.,역할
"PT : 자유주제 실무면접 : 최근 5년 이내에 따로 실력개발을 위해 준비하는 것이 있는가? ""2015 상반기 인턴면접을 보았습니다. 인적성 발표 후 약 3주정도 준비 시간을 줬었습니다. 워낙 꼼꼼하고 차별화된 전형으로 유명한 회사라 준비할 것이 많았었습니다. 인턴면접임에도 불구하고 오전 9시부터 오후 6시까지 점심시간을 제외하고 휴식시 간 거의 없이 다양한 방법으로 면접이 진행됬습니다. 회사가 인재 채용에 많은 비용 과 노력을 기울인다는 것이 느껴졌습니다. 오전에는 PT면접 오후에는 팀장 실무면접과 HR면접을 진행했습니다. PT면접의 경우 관련 주제에 따라 개인이 발표내용을 작성하고 면접관님께 제출합 니다. 그 후 지원자들이 돌아가며 발표하는데 질문지를 작성해서 제출한 후 질의응 답을 하는 식으로 진행되었습니다. 점심식사 후 2대1로 실무면접을 했습니다. 철저하게 자기소개서 바탕으로 꼬리질 문이 들어오는 형식의 면접이었습니다. HR 면접의 경우 키워드를 주고 키워드 중 몇개를 골라서 SKT의 발전 방향에 대해 서술하는 논술식 면접이었습니다."" K텔레콤(주) 사의 빠른 소식을 받아보세요! 3 엘티삼보(주) 1 기업 랭킹 채용 뉴스 연봉 이직 뽐뿌 오는 날 5분 완성, 1년 간 기업정보가 무료!    제휴 대학 서비스  회사소개 이용약관 개인정보처리방침 커뮤니티가이드라인 모바일 버전 공지사항 광고 및 제휴문의 고객 문의 FAQ | | | | | | | | (주)브레인커머스 서울특별시 강남구 테헤란로 509 엔씨타워 I, 10층 | 대표   황희승, 윤신근 | 개인정보보호관리자   윤신근 사업자등록번호   120-87-92182 | 통신판매업 신고번호   제2014-서울강남-02942호 | 유료 직업소개사업 등록번호   (국내) 제2017-3220163-14-5-00046호 대표번호   1644-5641 (10:00~17:00 / 매월 마지막 금요일 09:00~13:00 / 주말 및 공휴일 휴무) | 대표이메일 : customer_service@jobplanet.co.kr ©Jobplanet. All rights reserved. 23 24 25 26 27",right
"프로젝트 경험, ios에 대한 기본 배경 지식, 참여도 등을 질문 했음",ios
"1)진행했던 프로젝트를 설명하되, 실제로 컴파일하고 실행하는 모습을 보여주십시오 2)관련경력 관련 기술이 어떠한것이 있는데 아는데로 설명바랍니다. 3)진행했던 프로젝트의 본인의 역활에 대해 설명바랍니다","컴파일, 파일"
실시간으로 과제를 지속적으로 내어줍니다. SKT 현업에서 발생할수 있는 전략적인 문제점이나 해결책 을 제시하는것입니다. 개인과제로는 농구코트에 우리나라에서 현재 쓰고있는 스마트폰으로 가득채우 면 건물 몇층높이가 나오느냐와 같은 질문이 나옵니다. 공학적으로 접근하여 임의로 길이를 잡고 계산 했던거 같습니다.,스마트폰
기본적인 알고리즘에 대해. 스레드 세이프에 대해 알고있는가. 기타 현재 직무에 대해,알고리즘
"SKT 및 지원직무 지원동기 마지막으로 하고 싶은 말 원칙과 효용 사이의 갈등 경험 공모전에서 맡은 역할 공모전 팀에서 어떤 역할을 맡았는지 공모전에서 어떤 창의성을 발휘한 것인지 해외 여행 많이 하면서 무엇을 배웠는지 외국 생활을 어떤 이유에서 시작했는지 채용방식 인/적성검사, 그룹 프로젝트, 케이스 면접, PT면접, 개인면접 발표시기 18일 후 ""개인PT면접 30분 준비, 7분 발표, Q&A, 다른 사람 발표 요약 및 역Q&A (총 면접시간 3시간) 인성면접 30분 (팀장급), 자소서 기반의 질문 위주 HR면접 70분 (HR직원이 면접관), 광고 기획안 작성 프로젝트, 5대5 경쟁피티"" 대기중 긍정적 도움이 돼요 0",역할
"당신의 최종 꿈은 무엇인가요? 솔루션 기획이 어떤 업무를 하는 곳인지 알고 있나요? 이외 자소서 기반 인성질문이었습니다. 채용방식 인/적성검사, 케이스 면접, PT면접, 그룹면접, 토론면접, 개인면접 발표시기 14일 후 ""2014년 상반기 인턴면접을 보았고, 12명정도의 인원이 5- 6명씩 팀을 이루어 진 행토론하는 토론식 그룹면접과 1대다 인성면접이 번갈아 진행되었습니다."" 불합격 보통 도움이 돼요 0",솔루션
"SKT의 신사업으로 IT솔루션과 컨설팅을 제공하고 있는데, 매출을 높이려면 어떤 부분을 보완해야 하 는가?",솔루션
국내 스마트폰 사용자의 스마트폰을 이용하여 농구장 코트 채울때 몇층까지 채울 수 있는가,스마트폰
전체적으로 직무관련 질문은 없었고 저의 PT자료에 대한 질문들뿐이었습니다. 1. 해당 프로젝트는 어떻게 진행하게 된건가요? 2. 상인들에게 솔루션을 제공했던것 2가지 말씀해주세요. 3. 실패를 통해 배운것은 무엇인지 말씀해주세요.,솔루션
"Carrier Aggregation, Multi Carrier는 이미 상용화가 되어있다. CA, MC 이외의 방법은 뭐가 있나? 포트포워딩, IP , NAT에 관한 질문이 나왔습니다. 채용방식 인/적성검사, PT면접, 개인면접 발표시기 30일 후 ""서류전형 - SKCT - 1차 면접 - 2차 면접"" 불합격 보통 도움이 돼요 0","Aggregation, at"
"역량피티 피피티 면접 제출하고 피티 면접을 진행 K텔레콤(주) 사의 빠른 소식을 받아보세요! 2 코이즈(주) 8 기업 랭킹 채용 뉴스 연봉 이직 뽐뿌 오는 날 5분 완성, 1년 간 기업정보가 무료!    제휴 대학 서비스  회사소개 이용약관 개인정보처리방침 커뮤니티가이드라인 모바일 버전 공지사항 광고 및 제휴문의 고객 문의 FAQ | | | | | | | | (주)브레인커머스 서울특별시 강남구 테헤란로 509 엔씨타워 I, 10층 | 대표   황희승, 윤신근 | 개인정보보호관리자   윤신근 사업자등록번호   120-87-92182 | 통신판매업 신고번호   제2014-서울강남-02942호 | 유료 직업소개사업 등록번호   (국내) 제2017-3220163-14-5-00046호 대표번호   1644-5641 (10:00~17:00 / 매월 마지막 금요일 09:00~13:00 / 주말 및 공휴일 휴무) | 대표이메일 : customer_service@jobplanet.co.kr ©Jobplanet. All rights reserved. 31 32 33 34 35 면접일자 2014/09 면접경로 공개채용",right
"경력사원으로서 필요한 질문들, 이전 부서,자신의 역할, 참여했던 프로젝트에서 어떤 일을 맡았고 어떤 개선을 이루었는지 그 근거는 무엇이었는지에 대해 질문이 있었고 이에대한 심층질문이 이어졌습니다. 채용방식 개인면접 발표시기 5일 후 ""온라인 이력서 제출후 다음주에 전화연락으로 면접일정을 통보받았고 본사사옥에 서 실무자와 함께 이전 실무 경험에 대한 질문을 받았습니다."" 대기중 보통 도움이 돼요 0",역할
"기술면접 중 was에 대한 장단점 설명이 있었음. Was 종류 및 기능에 대핫 사전 연구가 필요 채용방식 인/적성검사, PT면접, 그룹면접 발표시기 10일 후 ""1차 면접은 기술면접.. 주제가 주어지고 한시간동안 발표를 준비해서 면접관들 앞에서 발표진행~ 기술적인 질문이 있었으나 그다지 압박은 아님 2차는 인성면접.. 회사 생활 및 각오에 대한 소신을 밝히고 좋은 분위기로 마무리됨..."" 합격 긍정적 K텔레콤(주) 사의 빠른 소식을 받아보세요! 2 코이즈(주) 8 기업 랭킹 채용 뉴스 연봉 이직 뽐뿌 오는 날 5분 완성, 1년 간 기업정보가 무료!    제휴 대학 서비스  회사소개 이용약관 개인정보처리방침 커뮤니티가이드라인 모바일 버전 공지사항 광고 및 제휴문의 고객 문의 FAQ | | | | | | | | (주)브레인커머스 서울특별시 강남구 테헤란로 509 엔씨타워 I, 10층 | 대표   황희승, 윤신근 | 개인정보보호관리자   윤신근 사업자등록번호   120-87-92182 | 통신판매업 신고번호   제2014-서울강남-02942호 | 유료 직업소개사업 등록번호   (국내) 제2017-3220163-14-5-00046호 대표번호   1644-5641 (10:00~17:00 / 매월 마지막 금요일 09:00~13:00 / 주말 및 공휴일 휴무) | 대표이메일 : customer_service@jobplanet.co.kr ©Jobplanet. All rights reserved. 32 33 34 35 36 신고하기 도움이 돼요 1",right
"무엇을 했는가?에 대해서 디테일하게 물어봅니다. 경력 이직이 처음이라서 준비를 제대로 하지 못했던 점이 아쉽네요. 상당히 기술적인 것을 설명해줘야 할 듯 합니다. 어떤 알고리즘을 써서 개발했냐? 이런거 없냐? 라는 질문을 받았는데 그 때, 저는 내가 구현한 사항을 말하면 안될 것 같아서 세세히 말하지 않았습니다. 대충 ""이만큼 했다."" 라고만 했죠. 떨어진 이유가 여기에 있는 것 같아요. 기타 질문은 이직을 왜 하려하냐?, 제일 잘하는게 뭐냐? 라는 등등이었습니다. 제 면접 역사상 최악의 면접이었네요..ㅜㅜ 채용방식 개인면접 ""실무면접만 보고 떨어졌네요. 우선 온라인 지원 후, 전화가 왔습니다. 그리고 면접 날짜 잡고, 면접을 보러 을지로로 갔습니다. 면접의 내용은 그냥 평범했습니다. 아무래도 면접관이 개발자이지만 주로 외주개발을 많이 하기에 깊은 지식은 없었던 것 같네요. 저도 마찬가지였던 것 같구요."" 불합격 보통 도움이 돼요 5",알고리즘
"일반공채 과정, 1박2일 면접, SK 연수원에서 다양한 면접을 실시, 토론면접, 인성면접, 체험면접 K텔레콤(주) 사의 빠른 소식을 받아보세요! 3 엘티삼보(주) 1 기업 랭킹 채용 뉴스 연봉 이직 뽐뿌 오는 날 5분 완성, 1년 간 기업정보가 무료!    제휴 대학 서비스  회사소개 이용약관 개인정보처리방침 커뮤니티가이드라인 모바일 버전 공지사항 광고 및 제휴문의 고객 문의 FAQ | | | | | | | | (주)브레인커머스 서울특별시 강남구 테헤란로 509 엔씨타워 I, 10층 | 대표   황희승, 윤신근 | 개인정보보호관리자   윤신근 사업자등록번호   120-87-92182 | 통신판매업 신고번호   제2014-서울강남-02942호 | 유료 직업소개사업 등록번호   (국내) 제2017-3220163-14-5-00046호 대표번호   1644-5641 (10:00~17:00 / 매월 마지막 금요일 09:00~13:00 / 주말 및 공휴일 휴무) | 대표이메일 : customer_service@jobplanet.co.kr ©Jobplanet. All rights reserved. 34 35 36 37 38 온라인 지원",right
크게 없었고 어려운 알고리즘 문제 또한 나오지 않았음 간단한편,알고리즘
포트폴리오 위주로 질문이 이어졌고 대용량 데이터의 처리를 어떻게 했는지 성능상 이슈가 없었는지 느리지 않았는지 물어보셨습니다. 그리고 디버깅할 때 어떻게 하는지 물어보셨어요.,디버깅
"-자바 씽크로나이즈 사용하는곳 , public private protect차이 , rest api -다나와 개선점 -이전회사 관둔이유 -학점 공격","public, private, ate"
"스프링기본기술, 회사홈페이지 상태, 다나와기업정보등 같이봄 채용방식 필기시험, 스킬테스트, 그룹면접 발표시기 30일 후 ""팀마다 다를것으로 보임. 면접 전 손코딩을 봣엇음..."" 합격 보통 도움이 돼요 0",상태
대학때 진행했던 프로젝트 회사에 대한 질문 자바 알고리즘에 대한 간단한 질의,알고리즘
Spring aop 관련 질문 대학원 나오신븐과 들어가서 기술적인 부분은 저게 끝,in
"하드웨어, 소프트웨어, 모바일 지식 다나와에 대한 이해도 프로젝트 경험",소프트웨어
"Linux, Windows Server 설치 및 관리 경험 여부 커널컴파일, 웹서버 설치 경험이 있는지 ""이력서 제출 -> 면접전 시험 -> 시험결과와 함께 면접 진행 -> 합격후 OJT 1~2개 월 진행 -> 최종 합격여부 발표"" 합격 보통 도움이 돼요 1","in, 컴파일, 파일"
