question,extracted_terms
"간단한 자료구조나 알고리즘 질문, tdd란 무엇인지, 데이터베이스를 다뤄본 경험 등 기술 전반",알고리즘
"자료구조, 알고리즘, 디자인패턴 관련 질문",알고리즘
java개념 중 오버라이딩 오버로딩의 차이점을 설명하시오 가장 어려웠던 프로젝트 진행 겅험이 대해서 말하시오,오버라이딩
"알고리즘 질문 답변, 프로젝트 질문. 주로 어떤 공부를 해왔는지 등",알고리즘
최근에 읽은 책은 이직 사유 웹 프로그래밍 경험 여부 그동안 해왔던 프로젝트 관련 질문,프로그래밍
"CS 전반적인 질문, 주로 컴퓨터구조, OS, 네트워크, 데이터베이스 관련 질문 채용방식 필기시험, 그룹면접, 개인면접 발표시기 30일 후 ""면접만 1차 2차 3차로 진행됨 1차는 4대3 면접 면접관 네분과 지원자 3명의 면접 주로 실제 진행했던 프로젝트 기반으로 모든 질문이 주어짐 자기소개 조차 실제 경험 사례를 기반으로 내가 이런사람이다라고 소개 하도록 질 문이 주어짐 그 외 질문도 다 실제 경험 위주 2차는 1대 1 면접 인성면접인줄 알았는데 기술면접 이었음 CS 전반적인 지식 다 물어봄 멀티쓰레드 프로그래밍 상황에서 공유자원 관리하는 방법 전부 설명하기, OS와 컴퓨터 구조를 연결시켜 설명하기, DB정규화, 인덱스 종 류, 네크워크 OSI 7계층에 대한 이해 등에 대한 질문 3차는 1대1 인성면접 당황했던건 면접 시작하자마자 면접관님이 자기소개부터 하 심. 엄청 긍정적인 경험. 일반적인 인성면접 질문 받음"" 합격 긍정적 도움이 돼요 5",프로그래밍
"1차 면접과 2차 면접은 면접관이 달랐고 답이 확신은 안들지만 암산으로 풀 수 있는 정도의 프로그래밍 문제와 이커머스 사용 경험과 개발 분야에 대해 알고 있는 지식과 현재 개발 트렌드 등을 물어봤고, 그 외에 전에 했던 개발 경험에 대해서 물어봄. 업무 중 상황 대처에 관한 질문을 물어봄.",프로그래밍
"Backend 관련 기술 질문함. 업무에 대한야기는 없었음. 채용방식 필기시험, 인/적성검사, 그룹면접 발표시기 25일 후 ""이력서 제출후 2주 정도 소요 됨. 1차기술면접 후 합격 하면 바로 2차 인성 면접을 진행 합니다."" 대기중 보통 도움이 돼요 0",end
1차는 자료구조 알고리즘 같은 전공지식과 it 관련 경험을 중점으로 물어봄 2차는 인성,알고리즘
"1차 면접 - 자기소개, 자소서 기반 경험 및 프로젝트 질문, 그 후 꼬리물기 식으로 전공 지식에 관련된 질 문을 합니다. 제 경우 객체지향 및 디자인패턴에 관련된 질문을 많이 받았습니다. 2차 면접 - 자기소개, 자소서의 대표 프로젝트 및 경험에 대한 상세한 질문이 들어옵니다. 프로젝트에서 자신의 역할과 사용한 기술에 대해 상세하게 대답할 수 있도록 준비하는 것이 좋을 것 같습니다.",역할
"자기소개, 지원동기, 자료구조(정렬) 등",정렬
"재귀함수를 이용하는 간단한 메소드 구현과 특정 캐시알고리즘 그러나 상세조건없이 편한 언어로 자유롭게 구현하라함 채용방식 필기시험, 개인면접 발표시기 13일 후 ""온라인코딩이 아닌 아예 손코딩방식이었는데 면접관이 정말 유도리가 없었음. 손 코딩 면접의 이유가 코딩에 대한 기본기와 알고리즘이나 자료구조 해결능력을 보는 거라고 생각했는데 원하는 언어로 자유롭게 제약사항은 없다며 그냥 풀라고 했으면 서 답지가 있는지 정확히 그대로 풀지 않으니 넘어가지 않고 계속 풀게해서 설명과 코드를 통해 알고리즘 자체를 이해 했음을 설득하고 혹시 제약사항이 있냐고 물어 보았으나 알려주진않고 완벽하게 답지와 일치하길 원하는듯 했음. 그외 기술에 대한 면접은 경력이었어서 본인이 했던 부분에 대해 설명하는 부분은 무리는 없엇으나 관련기술도 질문에 원하는바나 조건이 상세하게 말해주지 않고 뭉 뚱그려서 이 답지에 적힌걸 맞춰봐라 식이어서 좀 난감했었음"" 대기중 부정적 도움이 돼요 2","함수, 메소드, 알고리즘"
"자료구조 알고리즘 DB에 대해서 질문을 많이 받았습니다 발표시기 30일 후 ""공채 기술+인성 면접으로 편안한 분위기에서 이루어져서 어려운점은 많이 없었습 니다."" 불합격 긍정적 도움이 돼요 2",알고리즘
"프로젝트 위주의 질문이 많았습니다. 알고리즘, DB이론에 대한 질문",알고리즘
왜 이베이여야하는지? 이베이가 아니라면 어느 회사를 지원하겠는가? 이유는? 좋은 소프트웨어엔지니어란?,소프트웨어
관심있었던 과목을 묻고 그에 관한 질문을 합니다. 공통적으로는 알고리즘에 관해 질문을 하는것 같습 니다. 인성 면접 분위기는 편안하고 좋았습니다.,알고리즘
"정렬알고리즘 알고있는대로 말하시오 각각의 시간복잡도가 어떻게 되는지 말하시오 학부일때 진행한 프로젝트가 어떤것이 있는지 말하시오 채용방식 필기시험, 스킬테스트, 개인면접 발표시기 30일 후 ""1차로 기술 면접을 봤는데, 문제지를 주고 풀고 그 문제지 채점 후 커트라인을 통과 한 사람에 대해서만 실무자 면접을 진행했습니다. 1대 3으로 면접을 봤었고 정렬이 나 검색 알고리즘의 원리, 시간복잡도 등을 물어봤었고 1 ~ 2 주 후에 임원면접 후 전화로 입사여부를 물어보는 방식이었습니다"" 합격 긍정적 도움이 돼요 1","정렬, 알고리즘"
"PT후 같이 들어간 지원자들끼리 피드백, 개발 경험 위주 자기소개, 정렬 알고리즘 설명, 가장 좋다고 생 각하는 코딩 방법, 입사해서 하고싶은 일들, 면접관님께 질문하고 싶은 것..","정렬, 알고리즘"
"면접 6일 전 쯤에 pt주제를 통보받아 면접 3일 전까지 pdf파일을 미리 제출해야하였습니다. pt주제 : 현재 간편결제 시장현황에 대해 분석하고 본인이 생각하는 아이디어 모델을 제안해주시기 바 랍니다. 면접 당시 받았던 질문은 자기소개하기 ( 자기소개서 내용에 빗대었던 물품을 다시 한번 언급할 것 ) 지원하게 된 계기 가장 자신있는 언어 등이 있었습니다. 분위기는 생각만큼 딱딱하지 않았습니다. 채용방식 PT면접, 그룹면접 발표시기 6일 후 ""하계인턴에 지원하였으며 5월 말 서류 합격 후 6월 초에 1차 면접을 본 후 합격 메 일을 6일 후에 받아 6월 중순 2차 면접을 보아야 하는 상황입니다."" 대기중 부정적 도움이 돼요 0",파일
"db에 대해서 이론적인 질문을 많이받음 실무적인 경험에 대한 질문이 적음 채용방식 PT면접, 개인면접, 기타 발표시기 ""면접 자체는 평이한편 1차 2차면접이 존재함"" 라이언앤코(주) [경력] Java Web 개발자 모집 [주4일 출 근제 도입] 3 ~ 5년, java, Spring, aws, jquery, MYSQL, DB, was, 파…  111퍼센트(주) [111퍼센트] 1인 개발자 모집 경력무관, Unity, 유니티 합격보상 100만원  (주)코드박 [200억 웨어 엔 3 ~ 10년, 액 3000억원 이상 모트렉스(주) 포지션 30개 채용 중 2 코이즈(주) - 기업 랭킹 채용 뉴스 연봉 이직 뽐뿌 오는 날 5분 완성, 1년 간 기업정보가 무료!    제휴 대학 서비스","Java, in"
Quicksort을 최적하게 만들어보라.,sort
정렬 중 자신있는 2가지를 말하세요. 해당 정렬이 걸리는 시간은? 수행했던 프로젝트 이야기를 해보세 요.,정렬
"전공지식에 대해 알고리즘,자료구조,자바에 대해 물어봄",알고리즘
"1차 기술 문제는 10진수를 2진수로 변환하는 코드 작성, 복잡한 조인 쿼리 작성, 연결리스트의 원소 교 환 알고리즘, 바이너리 이진 탐색 알고리즘작성 2차 그룹 면접 100만 건의 데이터를 가장 빠르게 정렬하고 탐색하는 알고리즘은? 3차 cto에게 10가지 질문하기(대답이 아닌 질문을 하라고 해서 엄청 당황했음)","알고리즘, 정렬"
"기술면접을 거의 준비하지못하고 가서, 기본적인 프로그래밍 언어에 대한 질문은 괜찮았으나 알고리즘 에 관힌 질문은 대답이 바로바로 생각이 나지 않았으며 저는 그때당시 안드로이드 프로젝트를 준비했던 경험을 얘기하 였지만 주력으로 생각하는 부분이 아니어서 그런지 큰 반응은 없었습니다.","프로그래밍 언어, 알고리즘"
"2차 면접때 Database 쪽 이론 질문을 받았는데 Index관련 질문이 좀 당황스러웠습니다. 채용방식 필기시험, 개인면접 발표시기 40일 후 ""Tech본부 면접은 1차 손코딩 테스트를 마친 후 1차 합격 발표를 기다립니다. 2차 면접은 실무진과 1차 시험지를 기반으로 몇가지 기술적 질문을 주고 받습니다. 그후 합격 여부가 나오면 3차 경영진(상무/부사장) 면접이 있습니다. 3차까지 완료 되면 최종 합격 발표 기다립니다."" 합격 긍정적 도움이 돼요 2",at
"임원면접에서 왜 당신을 뽑아야하는가... 채용방식 필기시험, 스킬테스트, 그룹면접, 개인면접 발표시기 7일 후 ""코딩 테스트 어렵진 않으나 시간이 짧음 직무면접 지원자3 면접관1 자료구조 소프트웨어공학 내용 질문에 인성 지원동기 등도 물어봄 임원면접 총 세 단계 1. 면접관2 지원자3 인성 위주 2. 1대1 면접 개발경험 위주 3. 1대1 면접 인성 위주"" 불합격 보통 111퍼센트(주) [111퍼센트] 1인 개발자 모집 경력무관, Unity, 유니티 합격보상 100만원  (주)코드박스 [200억 ↑투자, 두나무 계열사] 소프트 웨어 엔지니어 3 ~ 10년, python, react, graphql, typescript, Django fra…  (주)박차컴 JAVA 개 5년 이상, j 합 액 3000억원 이상 한화비전(주) 포지션 22개 채용 중 3 롯데씨브이에스71… 3 기업 랭킹 채용 뉴스 연봉 이직 뽐뿌 오는 날 5분 완성, 1년 간 기업정보가 무료!    제휴 대학 서비스  신고하기 도움이 돼요 1",소프트웨어
갑자기 알고리즘 퀴즈를 내셔서 당황했습니다.,알고리즘
"자기소개를 한번 하고 난후, 근무성실도, 끈기, 경험, 공부 등을 제외하고 다시 자기소개를 하라는 부분 에서 당황했습니다. 채용방식 필기시험, 개인면접 발표시기 5일 후 ""서류예비통과가 되면 코딩테스트를 통해 1차면접기회를 줍니다. 코딩테스트는 5문제정도로 출제되며 코드를 직접 작성하는 문제가 많았습니다. 1차 면접은 실무진과 1:3으로 진행되었으며 전공기초지식에 관해 많이 물어봤습니 다. 2차 면접은 현재 기다리고 있는 상태입니다."" 대기중 긍정적 도움이 돼요 0",상태
"인더스트리 내에서 충분히 예상가능한 주제가 나왔습니다. 채용방식 PT면접 ""메일함 열어봤다가 갑자기 합격메일 와있길래 확인했습니다. 확인날로부터 일주일 안돼 면접 봤고 분위기 좋았습니다. 한시간 가량 발표준비해서 5분동안 발표하고 면접봤습니다."" 대기중 긍정적 도움이 돼요 0",표준
"여러 공학적인 질문들이 많이 나왔습니다. 알고리즘을 활용하여 즉각적으로 문제를 풀어야하는 문제들 이 대다수였습니다. """" 회사에 대한 애정 어필이 중요 """" 불합격 정보없음 도움이 돼요 0",알고리즘
"PT면접으로, 다른 지원자의 발표를 듣고 질문을 하게 하는 등 듣는 태도도 중요하게 생각하는 듯 합니 다. ""면접은 1차 2차에 나눠서 보고 현재는 1차 면접만 진행된 상태입니다. 1차면접은 주로 역량 면접이기 때문에 산업의 현황에 대해 잘 준비해가시는게 좋습니다."" 대기중 정보없음 도움이 돼요 0",상태
"기술면접을 예상하고 갔는데 의외로 개발자로써의 자세나 생각 등을 많이 물어봤습니다 설계에 대한 질문과 더불어 정렬 바이너리 서치등에 대한 질문등이 있었고 대체로 난이도는 평이했습니다 오히려 인성에 관련된 질문들이 준비가 안되있어서 그런지 더 어렵게 느껴졌던것같습니더 채용방식 필기시험, 그룹면접 발표시기 7일 후 ""서류보내고 몇일 후에 코딩 테스트 날짜 관련 연락이왔습니다 코딩테스트는 간단 한 알고리즘 문제들이 있었습니다 평소에 준비해왔다면 충분히 다풀만한 문제였습 니다 코딩테스트 합격통보 나자마자 바로 다음날 면접 봤습니다 기술면접과 인성면 접이 합쳐진듯한 형태였습니다 현재 1차면접 합격여부 기다리는중입니다"" 대기중 긍정적 도움이 돼요 0","정렬, 알고리즘"
객체지향 프로그래밍과 스프링에 대해서 물어본다. 경력이 없는 점을 비하하듯 말하는데 신입 면접 아 닌가요?,프로그래밍
"자소서 위주 기술 질문, JDBC란 무엇인가?, 오버라이드와 오버라이딩의 차이, 타인이 보는 본인의 장 단점",오버라이딩
"이력서를 위주로 질문하고, 포트폴리오에서 역할및 사용했던 기술을 중심으로 기술면접을 봄",역할
"1.java,oracle function명 퀴즈 2.야근 거부감은 없는지 확인",function
"[면접 방식] 대면 질문 [참고 자료] 이력서, 자소서 및 경력사항, 포트폴리오 보면서 질문 진행 [주요 질문] _대학교 재학 및 졸업 이후 공백기 등에 대한 질문 (공백기가 1년 정도 있는데 그 기간동안에 무엇 했나요?) _특기 관련 질문 (특기가 특이한데 특기에 대해 상세하게 설명 좀 해 주세요.) _업무 관련 질문 (업무에 대해 본인이 가장 중요하게 생각하는 것은 무엇인가요?) ""[일정] 서류 접수 후 1주일 후 연락. [면접 횟수] 실무자 면접 1회 [시간] 2시간 면접 [장소] 회사 내 회의실에서 면접 진행 [분위기] 사내 카페 근처여서 다소 어수선한 분위기 / 긴장을 풀어주어 다소 편한하 게 면접 진행 가능 [면접관 특징] 팀장 1명과 실무자 1명이 면접 진행 / 실무자는 중간에 업무 복귀하고 팀장이 면접 이후에 회사에 대한 상세한 설명 해 줌. [면접 팁] 회사에 대해 많이 조사해 가면 좋음 / 본인 담당 업무에 대한 전문성과 지 식 기반으로 탁월하게 설명을 해야 좋은 평가를 받을 수 있는 것 같음."" BEST (주)트레드링스 Back-end 개발 상시 채용 경력무관, java, Spring, SQL, java spring 백엔드  리디(주) 백엔드 소프트웨어 엔지니어 7 ~ 12년, MYSQL, node.js, go, typescript 합격보상 100만원  (주)액션파 Back-e 4 ~ 15년, 합 액 3000억원 이상 데브시스터즈(주) 포지션 0개 채용 중 2 코이즈(주) 1 기업 랭킹 채용 뉴스 연봉 이직 뽐뿌 오는 날 5분 완성, 1년 간 기업정보가 무료!    제휴 대학 서비스","end, in, 소프트웨어"
"서류면접 이후 실기면접은 어렵지 않음 다만 임원들의 인상이 무서웠음 액 3000억원 이상 데브시스터즈(주) 포지션 0개 채용 중 2 코이즈(주) 1 기업 랭킹 채용 뉴스 연봉 이직 뽐뿌 오는 날 5분 완성, 1년 간 기업정보가 무료!    제휴 대학 서비스  회사소개 이용약관 개인정보처리방침 커뮤니티가이드라인 모바일 버전 공지사항 광고 및 제휴문의 고객 문의 FAQ | | | | | | | | (주)브레인커머스 서울특별시 강남구 테헤란로 509 엔씨타워 I, 10층 | 대표   황희승, 윤신근 | 개인정보보호관리자   윤신근 사업자등록번호   120-87-92182 | 통신판매업 신고번호   제2014-서울강남-02942호 | 유료 직업소개사업 등록번호   (국내) 제2017-3220163-14-5-00046호 대표번호   1644-5641 (10:00~17:00 / 매월 마지막 금요일 09:00~13:00 / 주말 및 공휴일 휴무) | 대표이메일 : customer_service@jobplanet.co.kr ©Jobplanet. All rights reserved. 4 5 6 7 8 면접경로 온라인 지원",right
"1. C언어, JAVA의 기술 관련 질문 2. 학교 과제 말고 수행한 프로젝트 3. JAVA로 개발할 때, 상속을 사용 여부 (단순 상속이 아닌 추상 클래스, 인터페이스로 체계적으로 상속을 사용했는지) 4. 개발할 때, 어떤 스타일로 해결하는지, 막힐 경우 어떻게 해결하는지?","상속, 추상 클래스, 클래스"
참여했던 프로젝트 주제 / 팀프로젝트 내에서 맡은 역할 / 주로 유지보수일이 많을텐데 지겹지는 않을지,역할
"필기시험 중에 엘리베이터 버튼 그리는 거 있었음. 번역기 문장 자연스럽게 수정하는 것도 있었음. 채용방식 필기시험, 그룹면접 발표시기 7일 후 ""서류 -> 필기시험 및 1차 실무진 면접 -> 2차 임원진 면접 -> 결과발표. 거의 1~2일 텀으로 면접과 결과가 나옴. 다대다 면접. 필기시험은 상식 정도. 면접 질문 쉽고, 웬만하면 거의 다 붙음."" 액 3000억원 이상 대원씨티에스(주) 포지션 0개 채용 중 2 코이즈(주) - 기업 랭킹 채용 뉴스 연봉 이직 뽐뿌 오는 날 5분 완성, 1년 간 기업정보가 무료!    제휴 대학 서비스  회사소개 이용약관 개인정보처리방침 커뮤니티가이드라인 모바일 버전 공지사항 광고 및 제휴문의 고객 문의 FAQ | | | | | | | | (주)브레인커머스 서울특별시 강남구 테헤란로 509 엔씨타워 I, 10층 | 대표   황희승, 윤신근 | 개인정보보호관리자   윤신근 사업자등록번호   120-87-92182 | 통신판매업 신고번호   제2014-서울강남-02942호 | 유료 직업소개사업 등록번호   (국내) 제2017-3220163-14-5-00046호 대표번호   1644-5641 (10:00~17:00 / 매월 마지막 금요일 09:00~13:00 / 주말 및 공휴일 휴무) | 대표이메일 : customer_service@jobplanet.co.kr ©Jobplanet. All rights reserved. 7 8 9 10 11",right
- 비전공자에게는 CS 이론 기반 질문 폭탄 (막판 질문 몰빵. Join에 대해 아는대로 설명하세요 같은 기 초적인 내용도 좀 있었다.) - 전공자에게는 프로젝트 관련 질문 위주 (이 프로젝트에서 니가 기여한 부분이 어디냐? 이런 포멧. 그 러자 그 질문 받은 지원자가 가짜 뉴스를 판별하는 프로그램을 개발했습니다! 라고 답하던데 그 말 들은 면접관은 그거를 니가 했으면 넌 구글에 가 있어야 한다고 했었다. 이후 안보이던데 떨어진 모양,in
"SQL 관련하여 기본 쿼리 질문과 C#, JAVA 의 기본 문법을 질문함",C#
1. 왜 개발을 시작했냐 2. AOP에 대해서 설명해봐라 3. MyBatis와 JPA의 차이점이 무엇이냐?,at
"어떤 공부를 했는지, Java 기본적인 기술 질문들, 회사 위치 괜찮은지",Java
join 할줄알아요? 라고 물어보는데 너무 성의없었고 물어보는 사람 책임님이였는데 그팀 참 힘들것같 았음,in
"관련 프로젝트 경험,도메인지식과 back end 아키텍쳐 설계, 팀 리딩경험",end
팀에서 어려움이 생겼을때 어떻게 행동했는지 에러를 주로 어떤식으로 해결했는지 팀간의 분위기는 어땠는지,행동
"프로젝트 무엇했는지 역할은 무엇을 맡았는지 프로젝트를 하면서 과정에 대해서 물어봤었음 발표시기 30일 후 ""편안한 분위기에서 면접 보고 역량관련 질문위주로 했습니다 편하게 보시면 될듯"" 합격 보통 도움이 돼요 0",역할
"get, post 차이 OOP에 대해 설명 HTTP에 대해 설명",get
"Javascript, Java, typeScript 등....",Java
자료구조와 정렬기법 종류에 대한 질문을 받았습니다.,정렬
1. node와 spring 차이점 2. 파일 저장 시 보안관련 3. 트랜잭션 과정,"in, 파일"
"5년&10년 후 어떤 개발자가 되고 싶은가, 자신이 지금 가진 실력으로 바로 현업에서 일하는 것이 가능 하다고 생각하는가, 현업 진행 시 어떤 역할인가",역할
"취미, 성격의 장단점 회사에서 힘든일이 있었는지, 있었다면 어떻게 극복했는지 출퇴근시간 어느정도까지 가능한지 사용하고있는 프로그램 본인의 프로그래밍 수준 합격이후 출근날짜",프로그래밍
어떤 프로젝트를 했는지. DB와 java spring 관련하여 질문,in
"어레이리스트와 링크드리스트의 차이, 트렌젝셔널에 대해 설명, SPA와 SSR의 차이에 대해서 설명",링크
"프로젝트 과제 중 본인이 맡은 역할과 관련 기술 요약 설명,",역할
"1. 서버 이중화와 고가용성, Load Balancing 에 대해 아는대로 말해보라. 2. Spring Framework 에서 annotation이 어떤 역할을 한다 생각하는가? DI란 무엇이고 Spring Framework에서 DI를 함으로써 어떤 장점을 얻을 수 있는가? 3. 기본적인 리눅스 명령어 질문 3-1) su, su - 차이점 3-2) chmod 3-3) tar 명령어 및 쉘 프로그래밍 기초 지식 3-4) curl에 대한 질문 몇가지 4. Rest Api & MSA에 대한 질문 4-1) Rest Api 에 대해 아는대로 말해보라 4-2) Rest Api를 이용하여 서로 다른 기관 혹은 서버끼리 통신할때 어떤식으로 보안을 유지할 수 있을 지 설명하라 - 잘 모르지만 ssl인증서의 serial number, 각 기관끼리의 사전에 정의된 인증방식(토큰 등)을 통해 보 안을 유지할 수 있을거라 대답 4-3) 4-2에서 ssl 인증서를 언급하였는데 SSL 인증의 원리를 알고 있는가? 5. 기본적인 쿼리 질문 5-1) 계층쿼리(connect by) 5-2) Pivot 5-3) Rank(), RowNumber() over Partiton by ~ 6. 코딩 테스트(손코딩) 6-1) 자바 스크립트 promise함수 빈칸 완성 6-2) 기초적인 jquery 문제 - 체크박스 제어, 클릭이벤트등 html보고 코딩하면 됨 6-3) 쿼리코딩 (Cube 함수): 이거 못품 ㅡㅡ;;","cin, in, at, 역할, 프로그래밍, 함수"
1. 상사가 부당한 야근을 시킨다면 어떻게 할것인가 2. 자신의 성격은 어떠한가 3. 개발자의 정년은 언제까지라고 생각하나 4. MVC패턴에 대해 설명하라,MVC
1. 이 회사에 지원한 이유 2. 무슨 직무를 하고 싶은지 3. 내부비리를 알게 되면 어떻게 행동할 것인가,행동
알고리즘을 공부한 이유는? 기존에 있는 것이 아닌 UI를 직접 제작해본 경험이 있나요? 프로젝트를 할 때 리더인지 팔로우인지?,알고리즘
팀프로젝트 관련질문 알고리즘 관련질문 스크립트 관련질문,알고리즘
"쿼리문이 어떤 순서로 동작하는지에 대한 질문 , MVC패턴이 무엇인지에 대한 질문 , 진행했던 프로젝 트와 관련해서 상세한 내용",MVC
"분위기는 꽤 딱딱했던 것 같고 합격 발표 후 채용 기간이 오래 걸렸어요. 액 3000억원 이상 씨제이올리브네트웍스(주) 포지션 49개 채용 중 3 엘티삼보(주) - 기업 랭킹 채용 뉴스 연봉 이직 뽐뿌 오는 날 5분 완성, 1년 간 기업정보가 무료!    제휴 대학 서비스  회사소개 이용약관 개인정보처리방침 커뮤니티가이드라인 모바일 버전 공지사항 광고 및 제휴문의 고객 문의 FAQ | | | | | | | | (주)브레인커머스 서울특별시 강남구 테헤란로 509 엔씨타워 I, 10층 | 대표   황희승, 윤신근 | 개인정보보호관리자   윤신근 사업자등록번호   120-87-92182 | 통신판매업 신고번호   제2014-서울강남-02942호 | 유료 직업소개사업 등록번호   (국내) 제2017-3220163-14-5-00046호 대표번호   1644-5641 (10:00~17:00 / 매월 마지막 금요일 09:00~13:00 / 주말 및 공휴일 휴무) | 대표이메일 : customer_service@jobplanet.co.kr ©Jobplanet. All rights reserved. 41 42 43 44 45",right
Cs기본 지식 위주로 질문함. 버블정렬 선택정렬에 대해 설명해봐라,정렬
1. 멀티프로세싱 환경에서 발생할 수 있는 문제를 얘기해주세요 2. back-end 관련 프로젝트를 진행한 경험이 있으면 얘기해주세요. 3. rest api 에 대해 설명해주세요.,end
"1. 더존이 어떤 회사인지, 들어가고자 하는 팀이 어떤 업무를 하는지, 회사에서 어떤 역할을 하는지 물 어봄. 2. 비전공자인데 어떤 계기로 개발일을 생각을 하게 됐는지 물어봄. 3. Mvc패턴, get/post방식 등 신입 면접 기술 관련 기초 질문을 함.","역할, get"
"자바 컬렉션 관련 질문, C#을 다루게 될 수도 있는데 괜찮느냐는 정도 채용방식 개인면접, 워크숍, 산행, 체육대회 발표시기 29일 후 합격 보통 도움이 돼요 0",C#
"따로 없고 그냥 프로그래밍 기초에 대해서 물어본듯함.... 발표시기 30일 후 ""별거 안물어봄.. 그냥 정말 기초적인 부분맘 불어본듯???"" 합격 부정적 도움이 돼요 0",프로그래밍
1. 지원동기 2. 입사후 포부 3. 팀에서 어떤 역할이었는지,역할
- OUTER JOIN의 종류와 각각의 특징 및 차이점 - C# 코딩 테스트 - 하게 될 일이 어떤 일이라고 예상하는지 아는대로 답변.,C#
