question,extracted_terms
1차 면접은 개발 실무자 3명과의 면접이었고 이력서를 기준으로 본인이 진행했던 프로젝트에 대해서 자세히 문답하는 방식으로 진행되었고 말로 대답하기 어려웠던 알고리즘 부분은 화이트보드 사용해서 설명하였음. 모바일 최적화 관련해서 했던 경험을 많이 물어보았음. 2차 면접은 1차때보다 상위직급인 것으로 보이는 면접관이 3명 들어왔으며 1차보다 더 집요하게 이력 서의 내용을 파고들어서 물어보았음. 행동 관련 질문도 몇가지 있었음. 인사팀과 간단한 인상면접을 따로 진행했음.,"알고리즘, 행동"
전반적인 프로그램의 이해 자료구조 자바클래스 api관련 Scjp및 최신기술동향,클래스
iOS 개발 경험이 있었는데 실무자분 중 한분이 ios개발자셔서 관련 질문을 많이 함. GCD를 쓰는것과 쓰레드를 쓰는 것의 차이점은?,ios
"운영체제, DB, 알고리즘, 자료구조 등 전반적인 학부 과정에 대한 내용이 출제됩니다. 채용방식 필기시험, 그룹면접, 개인면접 발표시기 14일 후 ""필기시험에서 개인별 노트북이 주어집니다. 지정된 이름의 파일에 문제가 적혀있 으며 정해진 시간 이내에 파일에 적힌 문제들을 풀어야 합니다."" 대기중 긍정적 도움이 돼요 2","알고리즘, 이름, 파일"
"알고리즘 문제, 자료구조 문제, jvm관련 질문들, 네트워크 관련 질문",알고리즘
자료구조나 알고리즘을 묻더군요 경력에 대해서는 별로 관심 없는듯,알고리즘
"라인플러스의 서비스 중 개선해야 할 사항은 무엇인지 말해보세요 발표시기 30일 후 ""기본적인 알고리즘과 자료구조에 대해 물었고 손코딩을 했습니다"" 불합격 보통 도움이 돼요 0",알고리즘
"특별히 어렵지는 않았고 자료구조나 알고리즘을 공부했다면 충분히 답할 수 있는 수준의 질문으로 나 왔으며, 특정 플랫폼에 경험이 충분히 있는것이 도움이 됩니다. ""기술면접과 임원 면접을 나눠서 진행했습니다."" 합격 긍정적 도움이 돼요 1",알고리즘
"1. 자기소개 2. 자신있는 기술 3. 게임 개발 중 자신있었던 기술 4. 영어로된 맵 리두스 알고리즘 손코딩 5. 마지막으로 하고 싶은말, 기업에 궁금한점",알고리즘
"자바,c로 알고리즘 해결방법에대해서 물어보았음.",알고리즘
자바를 주로 공부해야하며 기본적인 알고리즘 문제를 풀 수 있어야 합니다. 채용방식 필기시험 발표시기 14일 후 대기중 보통 도움이 돼요 1,알고리즘
언어는 무관한 알고리즘이나 네트워크 지식 등이 요구됩니다. 프로젝트에 대한 질문이 많습니다.,알고리즘
"개인적인 질문과 팀활동 관련 질문, 그리고 다양한 분야의 전공 질문이 있었습니다. DB, OS, 네트워크, 자료구조, Java, C++ 등등",Java
"쓰레드, data structure, 안드로이드, IOS, 수학문제...",at
"- 개발직군으로서 갖춰야 할 기초지식에 대한 깊이 있는 이해도를 확인 - 자신이 개발한 결과물에 대한 논리적이고 합리적인 질문과 대화가 이어짐 - Java 관련 질문이 주를 이룸 - 특정 플랫폼에 대한 기본 개념 및 개발 이슈 숙지 필수 - 특정 개발 패턴에 관한 설명을 요구받음 (화이트보드 이용) - 소스 튜닝, 사용하는 툴이나 자신만의 방법론에 대한 설명 - 구글이나 마소 면접에 나올법한 질문 몇가지",Java
1. post와 get 요청의 차이점 2. tcp / udp 의 차이점 3. tcp 에서 close wait이 발생하는 경우 4. 2분기마다 늘어나는 컨텐츠에 대응하기 위해서 데이터베이스를 어떻게 운영해야 좋을지 5. tcp 에서 프로세스가 종료될때 소켓버퍼의 데이터를 전송하고 난 후에 종료되도록 하는 옵션은? 6. 하나의 인스턴스가 한번만 호출되도록 하기위해서 어떻게 구현해야 할까요? ( 싱글톤 관련 ) - 일부 소스 주고 나머지 채우기 7. 자바에서 가비지 컬렉터 구동 방식 8. 문자열 리버스하는 코딩 문제 등... 9. 소프트웨어 아키텍쳐 관련 책 읽은거 있는지? 10. 디자인패턴 책 읽은거 있는지?,"get, close, 버퍼, 인스턴스, 문자열, 소프트웨어"
"대체로 프로그래밍에 필요한 기본적인 내용들이었다. 스프링에 개념에대해서도 많이 물어 보았다 채용방식 스킬테스트, 개인면접 발표시기 10일 후 ""1차 면접은 전화 면접. 2차는 프로그램 실무 면점,"" 합격 긍정적 도움이 돼요 0",프로그래밍
"이전에 했던 프로젝트에 대한 경험에 대해서 질문하셨습니다. 어떤 문제가 있었는데 지금은 어떻게 해 결하고 있나, 혹은 어떤 역할을 맡았고 어떤식으로 구현하였나 같은 질문을 주셨습니다.",역할
"콜백함수 정의 ERD 설명 동시성 문제 알고리즘 채용방식 필기시험, 개인면접 발표시기 7일 후 ""작년 공채 지원하였고 분위기는 다소 딱딱한 분위기 시험 보고 쓴 내용으로 면접 진행 일주일이내로 결과 메일로 통보"" 불합격 부정적 도움이 돼요 0",알고리즘
"주로 지금까지 진행했던 프로젝트 위주로 면접이 진행되었습니다. 어떻게 구현했는지 프로젝트 내 자 신의 역할은 무엇이었는지 등 ... 에 대해서 물어봤습니다. 채용방식 스킬테스트, 개인면접 발표시기 7일 후 불합격 보통 도움이 돼요 0",역할
"경력위주 질문과 프로그래밍 언어 깊이있는 내용에 대해 물어보네요. 채용방식 개인면접 ""헤드헌터를 통해 진행했습니다. 1차 기슬면접만 진행한 상태입니다."" 대기중 긍정적 도움이 돼요 0","프로그래밍 언어, 상태"
"1. 관심있는 과목에 대한 질문들 (왜 그 과목이 필요한지, 어떻게 생각하는지 등) 2. 자료구조, 알고리즘, 네트워크와 관련된 기본 문제 (쓰레드와 프로세스, OSI7계층, 트리와 그래프 등에 대해 물어보고 답변을 하면 그거에 대해 자세하게 또 물어보는 식) 3. 하고싶은 분야와 왜 그런지",알고리즘
"자료구조, 서버프로그래밍, 웹프로그래밍 등 전반적인 전공에 대한 이해",프로그래밍
"신입이라 그런지 기본적인 것들을 위주로 물어봄. 알고리즘/자료구조/데이터베이스/네트워크에 대해 많이 물어봄. 채용방식 개인면접 발표시기 14일 후 ""지원서 쓰고 얼마 안 있어 메일로 인터뷰 보라고 연락 옴. 인터뷰 가겠다고 확정 메 일 보내야 함. 면접 후 2주 정도 후에 합불 통보 옴."" 합격 긍정적 도움이 돼요 1",알고리즘
"병합정렬의 시간복잡도를 설명하고 보드에 직접 코딩해보세요. 채용방식 필기시험 ""자료구조. 알고리즘. 등 전산학의 기초를 이루는 질문들이었습니다."" 합격 부정적 도움이 돼요 0","정렬, 알고리즘"
"자료구조. 멀티쓰레드. TCP/UDP차이점. Android에서 dp란? ios protocol, delegate, datasource 관 련. 암복호화 알고리즘(hex, AES256 등) 채용방식 개인면접 발표시기 10일 후 ""직무경력, 자기소개서 작성 후 이메일로 면접 일정을 통보받았습니다. 복 장은 세미캐쥬얼에 분당 그린팩토리에서 면접이 이루어졌습니다. 면접자 1명에 면 접관이 3명으로 진행되었습니다."" BEST 불합격 보통 도움이 돼요 6","ios, ate, at, 알고리즘, hex"
기억에 남는 trouble shooting. 그 외에 지원한 개발 분야에 대한 심도있는 질문들.,in
"자료구조 문제입니다. 채용방식 필기시험, 개인면접, 기타 발표시기 0일 후 ""헤드헌터를 통해 1차면접까지 진행하였습니다. 안드로이드 개발자로 지원했습니다. Pre test 30분 있구요. 문제는 자료구조, 코드의 부족한부분 찾기 등 으로 구성되어 있었습니다. 면접은 3대1로 진행되었고 자료구조를 묻는 질문에 기본 용어(데드락 등)들에 대한 질문 등이 있었습니다. 면접관들은 버벅거리는 저에게 친절히 포인트를 집어주셨으며, 개인적으로는 배우 고 왔다는 느낌이 있었네요.(광탈 삘..ㅠㅠ) 정리하자면 자료구조에 관한 문제와 얼마만큼의 개발을 해보았는지를 중점적으로 물어보는 느낌이었습니다."" 대기중 긍정적 (주)쏘카 Backend Developer 3 ~ 8년, Javascript 합격보상 100만원  (주)트레드링스 Back-end 개발 상시 채용 경력무관, java, Spring, SQL, java spring 백엔드  (주)자비스 [대규모 3 ~ 20년, j 합 액 3000억원 이상 휴맥스홀딩스(주) 포지션 0개 채용 중 2 (주)오픈노트 New 기업 랭킹 채용 뉴스 연봉 이직 뽐뿌 오는 날 5분 완성, 1년 간 기업정보가 무료!    제휴 대학 서비스  신고하기 도움이 돼요 0","end, in"
"자료구조 관련 질문 다자인패턴 관련 질문 자바 상속 관련 질문 채용방식 필기시험, 개인면접 ""서류 - 1차면접 전 시험 - 1차면접(기술) - 2차면접(기술+인성) 1차면접은 대부분 기술면접이고 2차는 기술80 인성20 정도로 본거 같습니다"" 합격 긍정적 도움이 돼요 3",상속
"개인적인 질문들에 대해 깊히 물어보셔서 당황했던 기억이 있습니다. 프로그래밍 질문중에는 1~1000 까지 숫자가 무작위로 10000 개가 있는데 이에대한 평균값 가운데값(줄새웠을때 가운데) 을 알아내는 알고리즘을 설계하라는 방법이었습니다. 여러 해결책을 재시하면서 해결책들을 발전시켜나가는 그런 종류의 문제들이였습니다.(구글방식인것 ""2014 공개채용에 지원했었습니다. 네이버와는 다르게 전화면접은 진행하지 않았고 서류 통과후 필기시험 필기시험후 1차면접 다른날 인성 2차면접 방식으로 진행했습니다. 필기시험에서는 약간 생각해볼만한 여러문제들 알고리즘 문제라기 보다는 CS전반 을 이해하고 있는지에 대한 문제들이 출제 되었습니다. 1차 면접에서는 자소서 위주로 전반적인 질문과 여러 프로그래밍 질문들을 하였습 니다. 2차 면접에도 인사과분이 들어오시긴했지만 거의 프로그래밍 관련 문제였고 약간 의 인성 문제가 있었습니다. 필기시험후에 간단한 필기구를 선물로 주었고 실기시험후에도 선물을 주어서 매우 좋았습니다. 면접관분들이 편하게 분위기를 이끌어 주셔서 너무 좋았고 생각들을 편히 이어갈수 있게 만들어 주셔서 좋았습니다."" BEST 리디(주) 백엔드 소프트웨어 엔지니어 7 ~ 12년, MYSQL, node.js, go, typescript 합격보상 100만원  (주)쏘카 Backend Developer 3 ~ 8년, Javascript 합격보상 100만원  라이언앤 [경력] J 근제 도 3 ~ 5년, ja 액 3000억원 이상 한화비전(주) 포지션 22개 채용 중 2 (주)오픈노트 New 기업 랭킹 채용 뉴스 연봉 이직 뽐뿌 오는 날 5분 완성, 1년 간 기업정보가 무료!    제휴 대학 서비스","프로그래밍, 알고리즘, 소프트웨어, end"
"1. 개발 디자인 관련 문제 MVC관련 2. 안드로이드 팀 프로젝트 관련해서 질문(Intent, 3. Java와 Java Script차이 4. Linked List와 Array 차이. 등등 채용방식 필기시험, 개인면접 발표시기 7일 후 불합격 부정적 도움이 돼요 0","MVC, Java, in"
"1. 라인 게임 서버의 아키텍처를 구성한다면 어떻게 할 것인지를 화이트 보드에 그려보라고 하였습니 다. 2. 상당히 기본적이면서도 깊이 있는 질문들이 줄을 이었습니다. (예를 들어, Java Garbage Collection 에 대해서 아는 대로 설명해보시오. Java 에서 생성자를 private 으로 선언하는 경우에는 어떠한 것들이 있는가? web browser에서 사용자의 HTTP 요청이 보내질 때 부터 화면에 HTML 컨텐 츠가 표시될 때 까지의 과정을 아는대로 말해보라. 서블릿 컨테이너는 자신이 호출할 서블릿을 어떻게 찾는가? 등등)","Java, 생성자, private, ate, 컨테이너"
"대용량 트랜젝션 처리에 대한 문제 기존에 경험하지 못한 부분에 대한 질문 ""진행 절차는 매우 느립니다. 사람을 조심스럽게 뽑는 느낌이 강하고 면접은 1차 기술 면접 2차 기술 면접 3차 인성 면접입니다. 2차 기술 면접이 매우 어려웠습니다. 경력이 많으신 분들은 2차에서 어려운 것을 물어보실 겁니다. 그리고, 결과 발표도 상당히 느리네요 지원서 작성 부터 불합격 까지 2달 이상 소요된 것 같습니다."" (주)쏘카 Backend Developer 3 ~ 8년, Javascript 합격보상 100만원  111퍼센트(주) [111퍼센트] 1인 개발자 모집 경력무관, Unity, 유니티 합격보상 100만원  (주)트레드 Back-e 경력무관, j 액 3000억원 이상 (주)교원 포지션 0개 채용 중 2 (주)오픈노트 New 기업 랭킹 채용 뉴스 연봉 이직 뽐뿌 오는 날 5분 완성, 1년 간 기업정보가 무료!    제휴 대학 서비스",end
"질문중에서 테이블설계를 해보라는거에 대한 질문이 있었는데, 예상못해서 당황했던기억이 납니다. 채용방식 그룹면접 발표시기 7일 후 ""면접장은 10인용 회의실 탁자였구요 인사담당자가 친절하셨습니다. 실제 면접은 인사담당자 제외하고 3명이 신데 여자팀장(주), 과장으로보이는 실무 자(부), 개발팀 차장(질문하나도 안했음. 면접중간에 노트북같은걸루 메모를 함). 면 접스타일은 완전압박형은 아니었으나, 나름 대답한거에 대해서 또 대답하고 이런식 이였습니다. 기술적인 질문과 자신의 실제로 한 이력에대해서 물어보는 질문이 주 가 되었습니다."" 액 3000억원 이상 (주)교원 포지션 0개 채용 중 2 (주)오픈노트 New 기업 랭킹 채용 뉴스 연봉 이직 뽐뿌 오는 날 5분 완성, 1년 간 기업정보가 무료!    제휴 대학 서비스  회사소개 이용약관 개인정보처리방침 커뮤니티가이드라인 모바일 버전 공지사항 광고 및 제휴문의 고객 문의 FAQ | | | | | | | | (주)브레인커머스 서울특별시 강남구 테헤란로 509 엔씨타워 I, 10층 | 대표   황희승, 윤신근 | 개인정보보호관리자   윤신근 사업자등록번호   120-87-92182 | 통신판매업 신고번호   제2014-서울강남-02942호 | 유료 직업소개사업 등록번호   (국내) 제2017-3220163-14-5-00046호 대표번호   1644-5641 (10:00~17:00 / 매월 마지막 금요일 09:00~13:00 / 주말 및 공휴일 휴무) | 대표이메일 : customer_service@jobplanet.co.kr ©Jobplanet. All rights reserved. 60 61 62 63 64",right
"전공외 사고적인 질문에 대한 해법이 가장 어려웠네요. 이런 질문을 할지를 몰랐는데 많이 당황했습니다. ""인턴 지원했었는데, 전화면접땐 무난한 전공 관련 질문 및 프로젝트 관련 질문 받았구요, 최종 임원면접에서 여러가지 사고적인 질문에 대한 해법, 디버깅 능력, 오류색출능 력 등 평가됩니다."" 불합격 정보없음 도움이 돼요 1",디버깅
"경력채용.부서장 면담. 부서장 면담에서 굉장히 디테일하게 물어봄. (주)피매치 백엔드 엔지니어 (채용전환형 인턴) 경력무관, python, SQL, azure, PostgreSQL, rest api, 시… 합격보상 100만원  라이언앤코(주) [경력] Java Web 개발자 모집 [주4일 출 근제 도입] 3 ~ 5년, java, Spring, aws, jquery, MYSQL, DB, was, 파…  (주)박차컴 JAVA 개 5년 이상, j 합 액 3000억원 이상 (주)우아한청년들 포지션 0개 채용 중 2 (주)오픈노트 New 기업 랭킹 채용 뉴스 연봉 이직 뽐뿌 오는 날 5분 완성, 1년 간 기업정보가 무료!    제휴 대학 서비스  면접경로 온라인 지원","Java, in"
"디비같은 경우 엔진의.특징, 대용량 데이터 처리에 대한 이해도를 상세하게 물어봤음 ""면접관은 3명 각각.물어보는 분야가 다르며 질문 난이도는 단순 지식수준이 아님"" 불합격 정보없음 액 3000억원 이상 (주)우아한청년들 포지션 0개 채용 중 2 (주)오픈노트 New 기업 랭킹 채용 뉴스 연봉 이직 뽐뿌 오는 날 5분 완성, 1년 간 기업정보가 무료!    제휴 대학 서비스  회사소개 이용약관 개인정보처리방침 커뮤니티가이드라인 모바일 버전 공지사항 광고 및 제휴문의 고객 문의 FAQ | | | | | | | | (주)브레인커머스 서울특별시 강남구 테헤란로 509 엔씨타워 I, 10층 | 대표   황희승, 윤신근 | 개인정보보호관리자   윤신근 사업자등록번호   120-87-92182 | 통신판매업 신고번호   제2014-서울강남-02942호 | 유료 직업소개사업 등록번호   (국내) 제2017-3220163-14-5-00046호 대표번호   1644-5641 (10:00~17:00 / 매월 마지막 금요일 09:00~13:00 / 주말 및 공휴일 휴무) | 대표이메일 : customer_service@jobplanet.co.kr ©Jobplanet. All rights reserved. 61 62 63 64 65 신고하기 도움이 돼요 1",right
"면접 분위기는 다소 경직된 편이며, 과제에 큰 의미를 부여한듯이, 성공 가능성이나 유사 서비스에 대한 비교 등이 이어집니다. 저는 과제가 해당 회사의 관심도와 정성의 표현이라고 생각했으나, 면접관 분들 은 과제의 합리성 여부를 매우 엄격한 관점에서 평가하는듯 합니다. 그리고 과제와는 별도로 라인의 소 소한 것들에 대하여도 물어보기 때문에 이에 대한 준비도 필요합니다. 채용방식 개인면접 발표시기 7일 후 ""면접 전 과제를 부여하고 과제를 제출한 다음, 면접 당일에 과제에 대하여 설명합니 다. 그리고 일반적인 질문도 있어서 그에 대한 답변도 필요합니다."" 불합격 부정적 (주)액션파워 Back-end Engineer (경력 5년 이상) 4 ~ 15년, node.js, Docker, Kubernetes, firebase 합격보상 200만원  (주)코드박스 [200억 ↑투자, 두나무 계열사] 소프트 웨어 엔지니어 3 ~ 10년, python, react, graphql, typescript, Django fra…  (주)자비스 [대규모 3 ~ 20년, j 합 액 3000억원 이상 (주)우아한청년들 포지션 0개 채용 중 2 (주)오픈노트 New 기업 랭킹 채용 뉴스 연봉 이직 뽐뿌 오는 날 5분 완성, 1년 간 기업정보가 무료!    제휴 대학 서비스  회사소개 이용약관 개인정보처리방침 커뮤니티가이드라인 모바일 버전 공지사항 광고 및 제휴문의 고객 문의 FAQ | | | | | | | | (주)브레인커머스 서울특별시 강남구 테헤란로 509 엔씨타워 I, 10층 | 대표   황희승, 윤신근 | 개인정보보호관리자   윤신근 사업자등록번호   120-87-92182 | 통신판매업 신고번호   제2014-서울강남-02942호 | 유료 직업소개사업 등록번호   (국내) 제2017-3220163-14-5-00046호 대표번호   1644-5641 (10:00~17:00 / 매월 마지막 금요일 09:00~13:00 / 주말 및 공휴일 휴무) | 대표이메일 : customer_service@jobplanet.co.kr ©Jobplanet. All rights reserved. 61 62 63 64 65 신고하기 도움이 돼요 5","end, in, right"
백엔드 할 때 어려운 점이 무엇인지 red-black tree 가 무엇인지 logN인 알고리즘이 무엇인지,알고리즘
"공백기에 관한 질문, 이전 회사에서 어떤 업무를 맡았는지, 다양한 솔루션이 있는데(jeus, webtob 등) 어떤 솔루션을 다루면서 일하고 싶은지 여쭤봤습니다.",솔루션
"프레임워크의 기본적인 원리, 프로그래밍을 시작한 이유, 선언적 프로그래밍이란?",프로그래밍
"1. 자기소개, 2. react-query의 장단점, 3. 상태관리라이브러리는 왜 그걸 선택했나",상태
Describe yourself with 3 words,word
"CS 질문(자료구조, 포인터 개념 등) 스프링 프레임워크 사용 경험 자바스크립트 사용 경험",포인터
"입사 후 포부, 프로젝트에서 본인이 맡은 역할이 무엇인지...",역할
"조별 과제에서 어떤 롤 맡았는지, 성격에 대해, 등등 ""잡코리아에서 내 이력서 열람하고 메일로 지원링크 줘서 지원함"" 대기중 긍정적 도움이 돼요 0",링크
"비전공자였기 때문에 어떻게 학습을 했었는지, 알고리즘 공부 방법, 선택한 알고리즘 풀이의 실무에서 의 문제점등이 기억이 남습니다",알고리즘
"알고리즘 기억에 남는 것, 가장 좋아하는 과목과 그 이유 등",알고리즘
1. 내가 한 프로젝트의 알고리즘 설명 2. 미들웨어에 대해서 자세히 설명하고 실제로 사용해본 미들웨어 제품이 있는지? 3. 우리회사 아는제품이 무엇이 있는지?,알고리즘
was란? web이란? linux경험있나?,in
Java 8버전에서 변화된 사항은 무엇이 있는지 CI/CD 에 대한 설명 본인이 프로젝트를 하면서 가장 중요하게 여기는 점,Java
자기소개 / 다이나믹 프로그래밍에 대해 설명해 보아라 / 해당 기업에 지원하게 된 이유는?,프로그래밍
멀리서 오셨는데 어떻게 오셨나요? 우리회사에서 어떤일을 하고싶나요? 우리회사 소프트웨어 사용경험이 있나요?,소프트웨어
"티맥스 소프트웨어 사용 여부, 소프트웨어 설계 가능한지, 경력에 있는 프로젝트 자세히 설명",소프트웨어
"1. C나 java가 python에 비해 뒤떨어지는 추세인데, 그럼에도 불구하고 C언어를 주로 사용한 이유는? 2. 지방 근무나 외근 잦은 것 괜찮은지? 3. 프로젝트 관련. 사용 라이브러리, 템플릿, 프레임워크 등등..",템플릿
"R&D로 지원했습니다. 서류 마감하고 2일 뒤에 합격 통보를 받았고, 코딩 테스트 링크를 받았습니다. 코딩테스트는 총 3문제로 난이도는 많이 어렵지는 않고, 당락에 영향은 없는 것 같습니다. - 1차 면접 1분 자기소개 여태까지 진행한 프로젝트의 구체적인 설명 (프로젝트의 구체적인 기술들을 거의 물어보시지 않으셨습 니다.) 자사 제품에 대해서 알고있는 것 설명 (저는 자기소개에서 구체적으로 어떠한 제품에 관심이 있었고, 이러한 분야에서 일을 해보고 싶다 라는 식으로 썼는데, 면접 때 자사 제품에 이렇게 관심있게 쓴 사람이 처음이라면서 매우 좋아하셨습니다.) 1지망으로 가고 싶은 부서 말고 다른 분서를 제안하시면서 거기는 어떻겠냐고 질문 성격의 장/단점 자소서에 쓴 내용들 확인 질문 코딩테스트 난이도와 결과에 대한 질문 - 2차 면접 저는 사실 1차 면접 이후 최종 합격이라고 통보를 받았고, 2차 면접 겸 연봉 협상을 했습니다.",링크
영어발표 시스템 소프트웨어 소개,"시스템 소프트웨어, 소프트웨어"
1. 고향이 어디냐? 2. 지금 친구들 호출하면 몇 명이 와줄 것 같냐 3. 회사에 지인이있으면 부서와 이름을 말해봐라,이름
임원면접시 프로그래밍 언어의 장단점에 대한 질문 이였고 면접관과 설전이 있었지만 다행히 합격했습 니다,프로그래밍 언어
프로젝트 중 가장 어려웠던 경험. 어떻게 해결했는 지 티맥스 중 아는 솔루션과 어느 솔루션을 지원하고 싶은지,솔루션
"1)프로젝트를 진행하면서 애로사항 2)자신의 강점 3가지 3)탈락하면 앞으로 무엇을 할 것인지 채용방식 그룹면접 발표시기 30일 후 ""다대다 면접으로 시간은 1시간 약간 안되게 소요 1차,2차 면접이 진행되며 기술질문은 많이 물어보진 않음"" 합격 긍정적 (주)박차컴퍼니 JAVA 개발자 5년 이상, java, spring boot, Docker, Jenkins, Spring Dat… 합격보상 100만원  (주)코드박스 [200억 ↑투자, 두나무 계열사] 소프트 웨어 엔지니어 3 ~ 10년, python, react, graphql, typescript, Django fra…  라이언앤 [경력] J 근제 도 3 ~ 5년, ja 액 3000억원 이상 모트렉스(주) 포지션 30개 채용 중 2 엘티삼보(주) 1 기업 랭킹 채용 뉴스 연봉 이직 뽐뿌 오는 날 5분 완성, 1년 간 기업정보가 무료!    제휴 대학 서비스  신고하기 도움이 돼요 0","in, at"
컴파일러시 필요한 파일과 이후 생성되는 파일은? 리눅스로 진행한 프로젝트는? 주변 지인들이 평가하는 면접자는?,"컴파일러, 파일"
"1. 자사 제품을 사용하셨다고 했는데, 자사제품군과 타사 솔루션의 차이와 특장점에 대해 설명해주세 요. 2. 개발했던 프로젝트 경험, 주로 사용하는 언어, 성격의 장점이 회사 생활에 적용될 수 있는지 여부 3. 여태까지 해왔던 활동 중에 대외활동 대표적인 것 4. 편입/전과는 좀 더 준비해야할 사항이 많다. 왜 적성이 맞다고 생각했는지? 5. Tmax OS 사용 경험이 있는지? 6. 회사의 제품들",솔루션
운영체제 가장 기억에 남았던 지식? 트렌젝션이 뭔가? MongoDB는 어떤 이유로 선택을 하였나? IoT platform이 무엇인가?,at
