question,extracted_terms
"질문은 안하고 그냥 화상통화 시작되자마자 코딩 시험보겠다고하고서 코딩시험봄 ""서류 전형 -> 코딩 테스트 (4시간) -> 원격 인터뷰 (화상 통화)"" 액 3000억원 이상 (주)우아한청년들 포지션 0개 채용 중 2 코이즈(주) - 기업 랭킹 채용 뉴스 연봉 이직 뽐뿌 오는 날 5분 완성, 1년 간 기업정보가 무료!    제휴 대학 서비스  회사소개 이용약관 개인정보처리방침 커뮤니티가이드라인 모바일 버전 공지사항 광고 및 제휴문의 고객 문의 FAQ | | | | | | | | (주)브레인커머스 서울특별시 강남구 테헤란로 509 엔씨타워 I, 10층 | 대표   황희승, 윤신근 | 개인정보보호관리자   윤신근 사업자등록번호   120-87-92182 | 통신판매업 신고번호   제2014-서울강남-02942호 | 유료 직업소개사업 등록번호   (국내) 제2017-3220163-14-5-00046호 대표번호   1644-5641 (10:00~17:00 / 매월 마지막 금요일 09:00~13:00 / 주말 및 공휴일 휴무) | 대표이메일 : customer_service@jobplanet.co.kr ©Jobplanet. All rights reserved. 42 43 44 45 46 2019/04 면접경로 온라인 지원",right
프로젝트 진행할때 했던 역할+어려웠던 점+어떻게 해결했는지 등등,역할
CS 기초 지식 및 그간 해온 프로젝트들 설명 자료구조 알고리즘 손코딩,알고리즘
"1차 인터뷰에서는 전화 인터뷰에서 언급된 기술을 자세하게 발표한 뒤 해당 기술에 대해 궁금한 내용 을 질문함. 컴퓨터 소프트웨어와 관련된 기초적인 질문도 받음. 2차 인터뷰에서는 직무에 대한 심층적인 질문과 함께 실제로 수행이 가능한지, 회사에서 왜 채용해야 되는지에 대해 질문함. 1차 인터뷰에서 언급되었던 질문과 답변에 대해서도 다시 질문함.",소프트웨어
"서버는 트래픽 대응 어느정도해봤는지, 스프링 디펜던시, 추상클리스, 코드개선을 위해 노력하는점 문법은 hashmap 프론트는 es6, prototype,크로스브라우징,framework",map
알고리즘 질문과 자료구조 질문 was구성요소등 트러블 슈팅,알고리즘
클래스란? 객체란? 어떤 책읽엇나 최근에.,"클래스, 객체"
"사전과제에 대한 질문 -프로젝트 구조화가 잘 되어 있지 않은데 어떻게 바꿀 수 있는가? -즉시실행함수를 왜 사용했는가? -코드 컨벤션이 제각각인데 이유는? 업무 지식 질문 -이벤트 플로우를 설명해라 -preventDefault, stoppropogation 차이 -이전 회사 프로젝트에서 왜 xml 사용했나? -개발했던 프로젝트에 대해서 설명하라.","함수, at"
"HTTP 메소드 종류가 몇 가지가 있는지 설명하고 각각 어떤 역할을 하는지 설명해봐라 발표시기 30일 후 ""팀원들이 전부 참여하여 면접을 진행했고 실무 경험을 주로 질문하였으나 본인들 은 잘 모르는 내용을 질문하는것 같았음"" 불합격 보통 도움이 돼요 0","메소드, 역할"
"코딩테스트 : 해커랭크링크를 통해 4시간 동안 3문제를 풀었음. 문제는 그리 어렵지 않았습니다. 1차면접 : 한시간 동안 진행 되었고, 기존 회사의 업무 질문, 자바, 자바8, 스프링, 동료들간의 협업 관련 질문들을 하였습니다. 2차면접 : 한시간 동안 진행 되었고, - 이직사유, - 현재 개편하려는 시스템이 있는데, 이 시스템을 한다면 어떻게 접근 할것이며, 어떻게 접근 할것이냐 - 동료와의 트러블이 있을때 어떻게 하겠느냐?",링크
기본적인 알고리즘에 대한 정보부터 자기가 한일을 프로젝트 단위로 말함 경력직이기 때문에 지금까지 한일 위주에서 그 부서에 맞는 질문을 하는 것으로 보임 - 기본 자료구조 - 사용된 알고리즘&원리,알고리즘
"uint8의 자료형 범위 mysql의 스토리지 엔진 종류 자바와 c의 차이 jvm 가비지컬렉션 동작과정 대칭키와 비대칭키 차이 다음 검색에서 검색이 일어나는 과정 설명 프로세스 메모리 구조 threeway handshaking ""1차면접은 3:1 면접, 2차면접은 2:1 면접으로 진행","int, in"
코딩 - 컴공이라면 어렵지 않게 해결되는 수준. 화상 - 논문 설명 및 알고리즘 1차 - 수행한 프로젝트 및 논문에 대해 매우 자세히 질문. 2차 - 지원 분야에 대한 철학 및 인성 위주. 기술질문 조금.,알고리즘
"코테는 당황하지 않으면 많이 어렵진 않음. 영어문제에 좀 익숙해지면 좋을듯 1차 (코테, 기술면접) 둘대 1대1 방식 사전 코테서 풀었던거를 클래스화 시키기 기술면접은 언어 + 인프라 + db 관련 물어봄",클래스
"dao에 대해 설명하시오. ajax란? static에 대해 설명하시오. 본인의 성격의 장단점은? 회사에 지원하게 된 동기. 채용방식 개인면접 발표시기 7일 후 ""경력이직으로 처음으로 면접본 회사였는데, 웹개발에 대한 전반적인 질문과 더불 어 개발진행시 요구되는 서버세팅부터 기획, 개발언어 등등에 대해 문제를 제시해 풀어가며 왜 그렇게 생각했는지 질문. 질문에대해 압박면접이였지만 면접관분들은 분위기를 풀어주며 차분히 편안히 볼 수있도록 만들어줌. 거의1시간정도 면접을 봄."" 불합격 보통 도움이 돼요 0","static, at"
"온라인코딩 문제는 어려운 알고리즘 문제가 아닌 간단한 언어능력 테스트. 파일입출력, 정규화, 주어진 알고리즘 로직 구현 등. 라이브코딩은 mac + intelij로 진행 내용은 온라인코딩 문제중 하나를 iterator로 구현 기술면접은 전형적인 java 관련 기술문제였다.","알고리즘, 파일, int, iterator, at"
"Javascript prototype chain이 무엇인가요? Event delegation이 무엇인가요? 크로스브리우징을 해 보았나요? 등등 발표시기 9일 후 ""과제로 제출한 것에 대한 질의 응답 40분 1대1로 보고 기술면접 40분 1대1로 진행 하였습니다. 면접자가 지원자에 대한 정보가 1도 없는 상태에서 순수하게 과제 내용과 기술을 평 가하는 느낌이였습니다. 1차면접이였고 이전 이력에 대한 정보는 없었습니다. 정말 기술만 면접 봤어요"" 불합격 긍정적 도움이 돼요 1","in, at, 상태"
"프로그래밍 지식을 묻는 질문보다는, 함께 일 할만 한 사람인지를 알고 싶어 하는 것 같습니다. 실무면접과 임원면접 둘 다 그런 느낌이였습니다.",프로그래밍
웹 Backend 관련 및 java 기본 관련 질문,end
"Java 개발자 면접으로, 1차면접이 40분씩 2회 이루어집니다. 첫번째 시간에는 JUnit 기반으로 알고리 즘 코딩 테스트를 진행했습니다. 두 번째 시간에는 JVM의 힙/스택 구조, 변수 타입, 자바 8에서 새로 생 긴 기능들, DB connection Pool의 구현, HTTP의 Keep-alive란? 등 기초적인 자바기반 웹개발 상식을 질문받았습니다.",Java
"자바, DB 설계, Mybatis, Spring, 디자인패턴 등 여러개 질문","at, in"
"1. 서류 2. 코딩테스트 (알고리즘 문제 3개. 자신있는 언어 선택해서 풀면됨. 어렵지 않음) 3. 화상면접 (면접관 2명이 진행하며, 자기소개 및 경력사항 설명, 지원한 직무에 대한 이해 확인) 4. 기술면접 (면접관 4명, 대부분 화이트보드에 그림 그리고 손코드짜고 하며 강도높게 진행됨. 진행하 는 1시간반동안 주로 앞에서 설명하고 코드짜야되므로 앉아있기보다 서서 진행한다고 보면됨. 경력사항에 적힌 내용을 자세히 확인하려는 의도는 알겠으나, 특정부분을 즉석에서 손코드로 짜보라고 해서 좀 당황하였음. 이후에도 계속 말로 주문하며 질의하고 개선 요구함. 프로젝트 경력이 많아도 면접관들이 관심있지 않은 프로젝트는 물어보지 않음. 소프트웨어를 설계하는 능력과 프로젝트경력 보다 언어를 얼마나 이해하고 손으로 짤정도로 문법을 외 우고 있냐를 보는듯한 느낌이 들었음. 다시는 경험하고 싶지 않은 면접 채용방식 스킬테스트, 개인면접 발표시기 3일 후 ""1. 서류 2. 코딩테스트 3. 화상면접 4. 기술면접 (면접관 4명(지원한 직무 관련자 3명과 다른부서에 전문가1명)으로 구 성되며 대부분 화이트보드에 그림그리고 코드짜고 하며 강도높게 진행됨. 진행하는 1시간30분동안 앉아있는 시간보다 서있는 시간이 더 많았을 정도로 다소 힘이들었 음. 경력사항에 적힌 내용을 자세히 확인하려는 의도는 알겠으나 특정부분을 손코 딩으로 짜보라고 해서 당황하였음. 손코딩으로 짜면서 계속 주문하며 개선시켜보라 고 함. 소프트웨어를 설계하는 능력과 프로젝트경력 보다 언어를 얼마나 이해하고 손으로 짤정도로 문법을 외우고 있냐를 보는듯한 느낌이 들었음. 다시는 경험하고 싶지 않은 면접."" 불합격 부정적 도움이 돼요 6","알고리즘, 소프트웨어"
"1) 원격면접 - Restful에 관하여 설명하시오. - GC, JVM에 관하여 설명하시오. - node.js의 이벤트 드리븐 설명하시오. - Actor에 대하여 설명하시오. - node 의 쓰레드 처리 방식과 아파치 쓰레드 방식의 차이점과 장단점 - java에서 문자열을 ==과 equals를 이용하여 비교시 사이드이펙트 - 쿠버네티스 설명 - docker와 가상머신의 성능상 차이 - 프로젝트에서 nosql을 사용한 것이 있는데 왜 사용하였는가.",문자열
"이전회사의 조직규모와 인원, 업무 프로세스, 자료구조, 단점 ""전화면접이라고 간단히 본다더니만 1시간 반동안 일반 대면면접과 동일한 과정을 거쳤음. 근데 질문 수준이 진짜..신입사원한테 물어볼만한 질문들과 전직장의 대외 비정보만 캐내려고함"" 액 3000억원 이상 신성통상(주) 포지션 9개 채용 중 2 코이즈(주) - 기업 랭킹 채용 뉴스 연봉 이직 뽐뿌 오는 날 5분 완성, 1년 간 기업정보가 무료!    제휴 대학 서비스  회사소개 이용약관 개인정보처리방침 커뮤니티가이드라인 모바일 버전 공지사항 광고 및 제휴문의 고객 문의 FAQ | | | | | | | | (주)브레인커머스 서울특별시 강남구 테헤란로 509 엔씨타워 I, 10층 | 대표   황희승, 윤신근 | 개인정보보호관리자   윤신근 사업자등록번호   120-87-92182 | 통신판매업 신고번호   제2014-서울강남-02942호 | 유료 직업소개사업 등록번호   (국내) 제2017-3220163-14-5-00046호 대표번호   1644-5641 (10:00~17:00 / 매월 마지막 금요일 09:00~13:00 / 주말 및 공휴일 휴무) | 대표이메일 : customer_service@jobplanet.co.kr ©Jobplanet. All rights reserved. 57 58 59 60 61 온라인 지원",right
"TCP/UDP 차이, 3-handshaking 과정 설명, hashmap, hashset 차이 채용방식 PT면접, 개인면접 발표시기 5일 후 ""전화 면접에서 기본적인 수준의 전공 기초를 물어봄. 1차 면접에서는 자기소개서 바탕으로 프로젝트 진행한 것에 대해 질문이 꼬리로 이 어지고 더 심화된 전공 기초 지식에 대해 물어본다."" 대기중 긍정적 도움이 돼요 1","in, map"
"1. 자기소개 - 맡고 있는 업무에 대한 구성원 질문 - 당신이 실제로 맡은 업무는? - 업무에 사용하고 있는 솔루션은? 2. 개발한 안드로이드 앱에 대한 기능 구현 설명 - 면접관이 앱을 실행시켜서 실제로 확인 - 앱에 들어간 기술을 깊숙히 설명 요청(HTML파싱, 이미지 로딩 등) - 앱에 들어간 특정 로직에 대하여 질문함 - 서버를 사용하는지 확인 3. 지원한 직군에 대한 질문 ""원격 인터뷰는 평일 오후 2시에 진행하였음. (진행시간 50분) 면접관 2명(관련 직군)이 면접 진행"" 액 3000억원 이상 데브시스터즈(주) 포지션 0개 채용 중 3 엘티삼보(주) - 기업 랭킹 채용 뉴스 연봉 이직 뽐뿌 오는 날 5분 완성, 1년 간 기업정보가 무료!    제휴 대학 서비스",솔루션
코딩테스트 문제는 정렬하기 간단한 게임 만들기 문자열 교정하기 등 문자열 위주가 많음,"정렬, 문자열"
"Spring AOP에 대해 설명해 보세요 Java VM의 구조에 대해 설명해 보세요 채용방식 개인면접 발표시기 10일 후 ""화상면접에서는 3명이 들어왔고 경력 위주의 질문을 받았음. 1차 면접에서는 4명 이 들어왔고 세부 기술 개념에 대한 질문을 많이 받았음."" 불합격 보통 도움이 돼요 0","in, Java"
"1차 알고리즘 테스트 난이도 중~하. 문제를 제대로 이해하고 그대로 구현하면되었음. 시공간복잡도를 따질 필요는 없었음. 7문제중, 4문제 이상 정답을 맞추면 합격. 2차 크롤링 개발 난이도 중. 카카오에서 호스팅 서버를 열고 API를 제공. 크롤링과 비슷한 메커니즘의 프론트 엔드 개발 이였음. 크롤링 성공시 점수가 부여되며, 쿼리량, 크롤링의 실패유무로 감점을 하는 방식. 자신의 최고 점수를 스코어보드로 띄워 실시간으로 자신의 순위를 볼 수 있었음. 1등은 23~24만점이였으며 50등 진입은 10만 초반대 100등 진입은 8만점대였음. 합격은 8만점 이상 커트라인이였음. 3차 알고리즘 테스트 준비중. 난이도 상으로 예상중.",알고리즘
코딩 테스트는 알고리즘 링크 주고 구현해서 풀기 코딩 면접은 면접관과 전화 연결 후 말해주는 알고리즘 라이브 코딩하기 1차 면접은 지원 직무 관련 심화 질문,"알고리즘, 링크"
"지원서에 쓴 프로젝트 관련 질문과 전공 질문(특히 알고리즘, 자료구조)에 대해 물어봅니다.",알고리즘
"실무진 면접에선 알고리즘부터 디자인 패턴, 데이터베이스 등 다양한 전산 이론 및 실무에 관련된 내용 을 물어봅니다. 팀장급 면접은 경력에 관한 설명과 카카오에서의 포부나 관심 사항에 대해 물어봅니다.",알고리즘
"미적분 B트리 삽입정렬 선택정렬 퀵소트 정규화 비정규화 이진검색트리 인덱싱 캐싱 디비클러스터링 서버로드밸런싱 이미지클러스터링 리스트 링크드리스트 앵귤러2 리액트 Virtual DOM 설명 ES6 Build Process 설명 Deploy Server Git Flow isolation level Graph 최단거리 ACID CRUD ""서류전형은 메일로 하루내에 알고리즘 코딩 1차 면접은 4인 압박면접 2시간정도"" 액 3000억원 이상 오진상사(주) 포지션 10개 채용 중 2 코이즈(주) - 기업 랭킹 채용 뉴스 연봉 이직 뽐뿌 오는 날 5분 완성, 1년 간 기업정보가 무료!    제휴 대학 서비스  회사소개 이용약관 개인정보처리방침 커뮤니티가이드라인 모바일 버전 공지사항 광고 및 제휴문의 고객 문의 FAQ | | | | | | | | (주)브레인커머스 서울특별시 강남구 테헤란로 509 엔씨타워 I, 10층 | 대표   황희승, 윤신근 | 개인정보보호관리자   윤신근 사업자등록번호   120-87-92182 | 통신판매업 신고번호   제2014-서울강남-02942호 | 유료 직업소개사업 등록번호   (국내) 제2017-3220163-14-5-00046호 64 65 66 67 68","정렬, 링크, at, 알고리즘"
"경력에 대한 심층 질문, Spring 프레임웍 등의 기술 기반에 대한 심층 질문",in
논문 링크를 보내주고 정해진 시간안에 구현하는 문제.,링크
"1.화이트보드로 간단한손코딩 2.전직장 업무설명하면서 화이트보드에 관련업무설명및 설계, 구현법 3.spring java 관련 이론질문. 4.개인성향에 관한 질문 채용방식 스킬테스트, 개인면접 발표시기 2일 후 ""분위기좋게 시작하였지만 꼬리에 꼬리를무는 질문. 잘 생각하고 답변해야지 안그 러면 처음했던말을 번복하며 정정해야한다."" 불합격 보통 도움이 돼요 0",in
손코딩이었습니다 문제는 동적프로그래밍중에하나였습니다,프로그래밍
"어떠한 알고리즘 문제 해결방법을 칠판에다 작성해보시오. 작성한후에는 칠판을 보면서 부분 부분 물 어봄. 채용방식 스킬테스트, 개인면접 발표시기 1일 후 ""인성 부분은 준비했지만.. 거의 물어보지 않았음. 기술적인 부분을 많이 강조 하셧고 어려운 문제들도 많이 나왓음. 면접 분위기는 무 겁지 않아서 좋았다 면접관에 따라 많이 바뀌는 듯"" 합격 긍정적 도움이 돼요 0",알고리즘
간단한 자기소개 후에 경력 위주로 질문을 받았습니다. 꼬리를 무는 질문이 많았고 본인이 실제로 업무를 진행했는지 확인하는 질문이 많았습니다. 논리적인 질문도 하나 있었습니다. 실무질문이 80% 인성질문이 20%정도였습니다. 2차면접은 심화실무질문이 대부분이었고 인성질문은 거의 없었습니다. 알고리즘이나 자료구조의 대한 질문도 있었습니다.,알고리즘
"map/set/list차이점, 자바의 serializable과 안드로이드 parcelable의 차이 등 채용방식 스킬테스트, PT면접, 개인면접 발표시기 7일 후 ""면접관 네 분이었고, 약 50분간 진행되었습니다. 면접관 세 분이 실무자 같았고, 한 분은 다른 팀 분이거나 인사팀 분이 아닐까 생각합니다. 세 분의 실무자 모두 저를 편하게 해주시려고 노력했고 굉장히 매너가 좋았습니다. 처음에 1분 자기소개 하고 제 경력 관련해서 질의 응답 이뤄졌습니다. 그리고 과제 보면서 리뷰 하면서 기술적 질의 응답을 했습니다. 이 때 거의 예상되는 질문들을 했습니다. 최대한 대답을 유도 하기 위해 질문하는 형태였습니다. 과제 관련해서 공부 많이 하면 되겠습니다."" 불합격 긍정적 도움이 돼요 0",map
알고리즘 문제를 지급받은 맥북에 코딩하고나서 끝나면 모니터에 코드를 띄우고 그에 대한 설명을 쭉 합니다. 설명이 끝나면 자기소개부터 시작해서 본격적으로 면접을 시작하죠. 그동안 진행했던 프로젝 트에 대한 설명과 함께 기술적인 부분에 대한 질문과 답변이 꼬리에 꼬리를 물고 이어집니다.,알고리즘
"알고리즘 문제 한문제, 이전에 했던 것에 대한 질문, db 테이블 구성법",알고리즘
"몇 가지 질문을 다음 분을 위해 공유합니다. 화이트 보드 코딩 질문 1. 문자열 리버스 함수 구현 2. 앞에 작성된 문자열을 TDD로 구현해보세요. 3. 싱글턴을 구현 해보세요. 서버 관련 질문 1. 리눅스 사용 해봤냐? 2. 서버가 1억대가 있고 서버에 데이터가 request가 저장되는 건이 1억건일 경우 어떻게 수집하고 구 성할 것인가? 3. Apache 와 Tomcat 의 연동 이유는 ? Was 로만도 웹 서비스가 사용이 가능할텐데 굳이 apache로 사용하는 이유는? 3-1. Apache 와 Tomcat 의 연동 방법은? 4. 서비스 운영 시 장애 경험은? 어떻게 해결했는가. 5. 서버스 운영 시 장애확인 이 불가능하다 (ex. 모니터링, 로그 부재 등) 이 같은 경우에는 어떻게 처리 할 것인가? 6. 서버가 이유없이 행이 걸렸다. 어떻게 처리할 것인가? 개인 생활 관련 질문 1. 회사에서 주어진 업무가 재미가 없고 다른 업무가 재미가 있다면 어떻게 하겠는가? 2. 기술 공부는 어떻게 하나? 이 밖에 다수..","문자열, at"
재생목록 음악 셔플링 문제로 같은 아티스트의 곡이 연속되지 않도록 하는 알고리즘 구현,알고리즘
"오픈소스 내부 로직. 해당 라이브러리 선정/사용하는 이유. 자바 기본 클래스 내부 메소드 로직. 채용방식 스킬테스트, 개인면접 발표시기 1일 후 ""면접 분위기는 편함. 기술면접은 과제 코드리뷰와 사용한 오픈소스 설명. 이력서에 기재한 경력내용과 해당 기술 설명. 임원면접도 기술면접이었음. 난이도가 어려웠고 답변을 못함."" 불합격 긍정적 도움이 돼요 1","기본 클래스, 클래스, 메소드"
"알고리즘/데이터 구조 질문 과제가 있었음. 과제 결과물이랑 코드 보고 왜 이렇게 했냐, 어떻게 구현했냐? 어려운건 없었냐? Component이런건 어떻게 동작할꺼 같냐? 동작을 어떻게 구현하겠느냐? Framework 소스는 보는 편 인가?",알고리즘
"실무경험 확인 java 기본 개념 자료구조와 간단한 알고리즘 구현 채용방식 스킬테스트, 개인면접, 기타 발표시기 30일 후 ""서류 면접, 코딩테스트, 실무면접, 임원면접, 연봉협상"" 합격 긍정적 도움이 돼요 1",알고리즘
"1차 코딩테스트: 이메일로 문제를 받고 4시간 안에 작성한 코드와 결과파일을 제출. 문제는 영어로 출제됨. playlist에 있는 노래를 랜덤 재생할 수 있도록 셔플링하는 코드 작성. C++ 혹은 Python 으로 코드 작성시 가산점 있음. 전화코딩테스트: 행아웃으로 약속한 시간에 전화가 와서 약 1시간 동안 진행. 면접관에게 화면 공유를 해야함. 세 문제 출제. 1번과 3번 문제는 쉬워서 말로 출제. 2번 문제는 영어 지문을 읽고, 주어진 조건을 만족하는 코드 작성. (anagram 관련 문제였음.)",파일
"경력에 표기된 프로젝트에 대해서 깊이 있는 질문을 함. 프로젝트와 관련된 기술(Spring, Http Protoco)에 대해서도 꽤 심도 있는 질문을 함. 질문은 꽤 공격적이나 매너를 잃는 수준의 질문은 아님.",in
소팅 알고리즘과 안드로이드 ipc 통신및 루퍼에 대한 사용법을 물어봤음,알고리즘
본인이 사용하고 잇는 개발언어를 이용하여 제귀함수를 이용해서 해당 문제를 풀어 보세요.,함수
기억나는 질문은 순환참조에 대해 설명하시오. 메모리 관리 기법에 대해 자세히 설명해주세요. OAuth가 먼가요 블러처리는 어떻게 했나요,참조
1. 본인이 이전 직장에서 했던 프로젝트 중 하나를 칠판에 그려 자세히 설명해 보시오. 2. thread local이란 무엇인가? 3. java에서 hashCode를 overrding할때 같이 override해야 하는 method는?,"in, override, method"
"알고리즘에 관한 문제가 있었고 프로젝트에 관한 내용중 기술적 질문을 많이 했음 채용방식 케이스 면접 발표시기 30일 후 ""인터넷으로 서류 접수 1주일후 1차 면접 일정 2주일후 2차 면접 합격"" 대기중 긍정적 도움이 돼요 0",알고리즘
"먼저 자기소개를 했고, 그 동안 했던 프로젝트들을 설명했습니다. 그리고 지원동기와 전공과목 중 좋아 하는 과목과 그 이유를 물었습니다. 전공질문은 간단한 정렬 알고리즘에 대해 나왔었습니다. 마지막은 질문하고 싶은 것을 각자 물어봤습니다. 면접은 50분정도 진행했던것 같습니다. 채용방식 그룹면접 발표시기 10일 후 ""고용 디딤돌지원으로 면접을 보고 왔습니다. 자기소개서는 자유양식이었고 서류 제출 후 일주일 정도 후 발표가 났습니다. 면접은 판교에 있는 사옥에서 봤고 3대3 면접으로 봤습니다."" 불합격 보통 도움이 돼요 0","정렬, 알고리즘"
알고 있는 자료구조와 알고리즘에 대해 설명하시오. 지원한 이유는 무엇인가요?,알고리즘
"본인이 했던 프로젝트 중에 어떤 역할을 했고 어떠한 문제를 해결 했는지 상세하게 말해보라, 과제에 이 러한 코드가 있는데 왜 이렇게 작성하게 되었는가? 등등",역할
"- 이력서에 근거해 질문, 특히 포트폴리오의 내용에 대해 상세히 물어봄 - 답변 이후 전공 지식 (자료구조, 알고리즘) 을 물어봄",알고리즘
직무와 관련된 프로그래밍 관련 질문들을 주로 하였습니다.,프로그래밍
"3:3 면접으로 팀장급 사원들이 면접을 직접 직행하고, 기술, 인성, 열정에 대해서 물어봤습니다. 질문 : 정렬 중 가장 빠른 정렬을 언급하시고, 알고리즘에 대해서 설명하세요.","정렬, 알고리즘"
