question,extracted_terms
"Tcp ip 의 상태 모델의 변화에 따라 개발자가 취해야 하는 작업이 어떻게 되는지 원인이 뭔지 등에 대해 몇 가지 장애 케이스를 놓고 이야기함 채용방식 필기시험, 토론면접 발표시기 30일 후 ""홈페이지로 지원 코딩테스트 후 1차면접 진행함 네트워크 데이터베이스 oop이론 등에 대해서 질문 답변을 이어나갔음"" 합격 긍정적 도움이 돼요 0","모델, 네트워크"
프로젝트기반 자기소개 / CS질문 / 네트워크중심질문,"기반, 네트워크"
해시 맵 vs 트리 맵 차이는? Java List vs Stream 차이는? HDFS는 CAP theorem으로 보면 어떠한 구조인가?,"CA, 구조"
대면 질문 - 네트워크와 관련된 기술적인 질문들(글로벌 회사라 네트워크 적인 성능 이슈에 초점) 인사 질문 - 야근이나 주말출근이 많다면? 인성 질문 - 왜 이직하려 하는가?,네트워크
"사전 과제에서 아쉬웠던 부분 전공 질문 (Deadlock 조건 등등) ""코딩테스트-사전과제-1차인터뷰-2차인터뷰"" 액 3000억원 이상 (주)솔루엠 포지션 2개 채용 중 2 (주)오픈노트 New 기업 랭킹 채용 뉴스 연봉 이직 뽐뿌 오는 날 5분 완성, 1년 간 기업정보가 무료!    제휴 대학 서비스  회사소개 이용약관 개인정보처리방침 커뮤니티가이드라인 모바일 버전 공지사항 광고 및 제휴문의 고객 문의 FAQ | | | | | | | | 4 5 6 7 8 면접경로 온라인 지원","서비스, 버전"
"서버에 대한 질문, 자소서와 관련된 경험, 코딩테스트 풀이",서버
당시 네이버 지도에 비합리적인 구조가 있었는데 왜 그렇게 구현이 되어있는지,구조
1. 경력과 관련된 프로젝트를 간단하게 소개해 주세요. 2. 어떤 서비스를 개발하고 싶은가요? 3. 자기소개서와 관련된 질문들(사용한 툴을 왜 사용했는지? 사용한 언어의 장단점?),서비스
"서류 - 코딩 테스트 - 기술 면접 - 인성 면접 - 처우 협의 - 입사 (주)쏘카 Backend Developer 3 ~ 8년, Javascript 합격보상 100만원  111퍼센트(주) [111퍼센트] 1인 개발자 모집 경력무관, Unity, 유니티 합격보상 100만원  (주)코드박 [200억 웨어 엔 3 ~ 10년, 액 3000억원 이상 신성통상(주) 포지션 9개 채용 중 2 (주)오픈노트 New 기업 랭킹 채용 뉴스 연봉 이직 뽐뿌 오는 날 5분 완성, 1년 간 기업정보가 무료!    제휴 대학 서비스  면접일자 2018/09 면접경로 온라인 지원",서비스
"2차 - hash join, nested join 차이점 - docker의 장단점 1차 ""코딩 테스트 후 1차 면접 - 실무자 4명 (기술 질문 100프로) 2차 면접 - 팀장 리더급 3명 (기술 질문 90프로 인적성 10프로)"" 액 3000억원 이상 신성통상(주) 포지션 9개 채용 중 2 (주)오픈노트 New 기업 랭킹 채용 뉴스 연봉 이직 뽐뿌 오는 날 5분 완성, 1년 간 기업정보가 무료!    제휴 대학 서비스  6 7 8 9 10",서비스
"레드 블랙 트리, 디자인 패턴 싱글톤, 접속중인 유저 수를 계산하는 법",트리
포폴 어떻게 만들었는지. 전공 자료구조 질문함. 회사에 궁금한점있는지 물어봄,구조
자소서기반의 질문과 기술적인 질문도 많았습니다 프로젝트 경험도,기반
고정된 질문 형태가 아닌 프로젝트 기반으로 어디까지 지원자가 아는지 파고듭니다.,기반
작업해본 파이프라인 아키텍쳐에 대해 설명해주시고 어려웠던 점은 무엇인가요?,파이프라인
1. 주소창에 url을 입력하고 웹페이지가 나타날 때까지의 과정 2. 알고있는 디자인 패턴 3. 클로저란?,주소
"JVM구조에 대한 질문, 스레드 동시성에 대한 질문, 알고리즘 질문",구조
프로젝트 기술 스택 선정 과정 JS 관련 질문 (클로저 등) 소켓통신 과정 설명,소켓
매우 까다로운 조건을 주고 시스템 설계를 시킴 알고리즘 복잡도 증명 JVM gc 전략 설명,시스템
프로젝트 기반 기술 질문 언어 지식 가벼운 인성 질문,기반
"1분 자기소개와 각오, 특정 파일 구조에 대해서 설명하기, 어떤 프로젝트를 어떤식으로 구현하였는지, 암호화 방식을 그것으로 사용한 이유는 무엇인지.","구조, 암호화"
PM 직군이 하는 일? 트랜젝션에 대해 설명해주세요. 게임 서버가 돌아가는 과정을 설명해주세요.,서버
강의나 책을 따라한 프로젝트가 아닌 직접 해본 프로젝트가 있냐. 라인서비스를 이용해본적 있는가 왜 이 직무를 선택하였는가,서비스
"스레드 관련 네이버 검색 시 일어나는 일 (DNS 머 이런거 설명하는거 과정) http, https",DNS
왜 이회사를 지원하였는지? 이직 이유는 ? 자바 버전에 따른 차이점은?,버전
전공 관련 질문이 95%였고 했던 프로젝트의 구조 등에 대해 질문 받음,구조
딱히 없습니다. 프로젝트 기반 질문이었기 때문에..,기반
TCP 4-Way Handshake에 대해 설명해주세요,TCP
업무하면서 협업에대한질문 협업시 팀원간에 불화 업무에 소요시간 및 방법,방법
"지금까지 한 업무 설명 강점/장점 지원 사유 자신의 성향이 어떠한 사람인지 프로젝트 위주 기술적인 부분 많이 물어봄 ""서류, 1차면접 2차면접 마지막 3차 면접 으로 진행 1차 기술 2차 인성면접으로 생각하면됨 3차 최종면접은 임원면접"" 액 3000억원 이상 데브시스터즈(주) 포지션 0개 채용 중 2 (주)오픈노트 New 기업 랭킹 채용 뉴스 연봉 이직 뽐뿌 오는 날 5분 완성, 1년 간 기업정보가 무료!    제휴 대학 서비스  회사소개 이용약관 개인정보처리방침 커뮤니티가이드라인 모바일 버전 공지사항 광고 및 제휴문의 고객 문의 FAQ | | | | | | | | (주)브레인커머스 서울특별시 강남구 테헤란로 509 엔씨타워 I, 10층 | 대표   황희승, 윤신근 | 개인정보보호관리자   윤신근 15 16 17 18 19","서비스, 버전"
"프로젝트에 대해서 설명해라, 그런데 왜 그렇게 했냐, 어떻게 할꺼냐 더 좋은 방법은 없냐, 어떤점이 힘 들었냐, 더 좋게 설명해봐라 그런데 어떻게 할꺼냐 등등 프로젝트 작성 기준으로 설명 발표시기 20일 후 불합격 부정적 도움이 돼요 2",방법
프로젝트에서 해당 기술을 선택한 이유는? 데이터의 구체적인 사이즈는 어느정도였는가,데이터
"기술면접의 경우 컴퓨터 사이언스 쪽 질문으로 구성되어 있음. 자바의 GC, 데이터베이스, 네트워크, 몇 몇 디자인 패턴에 대해 공부해가면 도움이 될 것. 또한 포트폴리오에 작성한 프로젝트에 대해 꼬리물기 식으로 질문하므로 포트폴리오 예상질문을 만들어가면 도움이 될 것. 당연히, 시간이 남으면 코딩테스 트 관련 질문도 들어옴. 2차면접의 경우 1차면접에서 잘못 대답한 것이 있나요? 식의 질문이 있었음. 나머지는 뭐 연구실 생활 에서 어떤 일이 있었나, 힘들었던 경험과 어떻게 해쳐나갔는지 알려달라(일적인 측면과 사람사이의 관 계 측면 각각)고 질문을 받음",네트워크
해봤던 프로잭트가 무엇인가요? 네트워크 통신 관련 지식들 설명해줘요.,네트워크
[온라인 코딩테스트] 타 기업에서 흔히 볼 수 있는 problem solving이라기보다는 간단한 문제를 '자바스크립트답게' 짤 수 있는가를 묻는 유형이었습니다. 아마 부서에 따라 조금씩 유형이 상이할 것 같습니다. [온라인 이론테스트] 이 역시 학교에서 배운 이론지식을 묻는 게 아니라 실제 업무에 필요한 렌더링이나 네트워크에 대한 지 식이 중심이었습니다. [1차 기술면접] 웹개발에서 필요한 건 그냥 다 물어봅니다. 제가 한 대답이 꼬리물기 식으로 다시 질문이 돼서 돌아옵니 다. 첫 질문이 그냥 자기소개가 아니라 '지금까지 한 프로젝트를 기반으로 한' 자기소개입니다. 주의하세요.,"유형, 네트워크, 기반"
"업무와 관련된 전반적인 내용을 질문합니다. 케바케일거 같긴 한데 지원 분야랑 다른 질문이 너무 많았 습니다. ""메일로 안내가 온 뒤 직접 방문하여 면접을 진행합니다."" 111퍼센트(주) [111퍼센트] 1인 개발자 모집 경력무관, Unity, 유니티 합격보상 100만원  라이언앤코(주) [경력] Java Web 개발자 모집 [주4일 출 근제 도입] 3 ~ 5년, java, Spring, aws, jquery, MYSQL, DB, was, 파…  (주)박차컴 JAVA 개 5년 이상, j 합 액 3000억원 이상 (주)솔루엠 포지션 2개 채용 중 2 (주)오픈노트 New 기업 랭킹 채용 뉴스 연봉 이직 뽐뿌 오는 날 5분 완성, 1년 간 기업정보가 무료!    제휴 대학 서비스","query, 서비스"
"흥미있던 과목들? 주로 쓰는 언어? 지원 동기? 기타 운영체제, 데이터통신 관련 질문들",데이터
"본인이 뭘 잘한다고 생각하세요? 뭘 잘해요? 라인에서 뭘 잘할수있을거라고 생각해요? 채용방식 스킬테스트, 개인면접 발표시기 8일 후 ""뭘 잘하세요? 등. 상대방을 얕잡아보는 질문을 합니다. 1차면접에서 뽑질 말던지 최종까지 붙이구선 황당한 질문들 합니다."" 불합격 부정적 액 3000억원 이상 (주)솔루엠 포지션 2개 채용 중 2 (주)오픈노트 New 기업 랭킹 채용 뉴스 연봉 이직 뽐뿌 오는 날 5분 완성, 1년 간 기업정보가 무료!    제휴 대학 서비스  회사소개 이용약관 개인정보처리방침 커뮤니티가이드라인 모바일 버전 공지사항 광고 및 제휴문의 고객 문의 FAQ | | | | | | | | (주)브레인커머스 서울특별시 강남구 테헤란로 509 엔씨타워 I, 10층 | 대표   황희승, 윤신근 | 개인정보보호관리자   윤신근 사업자등록번호   120-87-92182 | 통신판매업 신고번호   제2014-서울강남-02942호 | 유료 직업소개사업 등록번호   (국내) 제2017-3220163-14-5-00046호 대표번호   1644-5641 (10:00~17:00 / 매월 마지막 금요일 09:00~13:00 / 주말 및 공휴일 휴무) | 대표이메일 : customer_service@jobplanet.co.kr 19 20 21 22 23 신고하기 도움이 돼요 3","서비스, 버전, 번호, service"
"기본적인 부분을 물어보았고, 추상적인 질문을 기술에 맞게 생각하여 변환해서 애기해야했음 . 서버구 조를 어떻게 설계했는지에 대한 물음 코딩테스트는 알고리즘 문제였음","변환, 서버"
"필기시험은 네트워크, 암호학, 응용보안; 선택지 문제 + 서술형(분석) 문제로 이루어짐 선택지 문제는 보안기사 수준, 서술형은 학교에서 수업하는 내용을 이해해야 응용해서 풀수있는 정도 - 어려움 면접은 자기소개 - 프로젝트 중심으로 질문받았고 취약점 위주","네트워크, 암호학, 보안"
"필기는 cs전반적으로 나옵니다. 알고리즘 풀이도 포함 면접은 정말 너무 폭 넓게 물어봅니다. 신입이어도 시스템 설계에 대해서 물어보고... 이해할 수 없네요 채용방식 필기시험, 스킬테스트, 개인면접 발표시기 40일 후 합격 부정적 도움이 돼요 0",시스템
"자바 관련 질문 자바 버전 별 스펙, 가비지콜렉션, 네트워크 관련 질문","버전, 네트워크"
"자기 소개 경력직이라 경력 관련 질문이 대부분 최신 취약점 관련 질문과 공격 방법, 탐지 방안, 해결 방안 등 자세하게 질문함 보안 장비 운영 관련된 자세한 질문","방법, 보안"
"이회사에 왜 지원을 하였으며 앞으로 무엇을 보여줄수있는지 얘기해보세요 채용방식 개인면접 발표시기 16일 후 ""기존 다니던 회사와 비교하여 지금 회사와 비슷한점등 그외 회사 관련하여 질문"" 불합격 보통 라이언앤코(주) [경력] Java Web 개발자 모집 [주4일 출 근제 도입] 3 ~ 5년, java, Spring, aws, jquery, MYSQL, DB, was, 파…  (주)피매치 백엔드 엔지니어 (채용전환형 인턴) 경력무관, python, SQL, azure, PostgreSQL, rest api, 시… 합격보상 100만원  (주)박차컴 JAVA 개 5년 이상, j 합 액 3000억원 이상 모트렉스(주) 포지션 30개 채용 중 3 코이즈(주) 1 기업 랭킹 채용 뉴스 연봉 이직 뽐뿌 오는 날 5분 완성, 1년 간 기업정보가 무료!    제휴 대학 서비스  신고하기 도움이 돼요 0","query, 서비스"
"특정 상황이나 시스템을 던져주고 이것을 너라면 어떤식으로 구현하겠냐, 어떤식으로 성능 향상을 꾀 하겠냐 는 질문이 쉽지 않았음.",시스템
"1시간동안 3대1 면접이었습니다. 듣던대로 압박분위기는 전혀 없고 너무나도 친절하게 대해주셨습니다. 또한 듣던대로 전공관련 질의만 이뤄졌습니다. 포트폴리오가 없으시다면 기본 전공지식을 물어보실 것 이고 포트폴리오가 있다면 서류관련 기술질문을 하실 것입니다. 1. 가장 자신있는 언어는? 2. 퀵소트와 머지소트를 설명해보시오 3. 도메인을 입력하고 페이지가 열리는데까지 서버에서 어떤 일을 하는지? 4. 인덱스란? 5. 4 handshake, 3 handshade 의 차이 6. 마지막으로 하고 싶은 질문 7. 이외 만약 ~다면? 어떻게 할 것인가? 하는 즉시 생각해서 답변해야 하는 질문들(새로운 유형이라 재 밌었으나 제대로 코딩해본 경험이 많지 않으면 답변하기 쉽지 않을 것 같았습니다.) 8. 포트폴리오 관련 질문 꼬리물기식 심층질문을 하시되, 끄덕끄덕하신다던지 아닌 것 같으면 피드백을 해주신다던지 제 답변을 경청해주시고 있는 느낌을 받을 수 있었습니다. 많은 면접자분들이 얘기하시듯이 합/불여부랑 상관없이 실무자멘토와 대화를 나누다 온 느낌도 있어 서 좋았습니다. 면접동안 물도 가져가서 마시게 해주고 카페 이용쿠폰, 택시서비스, 기념품증정까지 면접자에 대한 배 려는 진짜 따라올 기업이 없을 것 같습니다.","질의, 서버, 유형, 서비스"
"이걸 알면 어머 이거 아시네, 그럼 이건 아세요? 라는 식으로 계속 이어진다고 했는데, 그렇게 이어지진 않았음. 그 중 가장 어려웠던 문제들은 기본지식이 아닌 생각해야 하는 문제들이였습니다. 좋은 API가 뭐라고 생각하시나요? 라던가.. 서버를 잘 만드려면 어떻게 해야할까요? Credential 에 대한 질문도 들어왔고, 해당 패킷을 암호화해야하지 않냐? 이런 질문도 들어왔었는데 당황스러웠습니다. 나머지는 굉장히 기본적인거였는데, 제가 몰랐던 것.. ex) www.naver.com 을 브라우저로 연결했을 때, 일어나는 일.","서버, 패킷, 암호화"
"1:1 면접이었고, 이력서 기반으로 질문을 많이 받았습니다.",기반
TCP/UDP 차이 프로세스 / 쓰레드 차이 수행한 프로젝트 기반 질문들,"TCP, UDP, 기반"
"자소서에 쓴 내용을 기반으로 직무에 관련된 질문이 많고 전공 과목에 대한 질문으로는 알고리즘 경우 에는 주어진 문자열을 담은 벡터에서 한 번 등장하는 문자열, 여러 번 등장하는 문자열을 구분하는 소스 코드 작성 문제가 있었습니다. 자료구조 경우에는 퀵소트와 머지소트의 알고리즘 설명, 운영체제 경우 에는 스케줄링 알고리즘에 대해서 구체적인 설명, 네트워크 경우는 TCP와 UDP 차이점 설명, 웹 경우에 는 GET과 POST 방식의 차이점과 각각 어떤 경우에 사용하는 것이 적당한지 질문이 있었습니다.","기반, 구조, 네트워크, TCP, UDP"
알고리즘 과 자료구조 문제 5개가 나왔습니다.,구조
"서비스를 런칭한 경험을 자세하게 설명하고 역할을 부연함 ""실무 측면에서 성공한 사례를 물어봄 구체적인 사례를 필요로함"" (주)코드박스 [200억 ↑투자, 두나무 계열사] 소프트 웨어 엔지니어 3 ~ 10년, python, react, graphql, typescript, Django fra…  (주)자비스앤빌런즈 [대규모 채용] Backend Engineer 3 ~ 20년, java, Spring 합격보상 100만원  (주)쏘카 Backen 3 ~ 8년, J 합 액 3000억원 이상 신성통상(주) 포지션 9개 채용 중 2 (주)오픈노트 New 기업 랭킹 채용 뉴스 연봉 이직 뽐뿌 오는 날 5분 완성, 1년 간 기업정보가 무료!    제휴 대학 서비스",서비스
"우선 코딩시험에서 제출한 코드를 받아서 들고 들어가면, 필기시험과 코딩시험에 대한 질문을 받았습 니다. 제가 선택한 답에 대해 다시 물어보고 그에 대한 설명을 했고, 서류 접수 시 제출한 포트폴리오를 기반으로 한 질문과 직무에 기반되는 전공 질문 순으로 진행되었습니다.",기반
"질문을 하고 답변의 꼬리를 무는 형식으로 면접이 진행되며, 대량 트래픽 및 서비스간 통신시 데이터 암 복호화에 관한 질문을 많이 합니다.","서비스, 데이터"
1.db migration경험 말해 보기 2.지금 개발시스템을 설명하기 3.cookies어디서 저장하는지 4.모든 자료구조 다 물어봤어요ㅜㅜ 5.jquery 브라우저마다 다 쓸 수 있는 이유? 6.ioc설명,"시스템, 구조, query"
해왔던 프로젝트들 설명 네트워크 관련 질문들,네트워크
"압박면접이 될 수 있으니 마음을 단단히 먹고 갔지만 밑도 끝도 없이 까는 질문에 속수무책. 자기소개 이후 SW 개발에 포함된 특정 기술에 대한 설명을 시작함과 동시에 말 짜르고 공격. ""그 기술 안 좋다. 실제로도 안 쓰인다."" ""실제 기업에서 그 기술을 사용하는 것 본적 있냐""는 질문에 기술 세미나와 컨퍼런스를 통해 확인한 몇 몇 기업의 이름을 답변하니 ""그 회사들도 그거 안쓴다. 걔네도 어떤 기술인지 확인해볼려고 그냥 써보 는거다"" 이런식으로 반박이 들어옴. 그 이후에도 해당 기술에 대한 장점을 말해봤지만 전혀 들으려고 하지 않음. 한참을 질의응답을 한 뒤에 그 기술을 라인에 어떻게 적용할 것인지, 현재 라인에는 20년 이 상의 경력자들과 아키텍트들이 있는데 그들을 어떻게 설득할 것인지에 대해 질문함. 몇 가지 장점을 예를 들어서 답변했으나 그마저도 중간에 말 짜르고 ""그거 이미 다른 기술로도 다 된다. 우리는 이미 그렇게 구현해서 잘 돌아가고 있다""라고 반박함. 면접시간의 절반을 그 기술을 까는데에 다 써놓고선 라인에 이 기술을 적용해보라고 질문을 하니 손발 다 묶어놓고 헤엄쳐보란 얘기로 들렸음. 물론 이런 압박에도 현명한 답을 내서 면접관을 설득하고 자신을 어필하는 것이 면접이라는 전형의 특 성이지만 해도 해도 너무 한다는 생각이 들었음. 지원자 본인을 어필하는 자리가 아니라 특정 기술을 판 매하는 세일즈맨이 된 듯한 착각이 들 정도. 해당 기술을 공부하고 개발했다는 것에 자괴감이 들었음. 사실 그 기술 개발 이외에도 굉장히 많은 프로젝트를 진행해봤지만 그에 대한 질문은 전혀 없었고 심지 어 서류 때 제출한 포트폴리오의 존재조차 모르고 있음. 후반에 내가 얘기해서 그제야 파일 찾아보고 열 어 봄. 이외의 질문들도 신입 지원자에게 질문할 정도의 수준인가 의심이 들 정도로... 어렵고 알아 듣기 힘든 질문이었음. 면접에 임하기 전 여러 사이트의 면접 후기를 통해 약간은 부정적일 수 있다라는 것을 인지하고 갔지만 농락당하는 듯한 면접과 지원자에 대한 최소한의 파악도 안 된 면접관들로 인해 인생에서 기억에 남는 면접자리가 됐음. 면접에 임한 땐 이 부분을 참고해서 멘탈 단단히 챙기고 가싶쇼. 채용방식 개인면접 발표시기 13일 후 ""온라인 원서 접수 후 한달 반 후에 서류 합격 통보 받음. 서류전형이 너무 긴 것 같 아서 문의 메일을 몇 번 보냈지만 계속 차주에 발표날 것이라는 복.붙 한듯한 연락만 받음. 물론 차주에 발표가 나지 않았음. 그 후 면접 전형을 본 뒤 2주 후에 불합격 통 보받음"" 불합격 부정적 도움이 돼요 15","질의, 응답"
"코딩테스트 때 작성했던 코드의 시간복잡도, 푼 방법, 더 나은 효율 방법과 포트폴리오, 자소서에 관한 질문합니다. 채용방식 필기시험, 개인면접 발표시기 7일 후 ""서류와 코딩테스트를 통과하여 1차 면접을 보러갔습니다. 면접은 면접관 3명인 1 대다 방식이었습니다. 약 한 시간정도 이루어졌습니다."" 불합격 긍정적 도움이 돼요 1",방법
- 데이터베이스 샤딩 - 대용량 데이터베이스 최적화 방안 - HTML5 -> C++ 개발자한테... 왜 물어보는지??? - Jquery 로딩 방식 -> 하... 왜 물어봄???? - Overloading vs override -> 경력자한테 이딴걸???? - Dictionary 내부 자료구조 -> 질문 다운 질문! - Ajax 요청 타입 지정 방법 -> 슬슬 열받기 시작... !!!! - 람다식 화이트보드 코딩 - Binary 소트 알고리즘 C++ 화이트보드 코딩,"query, 구조, 방법"
"프로세스와 스레드 차이 싱글톤 패턴에 대해서 ""서류 - 온라인 테스트 - 1차 -2차로 이어집니다 제가 경험한 면접관님들은 친절하나 다소 딱딱한 느낌이었습니다."" 액 3000억원 이상 (주)솔루엠 포지션 2개 채용 중 2 (주)오픈노트 New 기업 랭킹 채용 뉴스 연봉 이직 뽐뿌 오는 날 5분 완성, 1년 간 기업정보가 무료!    제휴 대학 서비스  회사소개 이용약관 개인정보처리방침 커뮤니티가이드라인 모바일 버전 공지사항 광고 및 제휴문의 고객 문의 FAQ | | | | | | | | (주)브레인커머스 서울특별시 강남구 테헤란로 509 엔씨타워 I, 10층 | 대표   황희승, 윤신근 | 개인정보보호관리자   윤신근 사업자등록번호   120-87-92182 | 통신판매업 신고번호   제2014-서울강남-02942호 | 유료 직업소개사업 등록번호   (국내) 제2017-3220163-14-5-00046호 대표번호   1644-5641 (10:00~17:00 / 매월 마지막 금요일 09:00~13:00 / 주말 및 공휴일 휴무) | 대표이메일 : customer_service@jobplanet.co.kr ©Jobplanet. All rights reserved. 33 34 35 36 37","서비스, 버전, 번호, service"
"실제 경력 기반으로 운영 경험이나 장비 장단점 질문 경험해본 케이스 기반으로 업무 능력 질문 중요하게 생각하는 회사의 기준(돈, 성취감 등) 질문 등",기반
프로젝트에 대한 질문을 많이 함. Window기반 서버를 제작한이유 리눅스를 사용해 보지 않은 이유 다른 언어 숙달 기간,"기반, 서버"
"면접관 3분이 계신 방에 혼자 돌어가 질문답변을 진행함. 온라인 테스트와 코딩 테스트 때 나온 문제에 대해 왜 그렇게 답했는지, 틀린 문제의 경우 더 생각해 보 았는지 물어봐서 답함. 또한, 문제에 나왔던 몇몇 개념들에 대해 설명해보라고 함. 이 외에 게임 클라 혹은 서버 개발에 필요한 여러 지식들에 대해서도 알고 있는지 물어봄. 면접 분위기는 역시 IT 회사라 그런지 부드럽고 편안함. 공격적인 질문도 없고 압박면접 같은것도 전혀 아님.",서버
왜그렇게 생각하세요? 왜 그회사가 그렇게 했을까요? 같은 마인드맵 질문들 많았고 대답 잘못하면 설명해주고 왜 그렇게 생각했는지 꼬리물어서 질문이 많았음 그 활동을 통해서 무엇을 얻었나요? 자소서 기반질문은 물어볼만한 질문들,기반
일단 면접 관들의 취지는 뭔지 알겠으나 기본적으로 기본적으로 내 경력과 스터디 내역에 전혀 관심이 없음 경력이나 포부에 대한 질문이 전혀 없는 것은 니 경력엔 관심이 없다 우린 실력만 보겠다라는 당찬 포부로 이해해볼수 있겠으나 애초에 내가 주로 개발하고 R&D했거나 알고 있는 범위 내에서 물어봐야 하는데 면접관 세명이 각자 자신있는 분야에 대한 질문을 하는 것 같음 한명은 네크워크 쪽 암호화쪽 질문만 계속해대고 한명은 계속 모바일쪽 네이티브 개발과 응용프로그램 개발 쪽만 물어보다보니 계속 내가 경험한쪽과 정반대의 질문들만 이어짐 결론은 내가 메신저 개발팀에 지원한건가 착각이 들 정도로 응용프로그램 개발 분야와 네트워킹 관련 지식에 대한 질문이 주를 이루었고 정작 게임 개발 실무 테크닉 관련 질문은 거의 못받음,암호화
면접 전 시전 테스트를 보는 데 그 테스트를 기반으로 질문 하고 심층 적으로 질문이 들어 갑니다. 그리고 필요하면 화이트 보드에 설명을 해야합니다,기반
어떤 경우 전체 면접을 영어로 보는 경우도 있음 실무적인 질문(ex) 해당 국가에서 어떤 프로모션을 해 볼 것이냐) 에서부터 자소서 기반 질문과 일반 면 접질문(ex) 성격적 장단점 ) 전반적으로 물어봄,기반
