question,extracted_terms
"Java 개발자 면접으로, 1차면접이 40분씩 2회 이루어집니다. 첫번째 시간에는 JUnit 기반으로 알고리 즘 코딩 테스트를 진행했습니다. 두 번째 시간에는 JVM의 힙/스택 구조, 변수 타입, 자바 8에서 새로 생 긴 기능들, DB connection Pool의 구현, HTTP의 Keep-alive란? 등 기초적인 자바기반 웹개발 상식을 질문받았습니다.","기반, 구조, connection, HTTP"
"포트폴리오와 관련된 질문, 포트폴리오에 작성된 프로젝트의 진행 방법",방법
주어진 문제 해결방안 설명 주어진 구조로 어떻게 서비스를 구성할 것인가 개선해야할 점은 없나 예상되는 문제점은 무엇인가,"구조, 서비스"
"프로세스와 스레드의 차이점 말하기, 문맥교환이란 무엇인가",교환
스프링 아키텍쳐 짜기 java 및 자료구조 기초지식 디자인패턴 지식,구조
"RESTFul 에 관해 설명 Monolithic 서버와 Microservice 에 대해서 아는대로 채용방식 스킬테스트, 개인면접 발표시기 5일 후 ""서류 합격 후 메일로 코딩테스트 안내를 보냅니다. 코딩테스트 수준은 그렇게 어렵 지 않고 다만 약간의 함정이 있는데 그 부분만 넘어가면 됩니다. 해커랭크로 시험봅 니다. 전화면접에서는 경력사항 확인과 기본적인 전공지식을 테스트합니다."" 대기중 긍정적 도움이 돼요 1","서버, service"
"1. 서류 2. 코딩테스트 (알고리즘 문제 3개. 자신있는 언어 선택해서 풀면됨. 어렵지 않음) 3. 화상면접 (면접관 2명이 진행하며, 자기소개 및 경력사항 설명, 지원한 직무에 대한 이해 확인) 4. 기술면접 (면접관 4명, 대부분 화이트보드에 그림 그리고 손코드짜고 하며 강도높게 진행됨. 진행하 는 1시간반동안 주로 앞에서 설명하고 코드짜야되므로 앉아있기보다 서서 진행한다고 보면됨. 경력사항에 적힌 내용을 자세히 확인하려는 의도는 알겠으나, 특정부분을 즉석에서 손코드로 짜보라고 해서 좀 당황하였음. 이후에도 계속 말로 주문하며 질의하고 개선 요구함. 프로젝트 경력이 많아도 면접관들이 관심있지 않은 프로젝트는 물어보지 않음. 소프트웨어를 설계하는 능력과 프로젝트경력 보다 언어를 얼마나 이해하고 손으로 짤정도로 문법을 외 우고 있냐를 보는듯한 느낌이 들었음. 다시는 경험하고 싶지 않은 면접 채용방식 스킬테스트, 개인면접 발표시기 3일 후 ""1. 서류 2. 코딩테스트 3. 화상면접 4. 기술면접 (면접관 4명(지원한 직무 관련자 3명과 다른부서에 전문가1명)으로 구 성되며 대부분 화이트보드에 그림그리고 코드짜고 하며 강도높게 진행됨. 진행하는 1시간30분동안 앉아있는 시간보다 서있는 시간이 더 많았을 정도로 다소 힘이들었 음. 경력사항에 적힌 내용을 자세히 확인하려는 의도는 알겠으나 특정부분을 손코 딩으로 짜보라고 해서 당황하였음. 손코딩으로 짜면서 계속 주문하며 개선시켜보라 고 함. 소프트웨어를 설계하는 능력과 프로젝트경력 보다 언어를 얼마나 이해하고 손으로 짤정도로 문법을 외우고 있냐를 보는듯한 느낌이 들었음. 다시는 경험하고 싶지 않은 면접."" 불합격 부정적 도움이 돼요 6",질의
"자기소개를 하고 나서 대부분 경력에 관해 질의하였음. 가장 많은 시간을 들인 프로젝트에 대해서 그림을 그리며 자세하게 설명 필요함 특정 부분에 대해서는 수도코드 작성을 요구하며, 궁금한 부분에 대해서 질의함.",질의
L2스위치의단점이 무엇인가 Ipv6는 몇비트인가 dna 리퀄시브란무엇인가 bgp를 아는대로 말해보라 등등,"스위치, 비트"
"이전회사의 조직규모와 인원, 업무 프로세스, 자료구조, 단점 ""전화면접이라고 간단히 본다더니만 1시간 반동안 일반 대면면접과 동일한 과정을 거쳤음. 근데 질문 수준이 진짜..신입사원한테 물어볼만한 질문들과 전직장의 대외 비정보만 캐내려고함"" 액 3000억원 이상 신성통상(주) 포지션 9개 채용 중 2 코이즈(주) - 기업 랭킹 채용 뉴스 연봉 이직 뽐뿌 오는 날 5분 완성, 1년 간 기업정보가 무료!    제휴 대학 서비스  회사소개 이용약관 개인정보처리방침 커뮤니티가이드라인 모바일 버전 공지사항 광고 및 제휴문의 고객 문의 FAQ | | | | | | | | (주)브레인커머스 서울특별시 강남구 테헤란로 509 엔씨타워 I, 10층 | 대표   황희승, 윤신근 | 개인정보보호관리자   윤신근 사업자등록번호   120-87-92182 | 통신판매업 신고번호   제2014-서울강남-02942호 | 유료 직업소개사업 등록번호   (국내) 제2017-3220163-14-5-00046호 대표번호   1644-5641 (10:00~17:00 / 매월 마지막 금요일 09:00~13:00 / 주말 및 공휴일 휴무) | 대표이메일 : customer_service@jobplanet.co.kr ©Jobplanet. All rights reserved. 57 58 59 60 61 온라인 지원","구조, 서비스, 버전, 번호, service"
"TCP/UDP 차이, 3-handshaking 과정 설명, hashmap, hashset 차이 채용방식 PT면접, 개인면접 발표시기 5일 후 ""전화 면접에서 기본적인 수준의 전공 기초를 물어봄. 1차 면접에서는 자기소개서 바탕으로 프로젝트 진행한 것에 대해 질문이 꼬리로 이 어지고 더 심화된 전공 기초 지식에 대해 물어본다."" 대기중 긍정적 도움이 돼요 1","TCP, UDP"
"1. 자기소개 - 맡고 있는 업무에 대한 구성원 질문 - 당신이 실제로 맡은 업무는? - 업무에 사용하고 있는 솔루션은? 2. 개발한 안드로이드 앱에 대한 기능 구현 설명 - 면접관이 앱을 실행시켜서 실제로 확인 - 앱에 들어간 기술을 깊숙히 설명 요청(HTML파싱, 이미지 로딩 등) - 앱에 들어간 특정 로직에 대하여 질문함 - 서버를 사용하는지 확인 3. 지원한 직군에 대한 질문 ""원격 인터뷰는 평일 오후 2시에 진행하였음. (진행시간 50분) 면접관 2명(관련 직군)이 면접 진행"" 액 3000억원 이상 데브시스터즈(주) 포지션 0개 채용 중 3 엘티삼보(주) - 기업 랭킹 채용 뉴스 연봉 이직 뽐뿌 오는 날 5분 완성, 1년 간 기업정보가 무료!    제휴 대학 서비스","서버, 서비스"
Tcp 3 handshake Tcp backlog TCP 연결 유지 방식 Write through Write Back OS 튜닝 OS 장애 발생시 원인 분석 방법,방법
편한 분위기 속에 포트폴리오를 기반으로 질문합니다.,기반
"Spring AOP에 대해 설명해 보세요 Java VM의 구조에 대해 설명해 보세요 채용방식 개인면접 발표시기 10일 후 ""화상면접에서는 3명이 들어왔고 경력 위주의 질문을 받았음. 1차 면접에서는 4명 이 들어왔고 세부 기술 개념에 대한 질문을 많이 받았음."" 불합격 보통 도움이 돼요 0",구조
"1차 알고리즘 테스트 난이도 중~하. 문제를 제대로 이해하고 그대로 구현하면되었음. 시공간복잡도를 따질 필요는 없었음. 7문제중, 4문제 이상 정답을 맞추면 합격. 2차 크롤링 개발 난이도 중. 카카오에서 호스팅 서버를 열고 API를 제공. 크롤링과 비슷한 메커니즘의 프론트 엔드 개발 이였음. 크롤링 성공시 점수가 부여되며, 쿼리량, 크롤링의 실패유무로 감점을 하는 방식. 자신의 최고 점수를 스코어보드로 띄워 실시간으로 자신의 순위를 볼 수 있었음. 1등은 23~24만점이였으며 50등 진입은 10만 초반대 100등 진입은 8만점대였음. 합격은 8만점 이상 커트라인이였음. 3차 알고리즘 테스트 준비중. 난이도 상으로 예상중.",서버
"코딩테스트는 4시간동안 3문제를 진행하였습니다. ""서류전형: 1주일 뒤 메일로 서류전형 합격메일 옴. 코딩테스트 안내 코딩테스트: 진행중"" 대기중 긍정적 액 3000억원 이상 (주)솔루엠 포지션 2개 채용 중 2 코이즈(주) - 기업 랭킹 채용 뉴스 연봉 이직 뽐뿌 오는 날 5분 완성, 1년 간 기업정보가 무료!    제휴 대학 서비스  회사소개 이용약관 개인정보처리방침 커뮤니티가이드라인 모바일 버전 공지사항 광고 및 제휴문의 고객 문의 FAQ | | | | | | | | (주)브레인커머스 서울특별시 강남구 테헤란로 509 엔씨타워 I, 10층 | 대표   황희승, 윤신근 | 개인정보보호관리자   윤신근 사업자등록번호   120-87-92182 | 통신판매업 신고번호   제2014-서울강남-02942호 | 유료 직업소개사업 등록번호   (국내) 제2017-3220163-14-5-00046호 대표번호   1644-5641 (10:00~17:00 / 매월 마지막 금요일 09:00~13:00 / 주말 및 공휴일 휴무) | 대표이메일 : customer_service@jobplanet.co.kr 60 61 62 63 64 신고하기 도움이 돼요 0","서비스, 버전, 번호, service"
코딩 테스트는 알고리즘 링크 주고 구현해서 풀기 코딩 면접은 면접관과 전화 연결 후 말해주는 알고리즘 라이브 코딩하기 1차 면접은 지원 직무 관련 심화 질문,링크
"지원서에 쓴 프로젝트 관련 질문과 전공 질문(특히 알고리즘, 자료구조)에 대해 물어봅니다.",구조
"자동 완성의 경우 이진트리로 자료구조를 만들었는데, 그 이유는 무었인가?","트리, 구조"
"지원동기및 회사에대한자기역량을 펼칠수잇는방법을제시하시오 발표시기 30일 후 ""좋은분위기에 차곡차곡 하나하나 세세하게 물어보는게 긍정적으로작용"" 대기중 보통 도움이 돼요 0",방법
"미적분 B트리 삽입정렬 선택정렬 퀵소트 정규화 비정규화 이진검색트리 인덱싱 캐싱 디비클러스터링 서버로드밸런싱 이미지클러스터링 리스트 링크드리스트 앵귤러2 리액트 Virtual DOM 설명 ES6 Build Process 설명 Deploy Server Git Flow isolation level Graph 최단거리 ACID CRUD ""서류전형은 메일로 하루내에 알고리즘 코딩 1차 면접은 4인 압박면접 2시간정도"" 액 3000억원 이상 오진상사(주) 포지션 10개 채용 중 2 코이즈(주) - 기업 랭킹 채용 뉴스 연봉 이직 뽐뿌 오는 날 5분 완성, 1년 간 기업정보가 무료!    제휴 대학 서비스  회사소개 이용약관 개인정보처리방침 커뮤니티가이드라인 모바일 버전 공지사항 광고 및 제휴문의 고객 문의 FAQ | | | | | | | | (주)브레인커머스 서울특별시 강남구 테헤란로 509 엔씨타워 I, 10층 | 대표   황희승, 윤신근 | 개인정보보호관리자   윤신근 사업자등록번호   120-87-92182 | 통신판매업 신고번호   제2014-서울강남-02942호 | 유료 직업소개사업 등록번호   (국내) 제2017-3220163-14-5-00046호 64 65 66 67 68","트리, 서버, 로드, 링크, 서비스, 버전, 번호"
"경력에 대한 심층 질문, Spring 프레임웍 등의 기술 기반에 대한 심층 질문","프레임, 기반"
논문 링크를 보내주고 정해진 시간안에 구현하는 문제.,링크
자바 인터페이스 왜 쓰는지 자바스크립트 디스 깃에 관한것,인터페이스
"자신의 경력에 대해서 짧게 설명하고 설명한 내용과 이력서에 기술한 내용을 기반으로 질문받았으며, 대답하는 도중에 나온 다른 개념들에 대한 추가적인 질문을 받는형식으로 진행되었습니다.",기반
나의 경우에 코딩 테스트 과제를 전달받아 작성 후 기술 면접시에 pt 를 하였음.,전달
"어떠한 알고리즘 문제 해결방법을 칠판에다 작성해보시오. 작성한후에는 칠판을 보면서 부분 부분 물 어봄. 채용방식 스킬테스트, 개인면접 발표시기 1일 후 ""인성 부분은 준비했지만.. 거의 물어보지 않았음. 기술적인 부분을 많이 강조 하셧고 어려운 문제들도 많이 나왓음. 면접 분위기는 무 겁지 않아서 좋았다 면접관에 따라 많이 바뀌는 듯"" 합격 긍정적 도움이 돼요 0",방법
간단한 자기소개 후에 경력 위주로 질문을 받았습니다. 꼬리를 무는 질문이 많았고 본인이 실제로 업무를 진행했는지 확인하는 질문이 많았습니다. 논리적인 질문도 하나 있었습니다. 실무질문이 80% 인성질문이 20%정도였습니다. 2차면접은 심화실무질문이 대부분이었고 인성질문은 거의 없었습니다. 알고리즘이나 자료구조의 대한 질문도 있었습니다.,구조
웹서비스의 뒷편 구석구석을 물어본다. 자세하게 쓰긴 어렵지만 개발을 하면서 그냥 지나갈수있는 부분을 다 물어본다. 서비스를 운영하며 발생하는 이슈처리방법에 대해서도 물어본다.,"서비스, 방법"
"map/set/list차이점, 자바의 serializable과 안드로이드 parcelable의 차이 등 채용방식 스킬테스트, PT면접, 개인면접 발표시기 7일 후 ""면접관 네 분이었고, 약 50분간 진행되었습니다. 면접관 세 분이 실무자 같았고, 한 분은 다른 팀 분이거나 인사팀 분이 아닐까 생각합니다. 세 분의 실무자 모두 저를 편하게 해주시려고 노력했고 굉장히 매너가 좋았습니다. 처음에 1분 자기소개 하고 제 경력 관련해서 질의 응답 이뤄졌습니다. 그리고 과제 보면서 리뷰 하면서 기술적 질의 응답을 했습니다. 이 때 거의 예상되는 질문들을 했습니다. 최대한 대답을 유도 하기 위해 질문하는 형태였습니다. 과제 관련해서 공부 많이 하면 되겠습니다."" 불합격 긍정적 도움이 돼요 0","질의, 응답"
"본인의 포트폴리오 기반으로 질문한다. 어떤식으로 설계했는지, 무엇을 사용했는지, 어려운 점은 뭐가 있었는지 등 꼬리에 꼬리를 무는 질문이 계속됨. ""서류, 1차, 2차 인터뷰가 진행됨. 1차는 해당 직군의 면접관이 참여, 2차는 임원급 면접관이 들어옴. 1(면접자) 대 2~3(면접관)으로 보며, 했던 포트폴리오를 기반으로 전문적인 질문 위주로 진행 됨."" 합격 긍정적 도움이 돼요 0",기반
"기본적인 IT 지식, 서버, JAVA에 대한 이해도, 개발간 경험에 대해서 물어보셨습니다",서버
자기 소개 이직 사유 했던 프로젝트 상세 설명 이력서 상에서 궁금한 것들 자바 최신 버전 장단점 사용했던 프레임워크 장단점 스크립트 언어 장단점 조인의 종류 마지막 질문 있는지,"버전, 프레임"
"1차 면접의 경우 경력으로 지원해서 주로 포트폴리오 상의 프로젝트를 위주로 질문이 이어졌으며, 그 외에 기술적인 질문과 커뮤니케이션, 인성에 대한 질문이 있었습니다. 임원 면접 또한 비슷하게 질문을 받았으며, 1차보다는 심화 기술면접의 느낌이었습니다. 프로젝트에 대한 질문과 서비스 경험, 학습 방법, 데이터베이스에 대한 질문이 있었습니다. ""카카오 지원 공고 사이트에서 지원 후 1주일 안에 메일로 서류 합격 통보를 받았으 며 따로 과제는 없었고, 서류 통과 후 1주일 간격으로 1차 면접 및 임원 면접을 진행 했습니다. 둘 다 1:3으로 진행되었으며 한 시간 정도의 시간이 소요되었습니다. 면접 후 결과 안내는 1차 및 임원 면접 모두 하루 뒤에 받았습니다."" 액 3000억원 이상 데브시스터즈(주) 포지션 0개 채용 중 2 코이즈(주) - 기업 랭킹 채용 뉴스 연봉 이직 뽐뿌 오는 날 5분 완성, 1년 간 기업정보가 무료!    제휴 대학 서비스  회사소개 이용약관 개인정보처리방침 커뮤니티가이드라인 모바일 버전 공지사항 광고 및 제휴문의 고객 문의 FAQ | | | | | | | | (주)브레인커머스 71 72 73 74 75","서비스, 방법, 버전"
"자소서 및 포트폴리오 기반으로 질문이 들어옴. 어떤 경험을 했는지, 새로운 사항을 배우기 위해서 평소 어떤 노력을 하는지 등등 조직에 잘 녹아들 수 있는 인원인지 확인하고자 하는 질문이 많은편.",기반
"과제에 대한 코드리뷰 진행. 왜 그렇게 구현했는가, 더욱 성능을 좋게 할 수 있는 방법은 있나 등등 질 문. 간단한 디자인 패턴 질문하고 기본적인 기술 지식 문답함.",방법
"몇 가지 질문을 다음 분을 위해 공유합니다. 화이트 보드 코딩 질문 1. 문자열 리버스 함수 구현 2. 앞에 작성된 문자열을 TDD로 구현해보세요. 3. 싱글턴을 구현 해보세요. 서버 관련 질문 1. 리눅스 사용 해봤냐? 2. 서버가 1억대가 있고 서버에 데이터가 request가 저장되는 건이 1억건일 경우 어떻게 수집하고 구 성할 것인가? 3. Apache 와 Tomcat 의 연동 이유는 ? Was 로만도 웹 서비스가 사용이 가능할텐데 굳이 apache로 사용하는 이유는? 3-1. Apache 와 Tomcat 의 연동 방법은? 4. 서비스 운영 시 장애 경험은? 어떻게 해결했는가. 5. 서버스 운영 시 장애확인 이 불가능하다 (ex. 모니터링, 로그 부재 등) 이 같은 경우에는 어떻게 처리 할 것인가? 6. 서버가 이유없이 행이 걸렸다. 어떻게 처리할 것인가? 개인 생활 관련 질문 1. 회사에서 주어진 업무가 재미가 없고 다른 업무가 재미가 있다면 어떻게 하겠는가? 2. 기술 공부는 어떻게 하나? 이 밖에 다수..","버스, 서버, 데이터, 수집, 서비스, 방법"
경력기술서와 포트폴리오 내용을 기반으로 질문이 있었습니다. 그리고 진행했던 프로젝트를 화이트보드에 써가며 설명하도록 했습니다.,기반
"과제의 코드를 왜 이렇게 작성했는지, 나라면 이렇게 했을텐데 어떻게 생각하는지요? 기타 신기술에 대 한 동작 원리 질문 안드로이드 생명주기, Thread, 직렬화, 자료구조 등에 대한 정의와 차이점들, 경험담, 극복방법 등 계속 해서 연계적인 질문 카카오를 지원한 이유","구조, 방법"
이론적인 개발관련 부분을 질문하며 이전회사에서의 개발 환경 및 코드 작성방법에 대해 질문했습니 다.,방법
"오픈소스 내부 로직. 해당 라이브러리 선정/사용하는 이유. 자바 기본 클래스 내부 메소드 로직. 채용방식 스킬테스트, 개인면접 발표시기 1일 후 ""면접 분위기는 편함. 기술면접은 과제 코드리뷰와 사용한 오픈소스 설명. 이력서에 기재한 경력내용과 해당 기술 설명. 임원면접도 기술면접이었음. 난이도가 어려웠고 답변을 못함."" 불합격 긍정적 도움이 돼요 1",클래스
다대일 의 분위기 경력에 대한 질문과 기술서의 내용들을 기반으로해서 디테일하게물어봄,기반
"HTTP클라이언트에서 요청을 보낼 때 요청/응답이 어떤식으로 진행되는지 설명하시오 채용방식 개인면접 발표시기 3일 후 ""1차면접은 기술면접으로 기술면접 난이도 자체는 그렇게 높지 않은 편. 고급기술보단 기초가 다져진 정도를 보는 편 2차면접은 인성면접이지만 어느정도 기술면접도 봄 1차가 기--------술 + 인성 면접이었다면 2차는 기술 + 인--------성 면접"" 합격 긍정적 도움이 돼요 1","HTTP, 클라이언트, 응답"
"알고리즘/데이터 구조 질문 과제가 있었음. 과제 결과물이랑 코드 보고 왜 이렇게 했냐, 어떻게 구현했냐? 어려운건 없었냐? Component이런건 어떻게 동작할꺼 같냐? 동작을 어떻게 구현하겠느냐? Framework 소스는 보는 편 인가?",구조
"실무경험 확인 java 기본 개념 자료구조와 간단한 알고리즘 구현 채용방식 스킬테스트, 개인면접, 기타 발표시기 30일 후 ""서류 면접, 코딩테스트, 실무면접, 임원면접, 연봉협상"" 합격 긍정적 도움이 돼요 1",구조
서버 운영중 장애가 발생 했을 경우 어떤 방법론으로 문제에 접근하고 해결하겠습니까?,서버
면접관이 제시하는 화면에 대한 구현과 내부 데이터 로직에 대한 설명,데이터
알고 있는 자료구조와 알고리즘에 대해 설명하시오. 지원한 이유는 무엇인가요?,구조
카카오의 가장 좋았던 서비스가 뭔가요? 카카오의 불편했던 서비스는 무엇입니까?,서비스
크게 어려움 없이 진행 프로젝트 경험 및 레거시 코드에 대한 이해 방법등 물어봄 jpa 사용 중 힘들었던 부분 물어봄,방법
"- 이력서에 근거해 질문, 특히 포트폴리오의 내용에 대해 상세히 물어봄 - 답변 이후 전공 지식 (자료구조, 알고리즘) 을 물어봄",구조
"자바로 밴딩머신(자판기)설계한다면 어떻게 설계할껀지 설명해보세요 채용방식 개인면접 발표시기 30일 후 ""기본적인 자바나 자료구조에 대해서 상세히물어보고 프로젝트한것들에 대해서 어 떻게 만들었는지 상세히 물어봄"" 불합격 보통 도움이 돼요 0",구조
"자료구조 및 언어특성, 과거 관련 프로젝트 관련하여 질문하였습니다",구조
"지금까지 해왔던 일과 가장 어려웠던 일 가장 인상적이었던 일을 물어봄. 거기서부터 기술적인 요소를 계속 캐내서 깊이있게 일을 했는지 시스템과 도메인에 대한 지식이 충분 한지를 파악하는 것 같음. 채용방식 개인면접 ""지인을 통해 서류를 접수했고 면접까지 2주쯤 걸린 것 같음."" 대기중 긍정적 도움이 돼요 0",시스템
전 직장에서 구현한 어플리케이션에 대한 질의 기초 자료구조 및 복잡도(시간 공간)에 대한이해 써킷브레이커 등 장애전파 관련 이슈에 대한 논의 msa아키텍처에 대한 이해,"질의, 구조"
"지금 이 프로젝트를 사용자 입장에서 기능적으로 어떻게 더 개선할 수 있겠는가? 채용방식 개인면접 발표시기 7일 후 ""실무면접에서 프로젝트 과제를 면접 전 미리 내주고 면접 시 실무자분들 앞에서 설명하는 형식의 면접. 비교적 편안한 분위기이며 프로젝트에 대한 설명 후 전공지식 질문이이어진다."" 불합격 보통 액 3000억원 이상 데브시스터즈(주) 포지션 0개 채용 중 2 코이즈(주) - 기업 랭킹 채용 뉴스 연봉 이직 뽐뿌 오는 날 5분 완성, 1년 간 기업정보가 무료!    제휴 대학 서비스  회사소개 이용약관 개인정보처리방침 커뮤니티가이드라인 모바일 버전 공지사항 광고 및 제휴문의 고객 문의 FAQ | | | | | | | | (주)브레인커머스 서울특별시 강남구 테헤란로 509 엔씨타워 I, 10층 | 대표   황희승, 윤신근 | 개인정보보호관리자   윤신근 사업자등록번호   120-87-92182 | 통신판매업 신고번호   제2014-서울강남-02942호 | 유료 직업소개사업 등록번호   (국내) 제2017-3220163-14-5-00046호 대표번호   1644-5641 (10:00~17:00 / 매월 마지막 금요일 09:00~13:00 / 주말 및 공휴일 휴무) | 대표이메일 : customer_service@jobplanet.co.kr ©Jobplanet. All rights reserved. 83 84 85 86 87 신고하기 도움이 돼요 0","서비스, 버전, 번호, service"
"주로 사용했던 프레임웍이 다른 프레임웍 사이의 차이점을 설명해주세요. 채용방식 필기시험, 개인면접 발표시기 7일 후 불합격 긍정적 도움이 돼요 0",프레임
기술면접은 굉장히 어려웠습니다. 면접자의 수준이 높을 수록 어렵게 파고듭니다. 자바 GC의 동작 방식 레이아웃을 칠판에 그린 후 구현 방안 제시 WAS 메모리 최적화 등,AS
"진행했던 프로젝트에 대한 설명 특정 프로토콜에 분류와 질문 장애 상황에서의 대처 방안류 등 발표시기 20일 후 ""1/2차 면접 진행되며, 1차는 3명의 면접관과 1:1로 실무 면접 진행. 1:1로 진행하다보니, 좀 편안한 느낌도 있지만 실무 관련 생각보다 깊이 있는 질문 들도 많은 편. 3명이 순차로 진행하다보니 시간은 2시간에서 길게는 4시간까지 치뤄짐 2차는 인성적인 부분을 더 중점적으로 판단하며, 2:1로 진행. 1차보다 편안함"" 합격 긍정적 도움이 돼요 0",프로토콜
"처음 해보는 일일텐데 잘 할수 있겟느냐, 앞으로의 계획은? 등의 질문 채용방식 개인면접 발표시기 3일 후 ""이력서 제출후 연락이 와서 면접을 보았습니다. 압박면접은 아니고, 편안한 분위기 에서 자기소개관련 질의응답등을 가졌습니다."" 합격 긍정적 도움이 돼요 0","질의, 응답"
"자료구조 - 자료구조 제일 잘 아는거 하나 소개하고 설명해보시오. 운영체제 - 페이징과 플러싱의 개념 설명해보시오. 채용방식 스킬테스트, 그룹면접, 개인면접 발표시기 30일 후 ""나 볼 때만 해도 크게 난이도 높진 않았다. 하지만 요즘 면접 들어가보면 쫌 빡세게 본다. 평가 프로세스등도 체계적으로 잡혀나가는 중이다. 공부는 좀 하고 봐야한다. 특히 검색본부."" 합격 긍정적 도움이 돼요 0",구조
대용량 서비스 설계를 대략적으로 설명해보라는 질문,서비스
