question,extracted_terms
"1시간동안 3대1 면접이었습니다. 듣던대로 압박분위기는 전혀 없고 너무나도 친절하게 대해주셨습니다. 또한 듣던대로 전공관련 질의만 이뤄졌습니다. 포트폴리오가 없으시다면 기본 전공지식을 물어보실 것 이고 포트폴리오가 있다면 서류관련 기술질문을 하실 것입니다. 1. 가장 자신있는 언어는? 2. 퀵소트와 머지소트를 설명해보시오 3. 도메인을 입력하고 페이지가 열리는데까지 서버에서 어떤 일을 하는지? 4. 인덱스란? 5. 4 handshake, 3 handshade 의 차이 6. 마지막으로 하고 싶은 질문 7. 이외 만약 ~다면? 어떻게 할 것인가? 하는 즉시 생각해서 답변해야 하는 질문들(새로운 유형이라 재 밌었으나 제대로 코딩해본 경험이 많지 않으면 답변하기 쉽지 않을 것 같았습니다.) 8. 포트폴리오 관련 질문 꼬리물기식 심층질문을 하시되, 끄덕끄덕하신다던지 아닌 것 같으면 피드백을 해주신다던지 제 답변을 경청해주시고 있는 느낌을 받을 수 있었습니다. 많은 면접자분들이 얘기하시듯이 합/불여부랑 상관없이 실무자멘토와 대화를 나누다 온 느낌도 있어 서 좋았습니다. 면접동안 물도 가져가서 마시게 해주고 카페 이용쿠폰, 택시서비스, 기념품증정까지 면접자에 대한 배 려는 진짜 따라올 기업이 없을 것 같습니다.",도메인
"SQL JOIN, 코드 채우기, 업무 관련, 기술 관련","SQL, JOIN, IN"
컴퓨터 사이언스 일반 지식과 알고리즘 그리고 문제가 주어졌을때 문제 해결 능력등,알고리즘
"코딩테스트는 알고리듬 문제가 나왔는데 난이도는 기본 알고리듬 문제 수준이었습니다. 각 문제마다 코드에 comment로 설명을 쓰고 시간복잡도를 써야 했습니다. 필기시험은 사용했던 테크 경험에 관한 질문, 이론에 관한 문제, Java 문제, 코드 작성 문제 등이 있었습 니다. 전반적으로 정보처리기사 정도 수준 문제와 프로그래머라면 당연히 알아야 할 지식들이었습니 다. 1차면접은 다양한 질문들이 나왔는데 지금까지 제가 사용했던 테크스택에 관한 질문과 이전 직장들에 서 했던 업무에 대한 질문이 대부분이었습니다. Kafka 등 오픈소스 프로젝트에 대한 질문들도 있었습 니다.","정보, 로그"
"면접을 보기전에 1시간정도 필기시험을 치루고 3(면접관);1(나) 로 면접을 진행합니다. 필기는 C++전반적인 이해와 OS 스케쥴링, 알고리즘 으로 나왔고 전반적으로 문제는 쉬웠습니다. 특히 C++ Virtual 과 Class 실무 관련 문제가 많이 나왔습니다.",알고리즘
1. 자기 소개 2. 스레드/프로세스 3. 알고리즘 (2 개의 큐로 스택 생성),"프로세스, 알고리즘"
세션과 쿠키의 차이를 물어보는 o x 문제가 출제되었음,세션
"자소서에 기입된 프로젝트 관련 질문이 대다수. 기술스택 선택 시 얼마나 비교분석하고 선택했는지, 해 당 기술의 장단점에 대해 알고있는지, 사용한 기술에 대해 얼마나 깊게 알고 있는지 꼬리에 꼬리를 물어 질문 간단한 알고리즘 관련 화이트보드 코딩.","분석, 알고리즘"
TCP/UDP 차이 프로세스 / 쓰레드 차이 수행한 프로젝트 기반 질문들,프로세스
"자소서에 쓴 내용을 기반으로 직무에 관련된 질문이 많고 전공 과목에 대한 질문으로는 알고리즘 경우 에는 주어진 문자열을 담은 벡터에서 한 번 등장하는 문자열, 여러 번 등장하는 문자열을 구분하는 소스 코드 작성 문제가 있었습니다. 자료구조 경우에는 퀵소트와 머지소트의 알고리즘 설명, 운영체제 경우 에는 스케줄링 알고리즘에 대해서 구체적인 설명, 네트워크 경우는 TCP와 UDP 차이점 설명, 웹 경우에 는 GET과 POST 방식의 차이점과 각각 어떤 경우에 사용하는 것이 적당한지 질문이 있었습니다.","알고리즘, 네트워크"
1. realloc이 OS에서 어떻게 동작하는지 아는가? 2. RDBMS에서 엔진은 어떤걸 사용하는가?,DBMS
알고리즘 과 자료구조 문제 5개가 나왔습니다.,알고리즘
"1차 JAVA 웹개발 전반적인 내용, 트러블슈팅 처리 내용 그동안 개발했던 내용 정리 발표 2차 그동안 개발했던 내용 정리 발표 간단한 통계프로그램 설계","프로그램, 로그"
"서비스를 런칭한 경험을 자세하게 설명하고 역할을 부연함 ""실무 측면에서 성공한 사례를 물어봄 구체적인 사례를 필요로함"" (주)코드박스 [200억 ↑투자, 두나무 계열사] 소프트 웨어 엔지니어 3 ~ 10년, python, react, graphql, typescript, Django fra…  (주)자비스앤빌런즈 [대규모 채용] Backend Engineer 3 ~ 20년, java, Spring 합격보상 100만원  (주)쏘카 Backen 3 ~ 8년, J 합 액 3000억원 이상 신성통상(주) 포지션 9개 채용 중 2 (주)오픈노트 New 기업 랭킹 채용 뉴스 연봉 이직 뽐뿌 오는 날 5분 완성, 1년 간 기업정보가 무료!    제휴 대학 서비스",정보
특정 문제를 해결하기 위해 도입한 프로세스나 로직을 설명하고 채택한 이유에 대해서 설명하시오,프로세스
"제가 자기소개서에 기술했던 프로젝트에 대한 질문이 많이 나왔습니다. 왜 그렇게 구현했는지, 장/단점 은 무엇인지, 이러한 상황에서 어떻게 대처할 것인지 등 상세하게 질문 하셨습니다.",구현
"질문을 하고 답변의 꼬리를 무는 형식으로 면접이 진행되며, 대량 트래픽 및 서비스간 통신시 데이터 암 복호화에 관한 질문을 많이 합니다.",데이터
해왔던 프로젝트들 설명 네트워크 관련 질문들,네트워크
"압박면접이 될 수 있으니 마음을 단단히 먹고 갔지만 밑도 끝도 없이 까는 질문에 속수무책. 자기소개 이후 SW 개발에 포함된 특정 기술에 대한 설명을 시작함과 동시에 말 짜르고 공격. ""그 기술 안 좋다. 실제로도 안 쓰인다."" ""실제 기업에서 그 기술을 사용하는 것 본적 있냐""는 질문에 기술 세미나와 컨퍼런스를 통해 확인한 몇 몇 기업의 이름을 답변하니 ""그 회사들도 그거 안쓴다. 걔네도 어떤 기술인지 확인해볼려고 그냥 써보 는거다"" 이런식으로 반박이 들어옴. 그 이후에도 해당 기술에 대한 장점을 말해봤지만 전혀 들으려고 하지 않음. 한참을 질의응답을 한 뒤에 그 기술을 라인에 어떻게 적용할 것인지, 현재 라인에는 20년 이 상의 경력자들과 아키텍트들이 있는데 그들을 어떻게 설득할 것인지에 대해 질문함. 몇 가지 장점을 예를 들어서 답변했으나 그마저도 중간에 말 짜르고 ""그거 이미 다른 기술로도 다 된다. 우리는 이미 그렇게 구현해서 잘 돌아가고 있다""라고 반박함. 면접시간의 절반을 그 기술을 까는데에 다 써놓고선 라인에 이 기술을 적용해보라고 질문을 하니 손발 다 묶어놓고 헤엄쳐보란 얘기로 들렸음. 물론 이런 압박에도 현명한 답을 내서 면접관을 설득하고 자신을 어필하는 것이 면접이라는 전형의 특 성이지만 해도 해도 너무 한다는 생각이 들었음. 지원자 본인을 어필하는 자리가 아니라 특정 기술을 판 매하는 세일즈맨이 된 듯한 착각이 들 정도. 해당 기술을 공부하고 개발했다는 것에 자괴감이 들었음. 사실 그 기술 개발 이외에도 굉장히 많은 프로젝트를 진행해봤지만 그에 대한 질문은 전혀 없었고 심지 어 서류 때 제출한 포트폴리오의 존재조차 모르고 있음. 후반에 내가 얘기해서 그제야 파일 찾아보고 열 어 봄. 이외의 질문들도 신입 지원자에게 질문할 정도의 수준인가 의심이 들 정도로... 어렵고 알아 듣기 힘든 질문이었음. 면접에 임하기 전 여러 사이트의 면접 후기를 통해 약간은 부정적일 수 있다라는 것을 인지하고 갔지만 농락당하는 듯한 면접과 지원자에 대한 최소한의 파악도 안 된 면접관들로 인해 인생에서 기억에 남는 면접자리가 됐음. 면접에 임한 땐 이 부분을 참고해서 멘탈 단단히 챙기고 가싶쇼. 채용방식 개인면접 발표시기 13일 후 ""온라인 원서 접수 후 한달 반 후에 서류 합격 통보 받음. 서류전형이 너무 긴 것 같 아서 문의 메일을 몇 번 보냈지만 계속 차주에 발표날 것이라는 복.붙 한듯한 연락만 받음. 물론 차주에 발표가 나지 않았음. 그 후 면접 전형을 본 뒤 2주 후에 불합격 통 보받음"" 불합격 부정적 도움이 돼요 15","구현, 파일"
- 데이터베이스 샤딩 - 대용량 데이터베이스 최적화 방안 - HTML5 -> C++ 개발자한테... 왜 물어보는지??? - Jquery 로딩 방식 -> 하... 왜 물어봄???? - Overloading vs override -> 경력자한테 이딴걸???? - Dictionary 내부 자료구조 -> 질문 다운 질문! - Ajax 요청 타입 지정 방법 -> 슬슬 열받기 시작... !!!! - 람다식 화이트보드 코딩 - Binary 소트 알고리즘 C++ 화이트보드 코딩,"데이터베이스, 샤딩, 알고리즘"
본인의 프로젝트 위주의 질문을 함. 이런 부분은 어떻게 구현하였는가? 왜 그렇게 구현하였는가? 이건 어떻게 생각하는가? 등과 같이 한 부분에 대해서 꼬리를 무는 심도있는 질문을 함. 본인이 했던 프로젝 트와 사용했던 기술이나 툴 등에 대해서 리뷰를 해보고 가는게 좋을 것임.,구현
"프로세스와 스레드 차이 싱글톤 패턴에 대해서 ""서류 - 온라인 테스트 - 1차 -2차로 이어집니다 제가 경험한 면접관님들은 친절하나 다소 딱딱한 느낌이었습니다."" 액 3000억원 이상 (주)솔루엠 포지션 2개 채용 중 2 (주)오픈노트 New 기업 랭킹 채용 뉴스 연봉 이직 뽐뿌 오는 날 5분 완성, 1년 간 기업정보가 무료!    제휴 대학 서비스  회사소개 이용약관 개인정보처리방침 커뮤니티가이드라인 모바일 버전 공지사항 광고 및 제휴문의 고객 문의 FAQ | | | | | | | | (주)브레인커머스 서울특별시 강남구 테헤란로 509 엔씨타워 I, 10층 | 대표   황희승, 윤신근 | 개인정보보호관리자   윤신근 사업자등록번호   120-87-92182 | 통신판매업 신고번호   제2014-서울강남-02942호 | 유료 직업소개사업 등록번호   (국내) 제2017-3220163-14-5-00046호 대표번호   1644-5641 (10:00~17:00 / 매월 마지막 금요일 09:00~13:00 / 주말 및 공휴일 휴무) | 대표이메일 : customer_service@jobplanet.co.kr ©Jobplanet. All rights reserved. 33 34 35 36 37","프로세스, 정보, 번호"
일단 면접 관들의 취지는 뭔지 알겠으나 기본적으로 기본적으로 내 경력과 스터디 내역에 전혀 관심이 없음 경력이나 포부에 대한 질문이 전혀 없는 것은 니 경력엔 관심이 없다 우린 실력만 보겠다라는 당찬 포부로 이해해볼수 있겠으나 애초에 내가 주로 개발하고 R&D했거나 알고 있는 범위 내에서 물어봐야 하는데 면접관 세명이 각자 자신있는 분야에 대한 질문을 하는 것 같음 한명은 네크워크 쪽 암호화쪽 질문만 계속해대고 한명은 계속 모바일쪽 네이티브 개발과 응용프로그램 개발 쪽만 물어보다보니 계속 내가 경험한쪽과 정반대의 질문들만 이어짐 결론은 내가 메신저 개발팀에 지원한건가 착각이 들 정도로 응용프로그램 개발 분야와 네트워킹 관련 지식에 대한 질문이 주를 이루었고 정작 게임 개발 실무 테크닉 관련 질문은 거의 못받음,"프로그램, 로그"
1차 면접은 개발 실무자 3명과의 면접이었고 이력서를 기준으로 본인이 진행했던 프로젝트에 대해서 자세히 문답하는 방식으로 진행되었고 말로 대답하기 어려웠던 알고리즘 부분은 화이트보드 사용해서 설명하였음. 모바일 최적화 관련해서 했던 경험을 많이 물어보았음. 2차 면접은 1차때보다 상위직급인 것으로 보이는 면접관이 3명 들어왔으며 1차보다 더 집요하게 이력 서의 내용을 파고들어서 물어보았음. 행동 관련 질문도 몇가지 있었음. 인사팀과 간단한 인상면접을 따로 진행했음.,알고리즘
전반적인 프로그램의 이해 자료구조 자바클래스 api관련 Scjp및 최신기술동향,"프로그램, 로그"
"컴퓨터 공학과에서 수업을 잘 들었으면 충분히 풀 수 있는 문제들. O/S, DB, 코딩, 네트워크 등",네트워크
"운영체제, DB, 알고리즘, 자료구조 등 전반적인 학부 과정에 대한 내용이 출제됩니다. 채용방식 필기시험, 그룹면접, 개인면접 발표시기 14일 후 ""필기시험에서 개인별 노트북이 주어집니다. 지정된 이름의 파일에 문제가 적혀있 으며 정해진 시간 이내에 파일에 적힌 문제들을 풀어야 합니다."" 대기중 긍정적 도움이 돼요 2","알고리즘, 파일"
"알고리즘 문제, 자료구조 문제, jvm관련 질문들, 네트워크 관련 질문","알고리즘, 네트워크"
자료구조나 알고리즘을 묻더군요 경력에 대해서는 별로 관심 없는듯,알고리즘
"라인플러스의 서비스 중 개선해야 할 사항은 무엇인지 말해보세요 발표시기 30일 후 ""기본적인 알고리즘과 자료구조에 대해 물었고 손코딩을 했습니다"" 불합격 보통 도움이 돼요 0",알고리즘
"특별히 어렵지는 않았고 자료구조나 알고리즘을 공부했다면 충분히 답할 수 있는 수준의 질문으로 나 왔으며, 특정 플랫폼에 경험이 충분히 있는것이 도움이 됩니다. ""기술면접과 임원 면접을 나눠서 진행했습니다."" 합격 긍정적 도움이 돼요 1",알고리즘
데이터베이스 운영체제 디자인패턴 자바 기타 등등 무척 많은 기본 전산지식,데이터베이스
"1. 자기소개 2. 자신있는 기술 3. 게임 개발 중 자신있었던 기술 4. 영어로된 맵 리두스 알고리즘 손코딩 5. 마지막으로 하고 싶은말, 기업에 궁금한점",알고리즘
"자바,c로 알고리즘 해결방법에대해서 물어보았음.",알고리즘
자바를 주로 공부해야하며 기본적인 알고리즘 문제를 풀 수 있어야 합니다. 채용방식 필기시험 발표시기 14일 후 대기중 보통 도움이 돼요 1,알고리즘
언어는 무관한 알고리즘이나 네트워크 지식 등이 요구됩니다. 프로젝트에 대한 질문이 많습니다.,"알고리즘, 네트워크"
"NoSQL 과 RDBMS의 차이 Tcp/ip 의 순서 OSI 7layer 등 채용방식 개인면접 발표시기 4일 후 ""인턴 면접 프로젝트 사항이 몇개 있었는데 그 부분에 대한 질문이 주로 이루어짐. 화이트보드를 이용한 손코딩 면접 그리고 네트워크 데이터베이스 등 기본적인 전공 지식에 대한 내용으로 면접이 진 행됨"" 불합격 긍정적 도움이 돼요 0","NoSQL, SQL, DBMS, 네트워크, 데이터베이스"
"개인적인 질문과 팀활동 관련 질문, 그리고 다양한 분야의 전공 질문이 있었습니다. DB, OS, 네트워크, 자료구조, Java, C++ 등등",네트워크
"쓰레드, data structure, 안드로이드, IOS, 수학문제...",data structure
1. post와 get 요청의 차이점 2. tcp / udp 의 차이점 3. tcp 에서 close wait이 발생하는 경우 4. 2분기마다 늘어나는 컨텐츠에 대응하기 위해서 데이터베이스를 어떻게 운영해야 좋을지 5. tcp 에서 프로세스가 종료될때 소켓버퍼의 데이터를 전송하고 난 후에 종료되도록 하는 옵션은? 6. 하나의 인스턴스가 한번만 호출되도록 하기위해서 어떻게 구현해야 할까요? ( 싱글톤 관련 ) - 일부 소스 주고 나머지 채우기 7. 자바에서 가비지 컬렉터 구동 방식 8. 문자열 리버스하는 코딩 문제 등... 9. 소프트웨어 아키텍쳐 관련 책 읽은거 있는지? 10. 디자인패턴 책 읽은거 있는지?,"데이터베이스, 프로세스, 버퍼, 데이터, 인스턴스, 구현"
"대체로 프로그래밍에 필요한 기본적인 내용들이었다. 스프링에 개념에대해서도 많이 물어 보았다 채용방식 스킬테스트, 개인면접 발표시기 10일 후 ""1차 면접은 전화 면접. 2차는 프로그램 실무 면점,"" 합격 긍정적 도움이 돼요 0","로그, 프로그램"
"이전에 했던 프로젝트에 대한 경험에 대해서 질문하셨습니다. 어떤 문제가 있었는데 지금은 어떻게 해 결하고 있나, 혹은 어떤 역할을 맡았고 어떤식으로 구현하였나 같은 질문을 주셨습니다.",구현
"1차 면접은 실무 위주의 질문 경력위주의 자기소개- 이력서 경력에 대한 내용 답변 - 회사에 궁금한 점 질문 - 끝 디테일하게 프로세스에 대하여 물어보셨고 알고 있는 한 최대한 자세하게 대답, 업무분야 글로벌 플레 이어에 대한 질문 1차 면접관 2분 중 1분은 일본분이었는데 통역하시는 분이 함께 들어와서 면접 봄 압박면접 아니고 저 사람이 실제 어떠한 업무를 했는지 상당히 자세하게 물어보는 형식의 면접. 총 40 분 정도 진행. 2차 면접은 조금 더 까다로웠음 자신의 단점, 일하면서 동료들이 나에 대해 어떻게 생각했을지, 지금껏 프로젝트 중 보람 있었던 것, 자 랑할만한 것, 업계 전반에 대한 질문과 그 안에 약간 tricky한 질문이 나옴. 그런 질문은 평소 본인이 생 각했던 바를 답변하면 될듯.. 글로벌 플레이어 관련된 질문도 더러 있었음. 이 면접 또한 40분정도 진 행. ""헤드헌터를 통해 연락이 왔고 면접은 매우 빠르게 진행 1,2차 로 나뉘는데 나의 경우 1,2차 같은날 진행하였음 의사결정과정이 매우 빠름"" BEST 액 3000억원 이상 한화비전(주) 포지션 22개 채용 중 2 (주)오픈노트 New 기업 랭킹 채용 뉴스 연봉 이직 뽐뿌 오는 날 5분 완성, 1년 간 기업정보가 무료!    제휴 대학 서비스  회사소개 이용약관 개인정보처리방침 커뮤니티가이드라인 모바일 버전 공지사항 광고 및 제휴문의 고객 문의 FAQ | | | | | | | | 49 50 51 52 53","프로세스, 정보"
"콜백함수 정의 ERD 설명 동시성 문제 알고리즘 채용방식 필기시험, 개인면접 발표시기 7일 후 ""작년 공채 지원하였고 분위기는 다소 딱딱한 분위기 시험 보고 쓴 내용으로 면접 진행 일주일이내로 결과 메일로 통보"" 불합격 부정적 도움이 돼요 0","ERD, 알고리즘"
"주로 지금까지 진행했던 프로젝트 위주로 면접이 진행되었습니다. 어떻게 구현했는지 프로젝트 내 자 신의 역할은 무엇이었는지 등 ... 에 대해서 물어봤습니다. 채용방식 스킬테스트, 개인면접 발표시기 7일 후 불합격 보통 도움이 돼요 0",구현
"프로젝트관련한게 아니면 기초적인것만 물어봄 client가 웹어플에 접속할때 서버의 처리과정 이런거 채용방식 개인면접 발표시기 8일 후 ""서류통과하고 1차 전화면접을 봤는데 30분이내라는 안내를 받았는데......자기소 개서에 적힌 모든 프로젝트에 대해 꼼꼼히 물어보는데만 30분 기본적인거 물어본 다면서 오라클 스프링 자바 까지 다 물어봄 전화면접만 1시간넘게 봄"" 불합격 부정적 도움이 돼요 2",접속
"경력위주 질문과 프로그래밍 언어 깊이있는 내용에 대해 물어보네요. 채용방식 개인면접 ""헤드헌터를 통해 진행했습니다. 1차 기슬면접만 진행한 상태입니다."" 대기중 긍정적 도움이 돼요 0",로그
"1. 관심있는 과목에 대한 질문들 (왜 그 과목이 필요한지, 어떻게 생각하는지 등) 2. 자료구조, 알고리즘, 네트워크와 관련된 기본 문제 (쓰레드와 프로세스, OSI7계층, 트리와 그래프 등에 대해 물어보고 답변을 하면 그거에 대해 자세하게 또 물어보는 식) 3. 하고싶은 분야와 왜 그런지","알고리즘, 네트워크, 프로세스"
"자료구조, 서버프로그래밍, 웹프로그래밍 등 전반적인 전공에 대한 이해",로그
"자기소개 싱글톤 패턴을 화이트보드에 구현하기 안드로이드 액티비티 생명주기 스레드와 프로세스 데이터베이스 정규화 해시 테이블 마지막으로 하고싶은 질문 채용방식 필기시험, 개인면접 발표시기 8일 후 ""필기시험 합격 후 1차 면접을 보았습니다 면접관 두분이서 보셨고 분위기는 좋았습니다 자기소개와 마지막으로 하고싶은 질문을 제외하고 전공지식 관련 질문을 하셨습니다 면접비 받았습니다"" 불합격 긍정적 도움이 돼요 0","구현, 프로세스, 데이터베이스, 정규화, 테이블"
프로세스 / 쓰레드의 차이는 무엇인가,프로세스
"자기소개서에 작성한 프로젝트를 얼마나 이해하고 개발했는지 여부를 중요시 여기고 그에 따른 전공지 식을 물어봄 채용방식 개인면접 ""일주일 단위로 필기 - 면접이 진행된다"" 대기중 보통 도움이 돼요 0",단위
필기시험 내용을 왜 이렇게 구현했나? 이 외에 필기시험기반 문제를 묻습니다,구현
"신입이라 그런지 기본적인 것들을 위주로 물어봄. 알고리즘/자료구조/데이터베이스/네트워크에 대해 많이 물어봄. 채용방식 개인면접 발표시기 14일 후 ""지원서 쓰고 얼마 안 있어 메일로 인터뷰 보라고 연락 옴. 인터뷰 가겠다고 확정 메 일 보내야 함. 면접 후 2주 정도 후에 합불 통보 옴."" 합격 긍정적 도움이 돼요 1","알고리즘, 데이터베이스, 네트워크"
엔티티와 릴레이션이 무엇인가? 가비지 컬랙션이 하는일은 무엇인가?,"엔티티, 릴레이션"
"프로세스, 스레드 차이점 자소서 바탕으로 수행한 프로젝트 디테일하게 물어봄",프로세스
"프로세스, 스레드의 차이, TDD, 안드로이드, 디자인 패턴, 3G와 LTE 이동통신 등 매우 넓은 범위에서 물 어봅니다.",프로세스
"병합정렬의 시간복잡도를 설명하고 보드에 직접 코딩해보세요. 채용방식 필기시험 ""자료구조. 알고리즘. 등 전산학의 기초를 이루는 질문들이었습니다."" 합격 부정적 도움이 돼요 0",알고리즘
"자료구조. 멀티쓰레드. TCP/UDP차이점. Android에서 dp란? ios protocol, delegate, datasource 관 련. 암복호화 알고리즘(hex, AES256 등) 채용방식 개인면접 발표시기 10일 후 ""직무경력, 자기소개서 작성 후 이메일로 면접 일정을 통보받았습니다. 복 장은 세미캐쥬얼에 분당 그린팩토리에서 면접이 이루어졌습니다. 면접자 1명에 면 접관이 3명으로 진행되었습니다."" BEST 불합격 보통 도움이 돼요 6","protocol, data, 알고리즘"
"자료구조 문제입니다. 채용방식 필기시험, 개인면접, 기타 발표시기 0일 후 ""헤드헌터를 통해 1차면접까지 진행하였습니다. 안드로이드 개발자로 지원했습니다. Pre test 30분 있구요. 문제는 자료구조, 코드의 부족한부분 찾기 등 으로 구성되어 있었습니다. 면접은 3대1로 진행되었고 자료구조를 묻는 질문에 기본 용어(데드락 등)들에 대한 질문 등이 있었습니다. 면접관들은 버벅거리는 저에게 친절히 포인트를 집어주셨으며, 개인적으로는 배우 고 왔다는 느낌이 있었네요.(광탈 삘..ㅠㅠ) 정리하자면 자료구조에 관한 문제와 얼마만큼의 개발을 해보았는지를 중점적으로 물어보는 느낌이었습니다."" 대기중 긍정적 (주)쏘카 Backend Developer 3 ~ 8년, Javascript 합격보상 100만원  (주)트레드링스 Back-end 개발 상시 채용 경력무관, java, Spring, SQL, java spring 백엔드  (주)자비스 [대규모 3 ~ 20년, j 합 액 3000억원 이상 휴맥스홀딩스(주) 포지션 0개 채용 중 2 (주)오픈노트 New 기업 랭킹 채용 뉴스 연봉 이직 뽐뿌 오는 날 5분 완성, 1년 간 기업정보가 무료!    제휴 대학 서비스  신고하기 도움이 돼요 0","SQL, 정보"
"특별히 어려운 질문은 없었으며, 인성 쪽을 위주로 평가함 ""서류 전형 이후 1차 실무진 면접, 2차 임원 면접을 진행 2차 진행 시 거의 합격"" 합격 정보없음 도움이 돼요 0",정보
"1. 디자인패턴의 싱글톤패턴을 작성해보세요. 현재 코드는 멀티쓰레드일때 문제가 발생합니다. -> 무슨 문제이며 해결책을 제시해보세요. ""서류 통과후 기술면접 1회 진행후 탈락하였습니다."" 불합격 정보없음 도움이 돼요 0",정보
"어떤 질문에 대답을 하면 그 분야나 질문이 점점 난이도가 높아짐. 뒤로갈수록 정신도 없고 대답을 잘 못했음. ""기술 면접을 봤는데 40분동안 필기 시험을 보고 또 40~50분가량 면접자2 : 지원 자1로 기술면접을 봄."" 불합격 정보없음 도움이 돼요 1",정보
