question,extracted_terms
"이전회사의 조직규모와 인원, 업무 프로세스, 자료구조, 단점 ""전화면접이라고 간단히 본다더니만 1시간 반동안 일반 대면면접과 동일한 과정을 거쳤음. 근데 질문 수준이 진짜..신입사원한테 물어볼만한 질문들과 전직장의 대외 비정보만 캐내려고함"" 액 3000억원 이상 신성통상(주) 포지션 9개 채용 중 2 코이즈(주) - 기업 랭킹 채용 뉴스 연봉 이직 뽐뿌 오는 날 5분 완성, 1년 간 기업정보가 무료!    제휴 대학 서비스  회사소개 이용약관 개인정보처리방침 커뮤니티가이드라인 모바일 버전 공지사항 광고 및 제휴문의 고객 문의 FAQ | | | | | | | | (주)브레인커머스 서울특별시 강남구 테헤란로 509 엔씨타워 I, 10층 | 대표   황희승, 윤신근 | 개인정보보호관리자   윤신근 사업자등록번호   120-87-92182 | 통신판매업 신고번호   제2014-서울강남-02942호 | 유료 직업소개사업 등록번호   (국내) 제2017-3220163-14-5-00046호 대표번호   1644-5641 (10:00~17:00 / 매월 마지막 금요일 09:00~13:00 / 주말 및 공휴일 휴무) | 대표이메일 : customer_service@jobplanet.co.kr ©Jobplanet. All rights reserved. 57 58 59 60 61 온라인 지원","프로세스, 정보, 번호"
"1. 자기소개 - 맡고 있는 업무에 대한 구성원 질문 - 당신이 실제로 맡은 업무는? - 업무에 사용하고 있는 솔루션은? 2. 개발한 안드로이드 앱에 대한 기능 구현 설명 - 면접관이 앱을 실행시켜서 실제로 확인 - 앱에 들어간 기술을 깊숙히 설명 요청(HTML파싱, 이미지 로딩 등) - 앱에 들어간 특정 로직에 대하여 질문함 - 서버를 사용하는지 확인 3. 지원한 직군에 대한 질문 ""원격 인터뷰는 평일 오후 2시에 진행하였음. (진행시간 50분) 면접관 2명(관련 직군)이 면접 진행"" 액 3000억원 이상 데브시스터즈(주) 포지션 0개 채용 중 3 엘티삼보(주) - 기업 랭킹 채용 뉴스 연봉 이직 뽐뿌 오는 날 5분 완성, 1년 간 기업정보가 무료!    제휴 대학 서비스","구현, HTML, 정보"
Tcp 3 handshake Tcp backlog TCP 연결 유지 방식 Write through Write Back OS 튜닝 OS 장애 발생시 원인 분석 방법,"log, 분석"
"1차 알고리즘 테스트 난이도 중~하. 문제를 제대로 이해하고 그대로 구현하면되었음. 시공간복잡도를 따질 필요는 없었음. 7문제중, 4문제 이상 정답을 맞추면 합격. 2차 크롤링 개발 난이도 중. 카카오에서 호스팅 서버를 열고 API를 제공. 크롤링과 비슷한 메커니즘의 프론트 엔드 개발 이였음. 크롤링 성공시 점수가 부여되며, 쿼리량, 크롤링의 실패유무로 감점을 하는 방식. 자신의 최고 점수를 스코어보드로 띄워 실시간으로 자신의 순위를 볼 수 있었음. 1등은 23~24만점이였으며 50등 진입은 10만 초반대 100등 진입은 8만점대였음. 합격은 8만점 이상 커트라인이였음. 3차 알고리즘 테스트 준비중. 난이도 상으로 예상중.","알고리즘, 구현"
"코딩테스트는 4시간동안 3문제를 진행하였습니다. ""서류전형: 1주일 뒤 메일로 서류전형 합격메일 옴. 코딩테스트 안내 코딩테스트: 진행중"" 대기중 긍정적 액 3000억원 이상 (주)솔루엠 포지션 2개 채용 중 2 코이즈(주) - 기업 랭킹 채용 뉴스 연봉 이직 뽐뿌 오는 날 5분 완성, 1년 간 기업정보가 무료!    제휴 대학 서비스  회사소개 이용약관 개인정보처리방침 커뮤니티가이드라인 모바일 버전 공지사항 광고 및 제휴문의 고객 문의 FAQ | | | | | | | | (주)브레인커머스 서울특별시 강남구 테헤란로 509 엔씨타워 I, 10층 | 대표   황희승, 윤신근 | 개인정보보호관리자   윤신근 사업자등록번호   120-87-92182 | 통신판매업 신고번호   제2014-서울강남-02942호 | 유료 직업소개사업 등록번호   (국내) 제2017-3220163-14-5-00046호 대표번호   1644-5641 (10:00~17:00 / 매월 마지막 금요일 09:00~13:00 / 주말 및 공휴일 휴무) | 대표이메일 : customer_service@jobplanet.co.kr 60 61 62 63 64 신고하기 도움이 돼요 0","정보, 번호"
코딩 테스트는 알고리즘 링크 주고 구현해서 풀기 코딩 면접은 면접관과 전화 연결 후 말해주는 알고리즘 라이브 코딩하기 1차 면접은 지원 직무 관련 심화 질문,"알고리즘, 구현"
"코딩 문제는 인터넷의 특정 회사의 기술 소개를 읽고, 해당 기술을 구현하는 방식으로 진행. 4시간의 시 험 시간. 처음에는 4시간이면 길다고 생각했으나, 생각보다 간단한 부분들에서 시간을 많이 잡아먹어, 마치기 5초 전에 제출.",구현
"지원서에 쓴 프로젝트 관련 질문과 전공 질문(특히 알고리즘, 자료구조)에 대해 물어봅니다.",알고리즘
주어진 과제를 설명해주세요. 왜 그렇게 구현했습니까?,구현
"해쉬맵과 해쉬테이블의 차이 서블릿디스패쳐란 Api가 느리면 어쩔텐가 채용방식 그룹면접 발표시기 7일 후 ""1시간반 동안 기술적인 질문만 집중적으로 받음 면접관 3명 들어옴 세명다 개발자였고 나를 편하게해주려고 노력하는 모습이 보였 지만 너무 긴장하였음 화이트 보드에 업무 설명과 간단한 코딩테스트도있었음"" 불합격 긍정적 도움이 돼요 3",테이블
"직접 구현도 가능할 것 같은데 왜 오픈소스 라이브러리를 썼나? 직접 구현한다면 어떻게 할 것 같나? 오 픈소스 동작 방식을 알고있나? 채용방식 개인면접 발표시기 30일 후 ""간단한 소개 이후에 과제에 대한 코드리뷰 후 왜 그렇게 작성했는지에 대해서나 다 른 조건일때 어떻게 할것인지에 대해 물어봤습니다."" 대기중 긍정적 도움이 돼요 0",구현
"실무진 면접에선 알고리즘부터 디자인 패턴, 데이터베이스 등 다양한 전산 이론 및 실무에 관련된 내용 을 물어봅니다. 팀장급 면접은 경력에 관한 설명과 카카오에서의 포부나 관심 사항에 대해 물어봅니다.","알고리즘, 데이터베이스"
"1. 기술 면접 이력서에 작성한 내용에 내용이 주로 함 2. 사용 가능한 개발 언어 및 인프라에 대한 질문(기술적인 질문이나 언어, 개인 경력) 3. 일부 코드에 대한 최적화, 함수 구현하기등",구현
"미적분 B트리 삽입정렬 선택정렬 퀵소트 정규화 비정규화 이진검색트리 인덱싱 캐싱 디비클러스터링 서버로드밸런싱 이미지클러스터링 리스트 링크드리스트 앵귤러2 리액트 Virtual DOM 설명 ES6 Build Process 설명 Deploy Server Git Flow isolation level Graph 최단거리 ACID CRUD ""서류전형은 메일로 하루내에 알고리즘 코딩 1차 면접은 4인 압박면접 2시간정도"" 액 3000억원 이상 오진상사(주) 포지션 10개 채용 중 2 코이즈(주) - 기업 랭킹 채용 뉴스 연봉 이직 뽐뿌 오는 날 5분 완성, 1년 간 기업정보가 무료!    제휴 대학 서비스  회사소개 이용약관 개인정보처리방침 커뮤니티가이드라인 모바일 버전 공지사항 광고 및 제휴문의 고객 문의 FAQ | | | | | | | | (주)브레인커머스 서울특별시 강남구 테헤란로 509 엔씨타워 I, 10층 | 대표   황희승, 윤신근 | 개인정보보호관리자   윤신근 사업자등록번호   120-87-92182 | 통신판매업 신고번호   제2014-서울강남-02942호 | 유료 직업소개사업 등록번호   (국내) 제2017-3220163-14-5-00046호 64 65 66 67 68","정규화, isolation level, ACID, 알고리즘, 정보, 번호"
논문 링크를 보내주고 정해진 시간안에 구현하는 문제.,구현
"1.화이트보드로 간단한손코딩 2.전직장 업무설명하면서 화이트보드에 관련업무설명및 설계, 구현법 3.spring java 관련 이론질문. 4.개인성향에 관한 질문 채용방식 스킬테스트, 개인면접 발표시기 2일 후 ""분위기좋게 시작하였지만 꼬리에 꼬리를무는 질문. 잘 생각하고 답변해야지 안그 러면 처음했던말을 번복하며 정정해야한다."" 불합격 보통 도움이 돼요 0",구현
손코딩이었습니다 문제는 동적프로그래밍중에하나였습니다,로그
"어떠한 알고리즘 문제 해결방법을 칠판에다 작성해보시오. 작성한후에는 칠판을 보면서 부분 부분 물 어봄. 채용방식 스킬테스트, 개인면접 발표시기 1일 후 ""인성 부분은 준비했지만.. 거의 물어보지 않았음. 기술적인 부분을 많이 강조 하셧고 어려운 문제들도 많이 나왓음. 면접 분위기는 무 겁지 않아서 좋았다 면접관에 따라 많이 바뀌는 듯"" 합격 긍정적 도움이 돼요 0",알고리즘
간단한 자기소개 후에 경력 위주로 질문을 받았습니다. 꼬리를 무는 질문이 많았고 본인이 실제로 업무를 진행했는지 확인하는 질문이 많았습니다. 논리적인 질문도 하나 있었습니다. 실무질문이 80% 인성질문이 20%정도였습니다. 2차면접은 심화실무질문이 대부분이었고 인성질문은 거의 없었습니다. 알고리즘이나 자료구조의 대한 질문도 있었습니다.,알고리즘
"map/set/list차이점, 자바의 serializable과 안드로이드 parcelable의 차이 등 채용방식 스킬테스트, PT면접, 개인면접 발표시기 7일 후 ""면접관 네 분이었고, 약 50분간 진행되었습니다. 면접관 세 분이 실무자 같았고, 한 분은 다른 팀 분이거나 인사팀 분이 아닐까 생각합니다. 세 분의 실무자 모두 저를 편하게 해주시려고 노력했고 굉장히 매너가 좋았습니다. 처음에 1분 자기소개 하고 제 경력 관련해서 질의 응답 이뤄졌습니다. 그리고 과제 보면서 리뷰 하면서 기술적 질의 응답을 했습니다. 이 때 거의 예상되는 질문들을 했습니다. 최대한 대답을 유도 하기 위해 질문하는 형태였습니다. 과제 관련해서 공부 많이 하면 되겠습니다."" 불합격 긍정적 도움이 돼요 0",serializable
자기 소개 이직 사유 했던 프로젝트 상세 설명 이력서 상에서 궁금한 것들 자바 최신 버전 장단점 사용했던 프레임워크 장단점 스크립트 언어 장단점 조인의 종류 마지막 질문 있는지,조인
"1차 면접의 경우 경력으로 지원해서 주로 포트폴리오 상의 프로젝트를 위주로 질문이 이어졌으며, 그 외에 기술적인 질문과 커뮤니케이션, 인성에 대한 질문이 있었습니다. 임원 면접 또한 비슷하게 질문을 받았으며, 1차보다는 심화 기술면접의 느낌이었습니다. 프로젝트에 대한 질문과 서비스 경험, 학습 방법, 데이터베이스에 대한 질문이 있었습니다. ""카카오 지원 공고 사이트에서 지원 후 1주일 안에 메일로 서류 합격 통보를 받았으 며 따로 과제는 없었고, 서류 통과 후 1주일 간격으로 1차 면접 및 임원 면접을 진행 했습니다. 둘 다 1:3으로 진행되었으며 한 시간 정도의 시간이 소요되었습니다. 면접 후 결과 안내는 1차 및 임원 면접 모두 하루 뒤에 받았습니다."" 액 3000억원 이상 데브시스터즈(주) 포지션 0개 채용 중 2 코이즈(주) - 기업 랭킹 채용 뉴스 연봉 이직 뽐뿌 오는 날 5분 완성, 1년 간 기업정보가 무료!    제휴 대학 서비스  회사소개 이용약관 개인정보처리방침 커뮤니티가이드라인 모바일 버전 공지사항 광고 및 제휴문의 고객 문의 FAQ | | | | | | | | (주)브레인커머스 71 72 73 74 75","데이터베이스, 정보"
알고리즘 문제를 지급받은 맥북에 코딩하고나서 끝나면 모니터에 코드를 띄우고 그에 대한 설명을 쭉 합니다. 설명이 끝나면 자기소개부터 시작해서 본격적으로 면접을 시작하죠. 그동안 진행했던 프로젝 트에 대한 설명과 함께 기술적인 부분에 대한 질문과 답변이 꼬리에 꼬리를 물고 이어집니다.,알고리즘
"알고리즘 문제 한문제, 이전에 했던 것에 대한 질문, db 테이블 구성법","알고리즘, 테이블"
"과제에 대한 코드리뷰 진행. 왜 그렇게 구현했는가, 더욱 성능을 좋게 할 수 있는 방법은 있나 등등 질 문. 간단한 디자인 패턴 질문하고 기본적인 기술 지식 문답함.",구현
1분 동안 자신을 표현해보아라. 자신이 지원한 직무와 관련하여,표현
"몇 가지 질문을 다음 분을 위해 공유합니다. 화이트 보드 코딩 질문 1. 문자열 리버스 함수 구현 2. 앞에 작성된 문자열을 TDD로 구현해보세요. 3. 싱글턴을 구현 해보세요. 서버 관련 질문 1. 리눅스 사용 해봤냐? 2. 서버가 1억대가 있고 서버에 데이터가 request가 저장되는 건이 1억건일 경우 어떻게 수집하고 구 성할 것인가? 3. Apache 와 Tomcat 의 연동 이유는 ? Was 로만도 웹 서비스가 사용이 가능할텐데 굳이 apache로 사용하는 이유는? 3-1. Apache 와 Tomcat 의 연동 방법은? 4. 서비스 운영 시 장애 경험은? 어떻게 해결했는가. 5. 서버스 운영 시 장애확인 이 불가능하다 (ex. 모니터링, 로그 부재 등) 이 같은 경우에는 어떻게 처리 할 것인가? 6. 서버가 이유없이 행이 걸렸다. 어떻게 처리할 것인가? 개인 생활 관련 질문 1. 회사에서 주어진 업무가 재미가 없고 다른 업무가 재미가 있다면 어떻게 하겠는가? 2. 기술 공부는 어떻게 하나? 이 밖에 다수..","구현, 데이터, Apache, 로그"
재생목록 음악 셔플링 문제로 같은 아티스트의 곡이 연속되지 않도록 하는 알고리즘 구현,"알고리즘, 구현"
"과제의 코드를 왜 이렇게 작성했는지, 나라면 이렇게 했을텐데 어떻게 생각하는지요? 기타 신기술에 대 한 동작 원리 질문 안드로이드 생명주기, Thread, 직렬화, 자료구조 등에 대한 정의와 차이점들, 경험담, 극복방법 등 계속 해서 연계적인 질문 카카오를 지원한 이유",read
"알고리즘/데이터 구조 질문 과제가 있었음. 과제 결과물이랑 코드 보고 왜 이렇게 했냐, 어떻게 구현했냐? 어려운건 없었냐? Component이런건 어떻게 동작할꺼 같냐? 동작을 어떻게 구현하겠느냐? Framework 소스는 보는 편 인가?","알고리즘, 데이터 구조, 구현"
"실무경험 확인 java 기본 개념 자료구조와 간단한 알고리즘 구현 채용방식 스킬테스트, 개인면접, 기타 발표시기 30일 후 ""서류 면접, 코딩테스트, 실무면접, 임원면접, 연봉협상"" 합격 긍정적 도움이 돼요 1","알고리즘, 구현"
"1차 코딩테스트: 이메일로 문제를 받고 4시간 안에 작성한 코드와 결과파일을 제출. 문제는 영어로 출제됨. playlist에 있는 노래를 랜덤 재생할 수 있도록 셔플링하는 코드 작성. C++ 혹은 Python 으로 코드 작성시 가산점 있음. 전화코딩테스트: 행아웃으로 약속한 시간에 전화가 와서 약 1시간 동안 진행. 면접관에게 화면 공유를 해야함. 세 문제 출제. 1번과 3번 문제는 쉬워서 말로 출제. 2번 문제는 영어 지문을 읽고, 주어진 조건을 만족하는 코드 작성. (anagram 관련 문제였음.)",파일
소팅 알고리즘과 안드로이드 ipc 통신및 루퍼에 대한 사용법을 물어봤음,알고리즘
본인이 사용하고 잇는 개발언어를 이용하여 제귀함수를 이용해서 해당 문제를 풀어 보세요.,함수
기억나는 질문은 순환참조에 대해 설명하시오. 메모리 관리 기법에 대해 자세히 설명해주세요. OAuth가 먼가요 블러처리는 어떻게 했나요,참조
1. 본인이 이전 직장에서 했던 프로젝트 중 하나를 칠판에 그려 자세히 설명해 보시오. 2. thread local이란 무엇인가? 3. java에서 hashCode를 overrding할때 같이 override해야 하는 method는?,read
면접관이 제시하는 화면에 대한 구현과 내부 데이터 로직에 대한 설명,"구현, 데이터"
"알고리즘에 관한 문제가 있었고 프로젝트에 관한 내용중 기술적 질문을 많이 했음 채용방식 케이스 면접 발표시기 30일 후 ""인터넷으로 서류 접수 1주일후 1차 면접 일정 2주일후 2차 면접 합격"" 대기중 긍정적 도움이 돼요 0",알고리즘
기술면시에는 자기가 이력서에 적어놓은 스킬에 대해 상세하게 물어봄. 실제로 설계나 구현에 참여했는지 검증.,구현
"먼저 자기소개를 했고, 그 동안 했던 프로젝트들을 설명했습니다. 그리고 지원동기와 전공과목 중 좋아 하는 과목과 그 이유를 물었습니다. 전공질문은 간단한 정렬 알고리즘에 대해 나왔었습니다. 마지막은 질문하고 싶은 것을 각자 물어봤습니다. 면접은 50분정도 진행했던것 같습니다. 채용방식 그룹면접 발표시기 10일 후 ""고용 디딤돌지원으로 면접을 보고 왔습니다. 자기소개서는 자유양식이었고 서류 제출 후 일주일 정도 후 발표가 났습니다. 면접은 판교에 있는 사옥에서 봤고 3대3 면접으로 봤습니다."" 불합격 보통 도움이 돼요 0",알고리즘
알고 있는 자료구조와 알고리즘에 대해 설명하시오. 지원한 이유는 무엇인가요?,알고리즘
"논쟁을 해결하는 방식은 무엇인가요? Html 파서를 고른 기준은? Asynctask를 직접 만들수 있으신가요? 채용방식 스킬테스트, 개인면접 발표시기 17일 후 ""3일의 기한을 주그 유명 이미지 사이트의 뷰어를 만드는 프로젝트르 수행한후 그 구현을 실무자 3분과 코드 리뷰했습니다. 이후 임원면접을 봤었고 질문이 자세히 생각 나진 않는데 아규가 붙엏을때 어떻게 해결하느냐 같은 질문을 받았습니다"" 불합격 보통 도움이 돼요 0","파서, 구현"
"- 이력서에 근거해 질문, 특히 포트폴리오의 내용에 대해 상세히 물어봄 - 답변 이후 전공 지식 (자료구조, 알고리즘) 을 물어봄",알고리즘
직무와 관련된 프로그래밍 관련 질문들을 주로 하였습니다.,로그
"지금까지 해왔던 일과 가장 어려웠던 일 가장 인상적이었던 일을 물어봄. 거기서부터 기술적인 요소를 계속 캐내서 깊이있게 일을 했는지 시스템과 도메인에 대한 지식이 충분 한지를 파악하는 것 같음. 채용방식 개인면접 ""지인을 통해 서류를 접수했고 면접까지 2주쯤 걸린 것 같음."" 대기중 긍정적 도움이 돼요 0",도메인
"3:3 면접으로 팀장급 사원들이 면접을 직접 직행하고, 기술, 인성, 열정에 대해서 물어봤습니다. 질문 : 정렬 중 가장 빠른 정렬을 언급하시고, 알고리즘에 대해서 설명하세요.",알고리즘
전 직장에서 구현한 어플리케이션에 대한 질의 기초 자료구조 및 복잡도(시간 공간)에 대한이해 써킷브레이커 등 장애전파 관련 이슈에 대한 논의 msa아키텍처에 대한 이해,구현
"지금 이 프로젝트를 사용자 입장에서 기능적으로 어떻게 더 개선할 수 있겠는가? 채용방식 개인면접 발표시기 7일 후 ""실무면접에서 프로젝트 과제를 면접 전 미리 내주고 면접 시 실무자분들 앞에서 설명하는 형식의 면접. 비교적 편안한 분위기이며 프로젝트에 대한 설명 후 전공지식 질문이이어진다."" 불합격 보통 액 3000억원 이상 데브시스터즈(주) 포지션 0개 채용 중 2 코이즈(주) - 기업 랭킹 채용 뉴스 연봉 이직 뽐뿌 오는 날 5분 완성, 1년 간 기업정보가 무료!    제휴 대학 서비스  회사소개 이용약관 개인정보처리방침 커뮤니티가이드라인 모바일 버전 공지사항 광고 및 제휴문의 고객 문의 FAQ | | | | | | | | (주)브레인커머스 서울특별시 강남구 테헤란로 509 엔씨타워 I, 10층 | 대표   황희승, 윤신근 | 개인정보보호관리자   윤신근 사업자등록번호   120-87-92182 | 통신판매업 신고번호   제2014-서울강남-02942호 | 유료 직업소개사업 등록번호   (국내) 제2017-3220163-14-5-00046호 대표번호   1644-5641 (10:00~17:00 / 매월 마지막 금요일 09:00~13:00 / 주말 및 공휴일 휴무) | 대표이메일 : customer_service@jobplanet.co.kr ©Jobplanet. All rights reserved. 83 84 85 86 87 신고하기 도움이 돼요 0","사용자, 정보, 번호"
기술면접은 굉장히 어려웠습니다. 면접자의 수준이 높을 수록 어렵게 파고듭니다. 자바 GC의 동작 방식 레이아웃을 칠판에 그린 후 구현 방안 제시 WAS 메모리 최적화 등,"구현, AS"
"검색 알고리즘에 대한 문의, 컴파일의 과정과 실행의 과정, 데드락 등...에 관한 질문을 하고 관련 내용을 즉석에서 코딩을 하거나 설명을 하는 방식으로 진행","알고리즘, 파일"
"자료구조 - 자료구조 제일 잘 아는거 하나 소개하고 설명해보시오. 운영체제 - 페이징과 플러싱의 개념 설명해보시오. 채용방식 스킬테스트, 그룹면접, 개인면접 발표시기 30일 후 ""나 볼 때만 해도 크게 난이도 높진 않았다. 하지만 요즘 면접 들어가보면 쫌 빡세게 본다. 평가 프로세스등도 체계적으로 잡혀나가는 중이다. 공부는 좀 하고 봐야한다. 특히 검색본부."" 합격 긍정적 도움이 돼요 0",프로세스
"(1) 간략하 자기소개 - 간략히 지금까지의 경력 위주로 간략소개함 (1분정도 소요) (2) 지금까지 했던 업무(프로젝트) 중 가장 자신있는 부분을 기술적인 측면에서 화이트보드에 판서를 해가면서 디케일하게 설명 해주세요 - 대략 30분정도 설명 해나감 (겁네 힘듬) (3) 하루에 2테라 정도의 입력이 있는 시스템에서 본인이 ETL 시스템을 개발한다고 하면 어떻게 개발 할지에 대한 디테일 설명 해주세요 - 하둡/HBase 등등을 써서 이러쿵 저러쿵 할것 같아요 - 왜요 ? - 일단 2테라 데이터는 한방에 들어오는 데이터도 아닐거라 생각하며 - 말그대로 로그성 데이터를 주구장창 쌓아둘 스토리지가 필요하니 - 빅데이터 플랫폼 하둡을 얹어놓고, 데이터를 누군가에게 시각화 - 하기위해서는 HBase같은 빅테이블 관리 애플리케이션이 필요하고 - 그리하여 그렇게 구성하면 되지 않을까요 ? - 네 맞습니다. (난 참고로 ETL 해보지도 접해보지도 못함 ㅠ) (3) 자바에서 Netty에 대해 설명 해주세요 (4) 자바에서 가비지 컬렉션 혹은 성능상의 문제로 튜닝 경험기는 ? (5) 입사를 했다고 치고 업무가 무지 재미없다면 ? (6) 마지막 이 질문이 나를 빡치게 함 ㅎ - 근데요 . 인프라쪽을 많이 하셨는데요. => 참고로 난 클라우드 컴퓨팅, 소프트웨어 정의 스토리지를 2010.05 ~ 현재까지 하고 있음 - 왜 이쪽을 지원하셨어요 ? 저희 ETL은 그쪽은 아니구요.. - 경력자를 뽑는데 저희도 관련 분야가 적당할듯하며, 분야를 잘못 선택하셔서 지원 하신듯이요.. - 나갈려는데 안되더시라도 실망 마세요 ㅎ 빠잉~","데이터, 로그, 빅데이터, 테이블"
"기술면접 시 대용량 데이터 처리를 위한 서비스 아키텍처에 대한 설명을 요구하고 그에 대한 기술을 물 어보더군요. ""인터넷으로 지원 메일로 면접 일정 안내"" 불합격 부정적 도움이 돼요 0",데이터 처리
"자바, 프로그래밍 기술 관련 정보 등을 질문 최신기술에 얼만큼 아는지 질문 등 채용방식 그룹면접 발표시기 3일 후 ""인터넷으로 지원 서류 통과 전화로 통보 1차 면접 전화로 합격 통보 2차 면접 메일로 합격 통보"" 대기중 긍정적 도움이 돼요 1","로그, 정보"
"자기소개, 요즘 관심있는 서비스 및 콘텐츠, 기업에 대한 기본적인 정보 및 생각, 이력서에 적은 것 중 궁 금했던 것 등. 딱딱하지 않고 대화하듯 편안한 분위기 였으나 질문 속 맥락을 잘 파악해서 대답해야함.","콘텐츠, 정보"
"1. 5줄 이하의 파이썬 코드를 보여주며 화이트보드를 이용하여 풀도록 함. 2. 통계와 관련하여 MLE, MAP , 베이지언 정리 등에 대해 설명하라고 함. 채용방식 개인면접 발표시기 1일 후 ""채용 과정: 서류 - 1차 면접 - 2차 면접 분위기: - 면접관은 총 4명으로 제주도 지사에 있는 2명은 화상통신으로 참여함. - 분위기는 다소 부드러웠음. - 면접 질문은 체계적이지 못하고 자소서를 보면서 그때 생각나는 질문을 던짐. 특 히 제주도에서 화상통신으로 참여한 면접관의 태도가 굉장히 불량스러웠음. 면접 내내 비웃음과 무시, 비꼬는듯한 말투로 일관하였으며 자신도 정확히 알고 있지 못 하는 알고리즘 문제를 질문하여 논란만 초래함. 코딩 문제 한 문제를 출제."" 불합격 부정적 도움이 돼요 2",알고리즘
