question,extracted_terms
"면접 6일 전 쯤에 pt주제를 통보받아 면접 3일 전까지 pdf파일을 미리 제출해야하였습니다. pt주제 : 현재 간편결제 시장현황에 대해 분석하고 본인이 생각하는 아이디어 모델을 제안해주시기 바 랍니다. 면접 당시 받았던 질문은 자기소개하기 ( 자기소개서 내용에 빗대었던 물품을 다시 한번 언급할 것 ) 지원하게 된 계기 가장 자신있는 언어 등이 있었습니다. 분위기는 생각만큼 딱딱하지 않았습니다. 채용방식 PT면접, 그룹면접 발표시기 6일 후 ""하계인턴에 지원하였으며 5월 말 서류 합격 후 6월 초에 1차 면접을 본 후 합격 메 일을 6일 후에 받아 6월 중순 2차 면접을 보아야 하는 상황입니다."" 대기중 부정적 도움이 돼요 0","파일, 분석, 모델"
"db에 대해서 이론적인 질문을 많이받음 실무적인 경험에 대한 질문이 적음 채용방식 PT면접, 개인면접, 기타 발표시기 ""면접 자체는 평이한편 1차 2차면접이 존재함"" 라이언앤코(주) [경력] Java Web 개발자 모집 [주4일 출 근제 도입] 3 ~ 5년, java, Spring, aws, jquery, MYSQL, DB, was, 파…  111퍼센트(주) [111퍼센트] 1인 개발자 모집 경력무관, Unity, 유니티 합격보상 100만원  (주)코드박 [200억 웨어 엔 3 ~ 10년, 액 3000억원 이상 모트렉스(주) 포지션 30개 채용 중 2 코이즈(주) - 기업 랭킹 채용 뉴스 연봉 이직 뽐뿌 오는 날 5분 완성, 1년 간 기업정보가 무료!    제휴 대학 서비스","SQL, 정보"
(기술)정규화에 대해 설명해보시오. (인성)ebay 가 어떤 사람을 뽑는다고 생각하는가?,정규화
"자기소개 osi 관련질문 - 전공관련 질문은 1개 밖에 안함 프로젝트 하면서 힘들었던점, 기억에 남는점 네트워크 실무 관련 경험 물어봄 면접관에게 하고싶은 말 채용방식 개인면접 발표시기 7일 후 ""2:1 면접으로 아주 편안한 분위기 자소서 읽으면서 물어봄"" 불합격 긍정적 도움이 돼요 0",네트워크
"전공지식에 대해 알고리즘,자료구조,자바에 대해 물어봄",알고리즘
"1차 기술 문제는 10진수를 2진수로 변환하는 코드 작성, 복잡한 조인 쿼리 작성, 연결리스트의 원소 교 환 알고리즘, 바이너리 이진 탐색 알고리즘작성 2차 그룹 면접 100만 건의 데이터를 가장 빠르게 정렬하고 탐색하는 알고리즘은? 3차 cto에게 10가지 질문하기(대답이 아닌 질문을 하라고 해서 엄청 당황했음)","조인, 알고리즘, 데이터"
"학창시절에 개발한 프로젝트에서 사용한 프레임워크, 기술 등등을 상당히 자세히 물어봤었습니다. 채용방식 필기시험, 개인면접 발표시기 7일 후 ""하루에 코딩 필기시험 실장님과 1차면접, 부사장님과 2차면접 다 했습니다. 면접은 편한 분위기였고 능력보다는 같이 트러블 없이 일할 수 있는 사람인지를 본 다고 했었습니다."" 합격 정보없음 도움이 돼요 1",정보
"기술면접을 거의 준비하지못하고 가서, 기본적인 프로그래밍 언어에 대한 질문은 괜찮았으나 알고리즘 에 관힌 질문은 대답이 바로바로 생각이 나지 않았으며 저는 그때당시 안드로이드 프로젝트를 준비했던 경험을 얘기하 였지만 주력으로 생각하는 부분이 아니어서 그런지 큰 반응은 없었습니다.","로그, 알고리즘"
"2차 면접때 Database 쪽 이론 질문을 받았는데 Index관련 질문이 좀 당황스러웠습니다. 채용방식 필기시험, 개인면접 발표시기 40일 후 ""Tech본부 면접은 1차 손코딩 테스트를 마친 후 1차 합격 발표를 기다립니다. 2차 면접은 실무진과 1차 시험지를 기반으로 몇가지 기술적 질문을 주고 받습니다. 그후 합격 여부가 나오면 3차 경영진(상무/부사장) 면접이 있습니다. 3차까지 완료 되면 최종 합격 발표 기다립니다."" 합격 긍정적 도움이 돼요 2","Database, 완료"
"임원면접에서 왜 당신을 뽑아야하는가... 채용방식 필기시험, 스킬테스트, 그룹면접, 개인면접 발표시기 7일 후 ""코딩 테스트 어렵진 않으나 시간이 짧음 직무면접 지원자3 면접관1 자료구조 소프트웨어공학 내용 질문에 인성 지원동기 등도 물어봄 임원면접 총 세 단계 1. 면접관2 지원자3 인성 위주 2. 1대1 면접 개발경험 위주 3. 1대1 면접 인성 위주"" 불합격 보통 111퍼센트(주) [111퍼센트] 1인 개발자 모집 경력무관, Unity, 유니티 합격보상 100만원  (주)코드박스 [200억 ↑투자, 두나무 계열사] 소프트 웨어 엔지니어 3 ~ 10년, python, react, graphql, typescript, Django fra…  (주)박차컴 JAVA 개 5년 이상, j 합 액 3000억원 이상 한화비전(주) 포지션 22개 채용 중 3 롯데씨브이에스71… 3 기업 랭킹 채용 뉴스 연봉 이직 뽐뿌 오는 날 5분 완성, 1년 간 기업정보가 무료!    제휴 대학 서비스  신고하기 도움이 돼요 1",정보
"직무 면접에서도 기술 외의 것들을 많이 물어봤습니다. 아무래도 같이 일해야할 사람을 뽑는것이라 그 런지 학창시절 재미있었던 공부같은 것을 물어봤습니다. 발표시기 12일 후 ""IT 경력 2년입니다. 지인 추천으로 지원했구요 서류부터 직무면접까지는 상당히 빠르게 진행된것을 보 면 여기까진 실무자가 주관하는 것 같았습니다. 실무자가 주관하기 때문에 아마 면접 분위기도 팀별로 많이 다를거같습니다. 저는 네 분의 실무자들 앞에서 손코딩하고 코딩한 것에 대해 이것저것 자유롭게 나누었 습니다. 그 뒤 5일정도 뒤에 직무면접 합격 이메일과 인성검사 안내가 왔고 8일 뒤 토요일에 인성검사를 봤습니다. 그리고 지금이 그 다음주인 수요일인데 아직 연락이 없네요. 현재 대기중입니다."" 불합격 정보없음 도움이 돼요 0",정보
현 회사에 대해 수익요익이 무엇인지. 물어보실 때.. 분야와 관계 없다보니 확실한 답변을 못드렸습니 다.,관계
갑자기 알고리즘 퀴즈를 내셔서 당황했습니다.,알고리즘
"여러 공학적인 질문들이 많이 나왔습니다. 알고리즘을 활용하여 즉각적으로 문제를 풀어야하는 문제들 이 대다수였습니다. """" 회사에 대한 애정 어필이 중요 """" 불합격 정보없음 도움이 돼요 0","알고리즘, 정보"
"PT면접으로, 다른 지원자의 발표를 듣고 질문을 하게 하는 등 듣는 태도도 중요하게 생각하는 듯 합니 다. ""면접은 1차 2차에 나눠서 보고 현재는 1차 면접만 진행된 상태입니다. 1차면접은 주로 역량 면접이기 때문에 산업의 현황에 대해 잘 준비해가시는게 좋습니다."" 대기중 정보없음 도움이 돼요 0",정보
"기술면접을 예상하고 갔는데 의외로 개발자로써의 자세나 생각 등을 많이 물어봤습니다 설계에 대한 질문과 더불어 정렬 바이너리 서치등에 대한 질문등이 있었고 대체로 난이도는 평이했습니다 오히려 인성에 관련된 질문들이 준비가 안되있어서 그런지 더 어렵게 느껴졌던것같습니더 채용방식 필기시험, 그룹면접 발표시기 7일 후 ""서류보내고 몇일 후에 코딩 테스트 날짜 관련 연락이왔습니다 코딩테스트는 간단 한 알고리즘 문제들이 있었습니다 평소에 준비해왔다면 충분히 다풀만한 문제였습 니다 코딩테스트 합격통보 나자마자 바로 다음날 면접 봤습니다 기술면접과 인성면 접이 합쳐진듯한 형태였습니다 현재 1차면접 합격여부 기다리는중입니다"" 대기중 긍정적 도움이 돼요 0",알고리즘
"이베이코리아 사장이라면 어떤 서비스 기획할것인지? ""발표면접 및 역량면접을 단체로 봄. 이베이코리아 서비스 기획 간단하게 해서 전지에 작성하라 한 뒤 발표시킴. 발표 뒤 에는 그룹 역량면접. 단기간에 끝나고 바로 입사"" 불합격 정보없음 도움이 돼요 1",정보
객체지향 프로그래밍과 스프링에 대해서 물어본다. 경력이 없는 점을 비하하듯 말하는데 신입 면접 아 닌가요?,로그
"자소서 위주 기술 질문, JDBC란 무엇인가?, 오버라이드와 오버라이딩의 차이, 타인이 보는 본인의 장 단점",JDBC
사람들과의 관계는 어떤가 원만한가 본인하고 안맞는 사람이 있을땐 어떡할것인가?,관계
블럭속성. 그전에 했던 일. 팀장이되면 이끌 고 싶은 인재상 등 대부분 질문이 말 꼬투리잡아서 파생된 질문이거나 포트폴리오를 제대로 보지않았는지 포폴질문,속성
정보보호관리체계 인증 경험이 있는지 또는 얼마나 알고있는지,정보
"[면접 방식] 대면 질문 [참고 자료] 이력서, 자소서 및 경력사항, 포트폴리오 보면서 질문 진행 [주요 질문] _대학교 재학 및 졸업 이후 공백기 등에 대한 질문 (공백기가 1년 정도 있는데 그 기간동안에 무엇 했나요?) _특기 관련 질문 (특기가 특이한데 특기에 대해 상세하게 설명 좀 해 주세요.) _업무 관련 질문 (업무에 대해 본인이 가장 중요하게 생각하는 것은 무엇인가요?) ""[일정] 서류 접수 후 1주일 후 연락. [면접 횟수] 실무자 면접 1회 [시간] 2시간 면접 [장소] 회사 내 회의실에서 면접 진행 [분위기] 사내 카페 근처여서 다소 어수선한 분위기 / 긴장을 풀어주어 다소 편한하 게 면접 진행 가능 [면접관 특징] 팀장 1명과 실무자 1명이 면접 진행 / 실무자는 중간에 업무 복귀하고 팀장이 면접 이후에 회사에 대한 상세한 설명 해 줌. [면접 팁] 회사에 대해 많이 조사해 가면 좋음 / 본인 담당 업무에 대한 전문성과 지 식 기반으로 탁월하게 설명을 해야 좋은 평가를 받을 수 있는 것 같음."" BEST (주)트레드링스 Back-end 개발 상시 채용 경력무관, java, Spring, SQL, java spring 백엔드  리디(주) 백엔드 소프트웨어 엔지니어 7 ~ 12년, MYSQL, node.js, go, typescript 합격보상 100만원  (주)액션파 Back-e 4 ~ 15년, 합 액 3000억원 이상 데브시스터즈(주) 포지션 0개 채용 중 2 코이즈(주) 1 기업 랭킹 채용 뉴스 연봉 이직 뽐뿌 오는 날 5분 완성, 1년 간 기업정보가 무료!    제휴 대학 서비스","SQL, 정보"
"서류면접 이후 실기면접은 어렵지 않음 다만 임원들의 인상이 무서웠음 액 3000억원 이상 데브시스터즈(주) 포지션 0개 채용 중 2 코이즈(주) 1 기업 랭킹 채용 뉴스 연봉 이직 뽐뿌 오는 날 5분 완성, 1년 간 기업정보가 무료!    제휴 대학 서비스  회사소개 이용약관 개인정보처리방침 커뮤니티가이드라인 모바일 버전 공지사항 광고 및 제휴문의 고객 문의 FAQ | | | | | | | | (주)브레인커머스 서울특별시 강남구 테헤란로 509 엔씨타워 I, 10층 | 대표   황희승, 윤신근 | 개인정보보호관리자   윤신근 사업자등록번호   120-87-92182 | 통신판매업 신고번호   제2014-서울강남-02942호 | 유료 직업소개사업 등록번호   (국내) 제2017-3220163-14-5-00046호 대표번호   1644-5641 (10:00~17:00 / 매월 마지막 금요일 09:00~13:00 / 주말 및 공휴일 휴무) | 대표이메일 : customer_service@jobplanet.co.kr ©Jobplanet. All rights reserved. 4 5 6 7 8 면접경로 온라인 지원","정보, 번호"
전직장에서 어떤 개발을 했는지 데이터 구성 이해도 인성,데이터
참여했던 프로젝트 주제 / 팀프로젝트 내에서 맡은 역할 / 주로 유지보수일이 많을텐데 지겹지는 않을지,유지보수
"데이터베이스 관련, 포트폴리오 관련 전문 분야 지식을 물어보았습니다.",데이터베이스
"필기시험 중에 엘리베이터 버튼 그리는 거 있었음. 번역기 문장 자연스럽게 수정하는 것도 있었음. 채용방식 필기시험, 그룹면접 발표시기 7일 후 ""서류 -> 필기시험 및 1차 실무진 면접 -> 2차 임원진 면접 -> 결과발표. 거의 1~2일 텀으로 면접과 결과가 나옴. 다대다 면접. 필기시험은 상식 정도. 면접 질문 쉽고, 웬만하면 거의 다 붙음."" 액 3000억원 이상 대원씨티에스(주) 포지션 0개 채용 중 2 코이즈(주) - 기업 랭킹 채용 뉴스 연봉 이직 뽐뿌 오는 날 5분 완성, 1년 간 기업정보가 무료!    제휴 대학 서비스  회사소개 이용약관 개인정보처리방침 커뮤니티가이드라인 모바일 버전 공지사항 광고 및 제휴문의 고객 문의 FAQ | | | | | | | | (주)브레인커머스 서울특별시 강남구 테헤란로 509 엔씨타워 I, 10층 | 대표   황희승, 윤신근 | 개인정보보호관리자   윤신근 사업자등록번호   120-87-92182 | 통신판매업 신고번호   제2014-서울강남-02942호 | 유료 직업소개사업 등록번호   (국내) 제2017-3220163-14-5-00046호 대표번호   1644-5641 (10:00~17:00 / 매월 마지막 금요일 09:00~13:00 / 주말 및 공휴일 휴무) | 대표이메일 : customer_service@jobplanet.co.kr ©Jobplanet. All rights reserved. 7 8 9 10 11","정보, 번호"
빅데이터에 대해서 기존과 차이점을 알고 있냐는 질문.,"빅데이터, 데이터"
"특별히 어려웠던 질문은 없었고, 자기소개서 및 이력서에 적었던 내용을 토대로 물어봄 ""서류전형시 사용된건 자사 양식이었으며 특출난건 없었음. 이사2명 부장급 2명 과장급 0명정도로 기억함 대여섯명 정도의 지원자가 같이 들어가는 다대다 면접이었음. CEO는 미참석. 면접은 1회로 끝남."" 합격 정보없음 도움이 돼요 0",정보
"대체적으로 무난한 질문. 관심사에 대한 질문 많음 . 원하는 카테고리가 있다면 그 부분에 대한 질문함 ""간단한 상식과 산수 시험을 보고 면접을 봄. 각팀의 팀장들과 부장, 이사급 참석. 간 단한 자기소개 등 1~2개 질문"" 합격 정보없음 도움이 돼요 0",정보
"개콘과 웃찾사의 차이는? 엘리베이터 닫힘/열림 버튼을 새로 구성해 보세요. ""서류 - 간단한 테스트 - 면접 - 끝"" 합격 정보없음 도움이 돼요 0",정보
- 비전공자에게는 CS 이론 기반 질문 폭탄 (막판 질문 몰빵. Join에 대해 아는대로 설명하세요 같은 기 초적인 내용도 좀 있었다.) - 전공자에게는 프로젝트 관련 질문 위주 (이 프로젝트에서 니가 기여한 부분이 어디냐? 이런 포멧. 그 러자 그 질문 받은 지원자가 가짜 뉴스를 판별하는 프로그램을 개발했습니다! 라고 답하던데 그 말 들은 면접관은 그거를 니가 했으면 넌 구글에 가 있어야 한다고 했었다. 이후 안보이던데 떨어진 모양,"프로그램, 로그"
1. 프로젝트 경험은 무엇인가요 2. DB 정규화에 대해 설명해보시오 3. React 사용경험에 대해 말하시오,정규화
"SQL 관련하여 기본 쿼리 질문과 C#, JAVA 의 기본 문법을 질문함",SQL
join 할줄알아요? 라고 물어보는데 너무 성의없었고 물어보는 사람 책임님이였는데 그팀 참 힘들것같 았음,join
웹개발 지원한이유는 데이터베이스관련해서 사용해본적있나,데이터베이스
"관련 프로젝트 경험,도메인지식과 back end 아키텍쳐 설계, 팀 리딩경험",도메인
1. 10년뒤 어떤개발자가 되어있을것 같나요? 2. js 비동기 관련질문 3. 데이터베이스 관련질문,데이터베이스
1. 자기소개와 입사 지원 동기 2. HTTP Method 3. 쿠키와 세션 차이점,세션
프로세스 및 DB구조에 대한 질문 지원 분야에 대한 향 후 발전 가능성 질문,프로세스
1. node와 spring 차이점 2. 파일 저장 시 보안관련 3. 트랜잭션 과정,"파일, 트랜잭션"
"프로젝트, 데이터베이스 관련,cs 관련 지식",데이터베이스
야근에대해서 어떻게 생각 하는가? 회계프로그램은 잘 알고 있는가?,"프로그램, 로그"
"취미, 성격의 장단점 회사에서 힘든일이 있었는지, 있었다면 어떻게 극복했는지 출퇴근시간 어느정도까지 가능한지 사용하고있는 프로그램 본인의 프로그래밍 수준 합격이후 출근날짜","프로그램, 로그"
고객에게 지원하는 기술지원과정에 대한 의미를 설명하라. 3way hand shake의 과정을 설명하라. 백업의 의미와 그 과정을 설명하라.,백업
DB실력에 대한 질문을 많이함 프로시저 트리거 인덱스 등 사용경험,트리거
1. index 설명 2. 캐시&쿠키&세션 설명 3. promise 설명,"index, 세션"
스프링 프로세스 관련 질문 말곤 기억안남 답변은 아는대로 쭉 말함,프로세스
기본적인 자바스크립트 질문 진행했던 프로젝트에 대한 질문 SQL 쿼리에 대한 질문,SQL
"제가 했던 프로젝트에 관한 질문, 우리 회사 프로그램이 어떤것이 있는줄 아느냐, 자바 스프링등을 물어보셨네요","프로그램, 로그"
가족관계를 물어보거나 결혼 유무를 물어보는 등의 질문을 받음,관계
"1. 서버 이중화와 고가용성, Load Balancing 에 대해 아는대로 말해보라. 2. Spring Framework 에서 annotation이 어떤 역할을 한다 생각하는가? DI란 무엇이고 Spring Framework에서 DI를 함으로써 어떤 장점을 얻을 수 있는가? 3. 기본적인 리눅스 명령어 질문 3-1) su, su - 차이점 3-2) chmod 3-3) tar 명령어 및 쉘 프로그래밍 기초 지식 3-4) curl에 대한 질문 몇가지 4. Rest Api & MSA에 대한 질문 4-1) Rest Api 에 대해 아는대로 말해보라 4-2) Rest Api를 이용하여 서로 다른 기관 혹은 서버끼리 통신할때 어떤식으로 보안을 유지할 수 있을 지 설명하라 - 잘 모르지만 ssl인증서의 serial number, 각 기관끼리의 사전에 정의된 인증방식(토큰 등)을 통해 보 안을 유지할 수 있을거라 대답 4-3) 4-2에서 ssl 인증서를 언급하였는데 SSL 인증의 원리를 알고 있는가? 5. 기본적인 쿼리 질문 5-1) 계층쿼리(connect by) 5-2) Pivot 5-3) Rank(), RowNumber() over Partiton by ~ 6. 코딩 테스트(손코딩) 6-1) 자바 스크립트 promise함수 빈칸 완성 6-2) 기초적인 jquery 문제 - 체크박스 제어, 클릭이벤트등 html보고 코딩하면 됨 6-3) 쿼리코딩 (Cube 함수): 이거 못품 ㅡㅡ;;","로그, 함수"
플젝 설명이랑 거기서 뭘 했는지 당시 신입 면접이었기 때문에 취성패 프로그램에서 했던 플젝에 대해 설명했었고 뭐 특정 기술에 대한 수수께끼 질답같은건 없었어요 대신 이력서에 써놓은 일화는 물어봤는데 재치있게 대답하니까 셋 다 웃고 그런 화기애애한 분위기,"프로그램, 로그"
"회계프로그램을 만들다보니 세법에관한질문이 많았슴 무슨신고를 하였는지 채용방식 개인면접 발표시기 14일 후 ""연락받고 갔고 3대1면접 전회사에서 무슨업무를 하였는지 위주로 질문"" 합격 보통 도움이 돼요 0","프로그램, 로그"
정보처리 기사 자격증 없으신 분들은 좀 안좋게 보셨던거 같아요.,정보
알고리즘을 공부한 이유는? 기존에 있는 것이 아닌 UI를 직접 제작해본 경험이 있나요? 프로젝트를 할 때 리더인지 팔로우인지?,알고리즘
팀프로젝트 관련질문 알고리즘 관련질문 스크립트 관련질문,알고리즘
"분위기는 꽤 딱딱했던 것 같고 합격 발표 후 채용 기간이 오래 걸렸어요. 액 3000억원 이상 씨제이올리브네트웍스(주) 포지션 49개 채용 중 3 엘티삼보(주) - 기업 랭킹 채용 뉴스 연봉 이직 뽐뿌 오는 날 5분 완성, 1년 간 기업정보가 무료!    제휴 대학 서비스  회사소개 이용약관 개인정보처리방침 커뮤니티가이드라인 모바일 버전 공지사항 광고 및 제휴문의 고객 문의 FAQ | | | | | | | | (주)브레인커머스 서울특별시 강남구 테헤란로 509 엔씨타워 I, 10층 | 대표   황희승, 윤신근 | 개인정보보호관리자   윤신근 사업자등록번호   120-87-92182 | 통신판매업 신고번호   제2014-서울강남-02942호 | 유료 직업소개사업 등록번호   (국내) 제2017-3220163-14-5-00046호 대표번호   1644-5641 (10:00~17:00 / 매월 마지막 금요일 09:00~13:00 / 주말 및 공휴일 휴무) | 대표이메일 : customer_service@jobplanet.co.kr ©Jobplanet. All rights reserved. 41 42 43 44 45","정보, 번호"
"기본적인 sql, 개발자의 마음가짐, 우리나라와 4차 산업형명의 관계 등등.",관계
"따로 없고 그냥 프로그래밍 기초에 대해서 물어본듯함.... 발표시기 30일 후 ""별거 안물어봄.. 그냥 정말 기초적인 부분맘 불어본듯???"" 합격 부정적 도움이 돼요 0",로그
경력간 진행한 프로젝트 위주의 질문 어떤걸했었고 잘했다 생각한것과 못했다고 생각한것 mvc 두가지 모델의 차이점 전직장 퇴사사유 정도??,모델
- OUTER JOIN의 종류와 각각의 특징 및 차이점 - C# 코딩 테스트 - 하게 될 일이 어떤 일이라고 예상하는지 아는대로 답변.,"ER, JOIN, IN"
"알고리즘 문제, 언어 차이, 적응력 등 다양한 질문들을 있었고 이에대하여 자신있게 대답했습니다.",알고리즘
직무 관련 얼마나 아는지(파악하는 질문) 업무 프로세스와 기능을 알고있는지 자격증 왜 땄는지 성격의 장단점 대인관계 어려운 점 있는지 스트레스 해소법,"프로세스, 관계"
자기소개 프로그래밍 경험 나열해보세요 프로그래밍을 왜 시작했나요 기술에 대한 질문,로그
"자바스크립트란 세션이란 말을 들어봤는가 어떤의미로 들어봤는가 간단한 코딩테스트 발표시기 30일 후 ""실제로 개발에 필요한 내용들에 관한 질문을 받음. 그리고 그렇게 면접을 보는것에 대해 긍정적으로 생각함"" 합격 긍정적 도움이 돼요 0",세션
네트워크를 잘 할수 있는 이유 네트워크 기본 지식 물어봄,네트워크
"성격을 나타낸다면? 인터페이스에 대해서 설명해보세요. 자신이 진행한 프로젝트에 대해서 말해보세요. ""기술 + 임원 면접이였음. 면접 마지막에 언제부터 근무할 수 있냐고 물음 (대답 : 언제든지 가능) 집이 멀어도 괜찮냐고 물었음. (대답 : 괜찮) 최종 합격 메일 오고 3일 뒤 출근이였음."" 111퍼센트(주) [111퍼센트] 1인 개발자 모집 경력무관, Unity, 유니티 합격보상 100만원  (주)자비스앤빌런즈 [대규모 채용] Backend Engineer 3 ~ 20년, java, Spring 합격보상 100만원  라이언앤 [경력] J 근제 도 3 ~ 5년, ja 액 3000억원 이상 (주)우아한청년들 포지션 0개 채용 중 3 엘티삼보(주) - 기업 랭킹 채용 뉴스 연봉 이직 뽐뿌 오는 날 5분 완성, 1년 간 기업정보가 무료!    제휴 대학 서비스",정보
"거래의 8요소, 더존이 하는일, 더존의 프로그램 문의","프로그램, 로그"
"0] 자기소개 1] 팀프로젝트 수행경험, 어떤 role을 했는지, 뭐가 힘들었는지 등등 무난한 질문 2] mvc 패텬, 자료구조, 정렬 기초 등등 전공 관련 무난한 것 질문 3] 리눅스 접해봤는지, 접해봤으면 컴파일 경험 있는지 등등","role, 파일"
"간단한 프로그래밍관련 질문, 동료들과의 협업에 대한 의견 및 갈등해소방법 등 까다로운 질문은 없었 음",로그
"Java, Spring, Html, Css, Js, db 다룰줄 아는지? 다룰수 있다면 수준은 어느정도? 학교에서 전공이 무엇인지? 경험했던 졸업작품 또는 프로젝트는? ""면접날짜 이전 서류합격여부 통보는 대략 일주일 안으로 이루어진것같음."" (주)코드박스 [200억 ↑투자, 두나무 계열사] 소프트 웨어 엔지니어 3 ~ 10년, python, react, graphql, typescript, Django fra…  (주)트레드링스 Back-end 개발 상시 채용 경력무관, java, Spring, SQL, java spring 백엔드  리디(주) 백엔드 7 ~ 12년, 합 액 3000억원 이상 (주)솔루엠 포지션 2개 채용 중 2 코이즈(주) - 기업 랭킹 채용 뉴스 연봉 이직 뽐뿌 오는 날 5분 완성, 1년 간 기업정보가 무료!    제휴 대학 서비스  학교 취업지원 센터","SQL, 정보"
